number,value,datetime_start,datetime_complete,duration,params_gamma_1,params_gamma_2,params_lambda,params_lr,params_n_clusters,params_n_points,params_optimizer,params_reg_lambda,params_reg_type,params_tanh_x,params_use_tanh,state
194,52.959999999999994,2025-01-20 07:20:32.931513,2025-01-20 07:22:58.190059,0 days 00:02:25.258546,1.1265547120460362,1.6342052002433638,0.41139329308389466,0.054630222342687176,65,7,Adam,0.0005599750209364869,1,0.8992410554387705,True,COMPLETE
195,53.04,2025-01-20 07:20:58.323316,2025-01-20 07:22:23.479655,0 days 00:01:25.156339,1.1253463355871687,1.6276023493384892,0.4207207428105946,0.0542739219093659,65,7,Adam,0.0005961092702097108,1,1.0671912837714284,True,COMPLETE
196,52.83,2025-01-20 07:22:23.547053,2025-01-20 07:23:56.851817,0 days 00:01:33.304764,1.0977999915739702,1.6972330617603761,0.4229412409181425,0.05597083319699247,69,7,Adam,0.0005895158177914357,1,1.0189085876786619,True,COMPLETE
197,52.910000000000004,2025-01-20 07:22:58.258169,2025-01-20 07:24:53.592743,0 days 00:01:55.334574,1.1106179209703673,1.7046939717272838,0.4140672688828318,0.05668247826271037,67,7,Adam,0.0006380324662621897,1,1.0311608169795017,True,COMPLETE
198,52.59,2025-01-20 07:23:56.908228,2025-01-20 07:25:49.129927,0 days 00:01:52.221699,1.1337339509701816,1.6432004893129515,0.41351799014537394,0.04949501615256852,67,9,Adam,0.0009292565663762666,1,2.1833501458182996,True,COMPLETE
199,52.78,2025-01-20 07:24:53.665979,2025-01-20 07:26:44.596959,0 days 00:01:50.930980,1.1208845009976254,1.7348360074773934,0.46343579419075653,0.050793361841190016,68,9,Adam,0.0009416897716187519,1,0.8161068071402489,True,COMPLETE
200,52.83,2025-01-20 07:25:49.189505,2025-01-20 07:27:28.424894,0 days 00:01:39.235389,1.176037677088035,1.7796134352316664,0.4695174420296868,0.07902072259761238,65,7,Adam,0.0006285978004311012,1,0.7936859799244322,True,COMPLETE
201,50.74999999999999,2025-01-20 07:26:44.685953,2025-01-20 07:28:15.488389,0 days 00:01:30.802436,1.1779951896189318,1.7720269878366202,0.7011375606724066,0.08102906746958177,65,7,Adam,0.0004931904517787227,1,1.3405387505853572,True,COMPLETE
202,52.839999999999996,2025-01-20 07:27:28.489824,2025-01-20 07:29:16.620915,0 days 00:01:48.131091,1.0828825562742683,1.6978172179809727,0.4161694978645014,0.05728443382888745,64,7,Adam,0.0007715447040610023,1,1.4198477617034284,True,COMPLETE
203,52.68000000000001,2025-01-20 07:28:15.578504,2025-01-20 07:30:07.455221,0 days 00:01:51.876717,1.1187131344994232,1.6991149855425376,0.4135404356418738,0.045938983817463176,63,8,Adam,0.0007580915397766691,1,0.4089739058232348,True,COMPLETE
204,52.75,2025-01-20 07:29:16.680699,2025-01-20 07:30:44.001562,0 days 00:01:27.320863,1.1153980013308606,1.6384386375731692,0.43142100131008154,0.04784189754407637,63,8,Adam,0.0007003155193840528,1,0.3032669638501695,True,COMPLETE
205,52.849999999999994,2025-01-20 07:30:07.542718,2025-01-20 07:31:59.177380,0 days 00:01:51.634662,1.198115982782862,1.64654690918052,0.431863051085459,0.06771388952990515,62,6,Adam,0.0006131421775848655,1,2.103603435158453,True,COMPLETE
206,52.910000000000004,2025-01-20 07:30:44.051247,2025-01-20 07:34:02.364625,0 days 00:03:18.313378,1.1953841501265716,1.671430986503499,0.431551465792646,0.05260428903271926,70,6,Adam,0.0009120348378334592,1,2.151299997704715,True,COMPLETE
207,52.980000000000004,2025-01-20 07:31:59.266189,2025-01-20 07:33:47.519473,0 days 00:01:48.253284,1.1702342358912339,1.6861212685057332,0.4366455679580938,0.052418995767496014,67,6,Adam,0.0009174977019603858,1,0.7902564686373257,True,COMPLETE
208,52.92,2025-01-20 07:33:47.594237,2025-01-20 07:35:31.358532,0 days 00:01:43.764295,1.1671841676726835,1.6807098551619166,0.45275846824521604,0.03746789157993989,67,6,Adam,0.0009459027521089282,1,0.8615761134813005,True,COMPLETE
209,52.83,2025-01-20 07:34:02.434047,2025-01-20 07:35:33.595423,0 days 00:01:31.161376,1.023308134842351,1.6822760762992948,0.45721480349341687,0.052435353566911,70,7,Adam,0.000976909264859822,1,0.8621208988307859,True,COMPLETE
210,52.96999999999999,2025-01-20 07:35:31.439298,2025-01-20 07:37:50.432726,0 days 00:02:18.993428,1.1572755941763626,1.8543219318464166,0.4623408416569479,0.03871624895863035,69,6,Adam,0.0009677320078764085,1,0.8947562655422472,True,COMPLETE
211,52.87,2025-01-20 07:35:33.647419,2025-01-20 07:37:11.667355,0 days 00:01:38.019936,1.1580618174307598,1.82783327315388,0.41061959027746486,0.040765927565802614,67,6,Adam,0.001180922019058256,1,1.1951153260535934,True,COMPLETE
212,52.900000000000006,2025-01-20 07:37:11.718933,2025-01-20 07:38:56.243711,0 days 00:01:44.524778,1.1643557591699443,1.85096362601118,0.4149165156218173,0.03798926201358626,67,6,Adam,0.0011954291633659644,1,1.1787833560404006,True,COMPLETE
213,52.71,2025-01-20 07:37:50.521196,2025-01-20 07:39:45.767413,0 days 00:01:55.246217,1.0763551519488133,1.9883326008508444,0.4310916829183887,0.035636318149990465,68,8,Adam,0.0009919000761729638,1,0.7117195415100736,True,COMPLETE
214,52.739999999999995,2025-01-20 07:38:56.305886,2025-01-20 07:40:44.471100,0 days 00:01:48.165214,1.074047630006887,1.9271567802300986,0.43023216994686364,0.03751860102795272,75,8,Adam,0.0009506633634204161,1,0.6976490313421436,True,COMPLETE
215,52.769999999999996,2025-01-20 07:39:45.845675,2025-01-20 07:41:21.678204,0 days 00:01:35.832529,1.2044218656439065,1.6679646945172422,0.40937856597490285,0.037684269307065275,70,7,Adam,0.0008870964421705985,1,1.0928105309667635,True,COMPLETE
216,52.81,2025-01-20 07:40:44.530698,2025-01-20 07:42:24.464062,0 days 00:01:39.933364,1.21067170106757,1.898283975035638,0.4143974590474222,0.06009871451202756,69,7,Adam,0.00047294478749198903,1,0.9990516153261196,True,COMPLETE
217,53.080000000000005,2025-01-20 07:41:21.754750,2025-01-20 07:43:38.197573,0 days 00:02:16.442823,1.2280504789825857,1.8332089774611917,0.4785188170498427,0.06026508928191806,72,6,Adam,0.0005112975818038517,1,1.9812574146191193,True,COMPLETE
218,52.88,2025-01-20 07:42:24.523581,2025-01-20 07:44:12.685604,0 days 00:01:48.162023,1.1456482632430591,1.8439515487208216,0.4769523103463149,0.049361668257653826,66,6,Adam,0.001468915585764596,1,1.9097353232184526,True,COMPLETE
219,53.0,2025-01-20 07:43:38.283443,2025-01-20 07:45:36.661448,0 days 00:01:58.378005,1.2380901007379939,1.7534129964574283,0.47944109392829964,0.033034702552377504,73,6,Adam,0.0005424550964253702,1,2.0900289709039592,True,COMPLETE
220,52.839999999999996,2025-01-20 07:44:12.742626,2025-01-20 07:45:43.197558,0 days 00:01:30.454932,1.1364565714255208,1.897677434098835,0.4832338344435503,0.04023946577973735,73,6,Adam,0.0013687110700519186,1,2.1105668888197533,True,COMPLETE
221,52.54,2025-01-20 07:45:36.744894,2025-01-20 07:47:46.567556,0 days 00:02:09.822662,1.12296163744527,1.8702241522905576,0.5049671926629341,0.033937765513998866,73,9,Adam,0.0003225587930583909,1,2.1568908841456884,True,COMPLETE
222,52.83,2025-01-20 07:45:43.248310,2025-01-20 07:47:24.553117,0 days 00:01:41.304807,1.1864471632001885,1.8381570826840994,0.5040438880006769,0.031707672196359865,71,6,Adam,0.0005332309038647657,1,2.29132553477404,True,COMPLETE
223,52.87,2025-01-20 07:47:24.602864,2025-01-20 07:48:47.672582,0 days 00:01:23.069718,1.130630298462422,1.7510840160803953,0.4791419892677675,0.04551301630015656,66,7,Adam,0.0016174788714351093,1,2.511763049041909,True,COMPLETE
224,52.849999999999994,2025-01-20 07:47:46.659245,2025-01-20 07:50:40.633298,0 days 00:02:53.974053,1.2200706897727152,1.7666511057674237,0.4849579113531354,0.04740978928715135,67,7,Adam,0.0016055381537104538,1,1.7622440807294337,True,COMPLETE
225,52.87,2025-01-20 07:48:47.747900,2025-01-20 07:50:25.601870,0 days 00:01:37.853970,1.2195004671219358,1.8169840936529442,0.4603125220223536,0.04830270381213205,67,6,Adam,0.0011044040912976513,1,1.745782114218716,True,COMPLETE
226,52.78,2025-01-20 07:50:25.660014,2025-01-20 07:52:11.603016,0 days 00:01:45.943002,1.2404053769218928,1.8526270487600798,0.4511474970355867,0.06576108890568642,71,8,Adam,0.0005573839019458066,1,1.7780559197385528,True,COMPLETE
227,52.690000000000005,2025-01-20 07:50:40.714996,2025-01-20 07:52:33.002002,0 days 00:01:52.287006,1.1660510855293138,1.861508883430142,0.442376123162791,0.06574473309730275,71,8,Adam,0.0005877821936318736,1,0.5036428290987055,True,COMPLETE
228,52.94,2025-01-20 07:52:11.663829,2025-01-20 07:53:58.372330,0 days 00:01:46.708501,1.1601694196675132,1.7986335148252846,0.4704565743067763,0.03894196561772333,69,6,Adam,0.0006974617353532364,1,0.48387972316838435,True,COMPLETE
229,52.949999999999996,2025-01-20 07:52:33.074116,2025-01-20 07:54:23.639635,0 days 00:01:50.565519,1.0835879644859352,1.7277515973854491,0.4749846772544933,0.0591813407710753,68,6,Adam,0.0011356753273435152,1,1.0236952155087724,True,COMPLETE
230,52.980000000000004,2025-01-20 07:53:58.428591,2025-01-20 07:55:54.511369,0 days 00:01:56.082778,1.1896641933466967,1.7281380315627777,0.438067680017721,0.04139742462126636,69,5,Adam,0.0004607461212303796,1,0.5233131010556207,True,COMPLETE
231,52.800000000000004,2025-01-20 07:54:23.719482,2025-01-20 07:56:21.905217,0 days 00:01:58.185735,1.0446162435016906,1.7988559719572557,0.4682761069703441,0.03776139151209783,69,7,Adam,0.0004478662689591148,1,0.975788629056805,True,COMPLETE
232,52.87,2025-01-20 07:55:54.565080,2025-01-20 07:57:41.110260,0 days 00:01:46.545180,1.0972638882598509,1.7945409799328864,0.46015691342040926,0.0419606210669852,69,5,Adam,0.0007697414993716044,1,0.971817594262181,True,COMPLETE
233,52.81,2025-01-20 07:56:21.999245,2025-01-20 07:58:27.521073,0 days 00:02:05.521828,1.0995982366284829,1.7130536188212426,0.4507918478487808,0.04108963194792768,69,5,Adam,0.0007256373913739769,1,0.5422396787185346,True,COMPLETE
234,52.78,2025-01-20 07:57:41.167121,2025-01-20 07:59:14.572829,0 days 00:01:33.405708,1.1904145214572415,1.7246451698431609,0.5232650987134206,0.04096642376732359,68,6,Adam,0.0007203423943741825,1,0.548229129170398,True,COMPLETE
235,53.09,2025-01-20 07:58:27.618461,2025-01-20 08:00:16.117861,0 days 00:01:48.499400,1.2484236058882905,1.7319443983439091,0.4954989544074083,0.05866261920545341,72,6,Adam,0.0004868149168924894,1,0.24546365605367237,True,COMPLETE
236,52.94,2025-01-20 07:59:14.628653,2025-01-20 08:00:48.063442,0 days 00:01:33.434789,1.2378200784991438,1.7508221592731874,0.49401730734026755,0.05618144853364914,66,6,Adam,0.0004180460311367334,1,0.15639225596928896,True,COMPLETE
237,53.0,2025-01-20 08:00:16.191535,2025-01-20 08:02:18.016495,0 days 00:02:01.824960,1.239318491088417,1.689348248939095,0.490198857470361,0.061629505278782575,72,7,Adam,0.0003886365898955082,1,0.3308538356812232,True,COMPLETE
238,52.96999999999999,2025-01-20 08:00:48.130677,2025-01-20 08:04:24.968951,0 days 00:03:36.838274,1.2547292148615146,1.751611188795468,0.49481167284305155,0.05909569788950736,72,7,Adam,0.000477626592299216,1,0.21875105053464194,True,COMPLETE
239,52.959999999999994,2025-01-20 08:02:18.112457,2025-01-20 08:04:24.980972,0 days 00:02:06.868515,1.2538969185470037,1.7634865847112762,0.48541884673085156,0.06905501331571245,72,7,Adam,0.00043665828289304713,1,0.14677341718440418,True,COMPLETE
240,52.75,2025-01-20 08:04:25.041534,2025-01-20 08:06:09.578158,0 days 00:01:44.536624,1.2540031294869927,1.7498357060625043,0.5161832084760991,0.07098248135106221,74,8,Adam,0.00039859369168693883,1,0.22177044629483794,True,COMPLETE
241,52.59,2025-01-20 08:04:25.068240,2025-01-20 08:06:21.648349,0 days 00:01:56.580109,1.2599977711952408,1.7499058039685456,0.5160957716981615,0.0624467987200245,73,8,Adam,0.00026984057504399114,1,0.18432608678120704,True,COMPLETE
242,53.04,2025-01-20 08:06:09.649148,2025-01-20 08:07:53.004026,0 days 00:01:43.354878,1.2603705684569466,1.7501832261934227,0.4984908791980094,0.061583167266462506,74,7,Adam,0.00030814287609713203,1,0.1370140828819023,True,COMPLETE
243,52.88,2025-01-20 08:06:21.720363,2025-01-20 08:08:10.137160,0 days 00:01:48.416797,1.2194667770720595,1.7885858258218044,0.482680539761871,0.0575806342081138,71,7,Adam,0.00036855636593998787,1,0.10911489605655775,True,COMPLETE
244,53.0,2025-01-20 08:07:53.057891,2025-01-20 08:09:19.568683,0 days 00:01:26.510792,1.2496164210909637,1.7887919371925551,0.4948360128305748,0.05941841826766485,72,7,Adam,0.00023253260285092522,1,0.1790336343625423,True,COMPLETE
245,52.910000000000004,2025-01-20 08:08:10.214318,2025-01-20 08:09:52.803684,0 days 00:01:42.589366,1.2493688979265423,1.7407371957919548,0.5012414609168981,0.08360999527489237,75,7,Adam,0.0004548572140046532,1,0.4249131545707467,True,COMPLETE
246,52.89,2025-01-20 08:09:19.627097,2025-01-20 08:11:08.210180,0 days 00:01:48.583083,1.2523003769351886,1.731898342192638,0.49547541077859053,0.08838550712600568,75,7,Adam,0.00025976824905618205,1,0.43839652053776756,True,COMPLETE
247,52.66,2025-01-20 08:09:52.897591,2025-01-20 08:11:30.163499,0 days 00:01:37.265908,1.2609760182979113,1.7804455353113466,0.5053250401727164,0.07263298621692821,72,9,Adam,0.0003237142176870733,1,0.13259882601774267,True,COMPLETE
248,52.71,2025-01-20 08:11:08.271964,2025-01-20 08:12:35.814420,0 days 00:01:27.542456,1.2657370759825504,1.8058130978384794,0.4939696688044288,0.07157961748860563,71,9,Adam,0.0002257681066204821,1,0.11189307208750415,True,COMPLETE
249,52.39,2025-01-20 08:11:30.236612,2025-01-20 08:13:17.357654,0 days 00:01:47.121042,1.272142258913668,1.8171508451770866,0.5308381097531055,0.06123712345638927,72,9,Adam,0.00018613202631462313,1,0.7050615517665219,True,COMPLETE
250,52.849999999999994,2025-01-20 08:12:35.872813,2025-01-20 08:14:36.275432,0 days 00:02:00.402619,1.2136481814756213,1.7055915737490854,0.5241394477440928,0.06700349166620288,72,7,Adam,0.00032856921617132424,1,0.6478732067212861,True,COMPLETE
251,52.949999999999996,2025-01-20 08:13:17.456570,2025-01-20 08:15:22.884159,0 days 00:02:05.427589,1.1993935654459122,1.705931314531603,0.49156243322773857,0.06013464746609532,73,7,Adam,0.00040758248100299874,1,0.7132077359037888,True,COMPLETE
252,52.04,2025-01-20 08:14:36.351512,2025-01-20 08:16:17.463095,0 days 00:01:41.111583,1.2334238751261557,1.7670597948982028,0.4815727742355388,0.05886072533815438,74,14,Adam,0.0004214199778679038,1,0.42039919281810967,True,COMPLETE
253,52.82,2025-01-20 08:15:22.982706,2025-01-20 08:17:20.454427,0 days 00:01:57.471721,1.2279255999212069,1.7640160578420692,0.4925950735484908,0.06134449896205567,74,8,Adam,0.00041596324475864785,1,0.5037453549433175,True,COMPLETE
254,52.43,2025-01-20 08:16:17.533688,2025-01-20 08:17:46.511467,0 days 00:01:28.977779,1.1875220314181247,1.6882969539807133,0.5498526014056292,0.05203944357943411,73,8,Adam,0.000482730882619747,1,0.40270579476828844,True,COMPLETE
255,52.910000000000004,2025-01-20 08:17:20.539865,2025-01-20 08:19:47.141325,0 days 00:02:26.601460,1.1871923896883232,1.7300568567062926,0.5125547722390641,0.05087724501215296,73,6,Adam,0.0005021041136368935,1,0.826679917937825,True,COMPLETE
256,52.769999999999996,2025-01-20 08:17:46.594361,2025-01-20 08:19:30.052009,0 days 00:01:43.457648,1.1884927302793353,1.7326205127972676,0.5129790395682379,0.05139454174389225,70,6,Adam,0.00035800940907596484,1,0.7592420025204161,True,COMPLETE
257,53.06999999999999,2025-01-20 08:19:30.109387,2025-01-20 08:21:10.759145,0 days 00:01:40.649758,1.2754789427814506,1.68040034015647,0.4927188505184104,0.06417294683765913,72,5,Adam,0.0005033776687215549,1,0.8272630751729437,True,COMPLETE
258,52.86,2025-01-20 08:19:47.219339,2025-01-20 08:21:32.369968,0 days 00:01:45.150629,1.2759218034722435,1.8035156148791371,0.491861789744631,0.06805458320867484,69,5,Adam,0.0003120037185152371,1,0.321043248089557,True,COMPLETE
259,53.02,2025-01-20 08:21:10.833283,2025-01-20 08:22:59.750963,0 days 00:01:48.917680,1.281477060748813,1.8041416705566158,0.4884635650213453,0.07532659397553744,72,5,Adam,0.0005293910872200602,1,0.34758895200390055,True,COMPLETE
260,53.1,2025-01-20 08:21:32.447654,2025-01-20 08:23:19.771115,0 days 00:01:47.323461,1.2744017016409774,1.6617683133101373,0.47696018671099616,0.061600521846891486,72,5,Adam,0.0005217174403113734,1,1.405914719203866,True,COMPLETE
261,52.7,2025-01-20 08:22:59.812835,2025-01-20 08:24:51.990109,0 days 00:01:52.177274,1.2877214256800094,1.7697142538310398,0.5332762136564378,0.07877744848837759,72,7,Adam,0.0005209226761482547,1,0.3092794384136237,True,COMPLETE
262,52.790000000000006,2025-01-20 08:23:19.862238,2025-01-20 08:25:14.897683,0 days 00:01:55.035445,1.2737581205269883,1.917139736313299,0.5393599489651663,0.07245597353160765,72,5,Adam,0.0005587386925904649,1,1.4650590182613867,True,COMPLETE
263,52.87,2025-01-20 08:24:52.044326,2025-01-20 08:26:53.866801,0 days 00:02:01.822475,1.2819924904075064,1.9435581844832666,0.47498607631394885,0.06276763533664556,74,5,Adam,0.0005343482131669101,1,0.6112758214879173,True,COMPLETE
264,52.89,2025-01-20 08:25:14.982052,2025-01-20 08:27:10.806444,0 days 00:01:55.824392,1.2226855994441228,1.6887893208921654,0.4757985182377829,0.06543885175800272,74,7,Adam,0.00047696409578429583,1,0.6339442587509058,True,COMPLETE
265,52.910000000000004,2025-01-20 08:26:53.921766,2025-01-20 08:28:22.807457,0 days 00:01:28.885691,1.230842335360164,1.82772925078024,0.47468122946485847,0.09687615919206889,71,7,Adam,0.00028627234199367395,1,0.9365329657547437,True,COMPLETE
266,47.68,2025-01-20 08:27:10.881440,2025-01-20 08:28:40.511747,0 days 00:01:29.630307,0.2682965706140177,1.820589697500245,0.49687680332646084,0.09003037293515546,71,7,Adam,0.00026812185679398327,1,0.9575191363785085,True,COMPLETE
267,52.88,2025-01-20 08:28:22.869983,2025-01-20 08:30:14.023069,0 days 00:01:51.153086,1.1412743219347317,1.6645600481075302,0.49741018800011527,0.06251637531543162,71,5,Adam,0.00038481269738867963,1,1.1533222802439624,True,COMPLETE
268,52.790000000000006,2025-01-20 08:28:40.588023,2025-01-20 08:30:36.104396,0 days 00:01:55.516373,1.141121595085836,1.656320052558785,0.5083244712794018,0.07598305846033147,69,5,Adam,0.0003624391610358968,1,3.041106716585373,True,COMPLETE
269,52.800000000000004,2025-01-20 08:30:14.082655,2025-01-20 08:31:39.664679,0 days 00:01:25.582024,1.0660036328703515,1.715994864172392,0.48393622693626126,0.07576920724083182,69,6,Adam,0.0006108991954157498,1,0.31251400494349857,True,COMPLETE
270,50.49,2025-01-20 08:30:36.181135,2025-01-20 08:32:26.731459,0 days 00:01:50.550324,1.1939112239278342,1.7054236767556206,0.4779617000330281,0.0607196465994722,72,25,Adam,0.0005860788200213863,1,0.292997083555681,True,COMPLETE
271,52.75,2025-01-20 08:31:39.726371,2025-01-20 08:33:36.499719,0 days 00:01:56.773348,1.0196424264707065,1.605901026333647,0.46970339184397647,0.05675447736551864,73,8,Adam,0.00044768214146112897,1,1.4003432213833054,True,COMPLETE
272,52.87,2025-01-20 08:32:26.828706,2025-01-20 08:34:41.959310,0 days 00:02:15.130604,1.271459371566324,1.6057918121976094,0.47040627267257074,0.056438593656943606,75,8,Adam,0.0004922631389383033,1,1.3524498638526758,True,COMPLETE
273,52.93,2025-01-20 08:33:36.559217,2025-01-20 08:35:27.421494,0 days 00:01:50.862277,1.2904355360836883,1.7894887448018326,0.4920278432190173,0.06958262936141571,75,6,Adam,0.00023789485645987066,1,0.7145643196924056,True,COMPLETE
274,52.769999999999996,2025-01-20 08:34:42.028741,2025-01-20 08:37:00.546489,0 days 00:02:18.517748,1.0955422998367788,1.7758175190753251,0.5124375330811918,0.06780642015150401,70,6,Adam,0.00022465787567400446,1,0.8289903017385779,True,COMPLETE
275,52.739999999999995,2025-01-20 08:35:27.487924,2025-01-20 08:37:11.459945,0 days 00:01:43.972021,1.0932752135197468,1.6705946757043661,0.5136385277238602,0.048614114105906776,70,5,Adam,0.00032450274536520966,1,0.8472117013830069,True,COMPLETE
276,52.89,2025-01-20 08:37:00.633277,2025-01-20 08:38:39.679940,0 days 00:01:39.046663,1.241260938853631,1.6738748526782627,0.4635185072319658,0.05054830850328823,73,5,Adam,0.00033242695790917606,1,0.5494201018388765,True,COMPLETE
277,52.81,2025-01-20 08:37:11.516252,2025-01-20 08:39:04.973731,0 days 00:01:53.457479,1.2358511290292618,1.7294941378236732,0.4592535616167855,0.05224104097020327,73,7,Adam,0.0001550289833783444,1,1.1495940060519072,True,COMPLETE
278,52.910000000000004,2025-01-20 08:38:39.746231,2025-01-20 08:40:42.208872,0 days 00:02:02.462641,1.2030994293853055,1.8688844485488474,0.48323515677870643,0.043867146627333736,68,7,Adam,0.00015711796451369227,1,1.2166263664313122,True,COMPLETE
279,52.769999999999996,2025-01-20 08:39:05.036882,2025-01-20 08:40:53.727374,0 days 00:01:48.690492,1.1896424091027575,1.8726907097340044,0.4895635676473832,0.04478430155540414,65,7,Adam,0.0006193055458335752,1,4.877175028522505,True,COMPLETE
280,52.629999999999995,2025-01-20 08:40:42.303623,2025-01-20 08:42:49.408412,0 days 00:02:07.104789,1.1394322990194201,1.6293251085662381,0.49314866846015104,0.059980602422515246,65,8,Adam,0.0006513959678841509,1,1.5433875560594945,True,COMPLETE
281,52.96999999999999,2025-01-20 08:40:53.788621,2025-01-20 08:42:31.818766,0 days 00:01:38.030145,1.1483965138459764,1.6345964754990905,0.4529695714413141,0.060010629113464074,71,6,Adam,0.00043183332303348664,1,0.4131978275034007,True,COMPLETE
282,52.739999999999995,2025-01-20 08:42:31.876614,2025-01-20 08:44:14.899801,0 days 00:01:43.023187,1.302871471725054,1.6425023302146964,0.45186042905428864,0.06167164915371463,72,10,Adam,0.0004165139255673211,1,2.4399605070181356,True,COMPLETE
283,52.82,2025-01-20 08:42:49.495744,2025-01-20 08:44:54.894015,0 days 00:02:05.398271,1.3114043275649236,1.6393596314669936,0.4528528443242667,0.0834610085793472,72,9,Adam,0.0003936060405532971,1,0.2873553831446328,True,COMPLETE
284,53.059999999999995,2025-01-20 08:44:14.954842,2025-01-20 08:46:04.232146,0 days 00:01:49.277304,1.3206672978852707,1.5837419266737114,0.45083396722728053,0.06722752368931803,71,5,Adam,0.00047724342042413547,1,0.10883589338578076,True,COMPLETE
