number,value,datetime_start,datetime_complete,duration,params_gamma_1,params_gamma_2,params_lambda,params_lr,params_n_clusters,params_n_points,params_optimizer,params_reg_lambda,params_reg_type,params_tanh_x,params_use_tanh,state
285,52.849999999999994,2025-01-20 08:44:54.973933,2025-01-20 08:48:01.413589,0 days 00:03:06.439656,1.250194402089346,1.5739422045166434,0.5038289841263259,0.05618946138623243,70,5,Adam,0.0004984528278515626,1,0.6283582017356757,True,COMPLETE
286,52.99,2025-01-20 08:46:04.297916,2025-01-20 08:47:44.952574,0 days 00:01:40.654658,1.3355959280686,1.5817171293744066,0.4454956079705862,0.07492181062115286,70,5,Adam,0.0005000759724716301,1,0.28408107953853584,True,COMPLETE
287,52.94,2025-01-20 08:47:45.012068,2025-01-20 08:49:23.263798,0 days 00:01:38.251730,1.3460012679339435,1.5661532898518404,0.44240653471305147,0.07593648066000856,70,4,Adam,0.0005177491336008276,1,1.9530447268802829,True,COMPLETE
288,52.959999999999994,2025-01-20 08:48:01.513597,2025-01-20 08:50:03.563173,0 days 00:02:02.049576,1.3307897059519764,1.5810321800427494,0.4430434926351896,0.0771965646066181,71,4,Adam,0.00047456733334088057,1,1.943343313943567,True,COMPLETE
289,53.1,2025-01-20 08:49:23.312823,2025-01-20 08:51:06.201005,0 days 00:01:42.888182,1.3179480909423746,1.5947306043890122,0.44151769568621685,0.06775914785044213,71,5,Adam,0.00045588677849454077,1,0.1282294560469665,True,COMPLETE
290,53.02,2025-01-20 08:50:03.656262,2025-01-20 08:51:52.747697,0 days 00:01:49.091435,1.2892335305520395,1.5922881161676044,0.4557281775007217,0.06863845029584398,71,5,Adam,0.0005563246713909199,1,0.18879213550238222,True,COMPLETE
291,52.93,2025-01-20 08:51:06.269309,2025-01-20 08:53:21.747354,0 days 00:02:15.478045,1.3207852937162299,1.606105265123223,0.443174978754438,0.06574397032141487,74,5,Adam,0.0005946987381422129,1,0.3820804812405726,True,COMPLETE
292,52.980000000000004,2025-01-20 08:51:52.844201,2025-01-20 08:53:46.303700,0 days 00:01:53.459499,1.3275400207672048,1.6011864214458893,0.45853618219667625,0.08499795573135725,71,5,Adam,0.0003454794040246745,1,0.13516725701755022,True,COMPLETE
293,53.03,2025-01-20 08:53:21.806254,2025-01-20 08:55:03.314418,0 days 00:01:41.508164,1.297400468407437,1.59868581521439,0.4589308750485331,0.08288678005252126,71,5,Adam,0.0003691503853994754,1,0.1000276906969387,True,COMPLETE
294,53.059999999999995,2025-01-20 08:53:46.412158,2025-01-20 08:55:36.471914,0 days 00:01:50.059756,1.2953486016653548,1.5674326401106182,0.45855618540689164,0.0993756922401421,68,4,Adam,0.00030114086474206277,1,0.14887398974988608,True,COMPLETE
295,52.96999999999999,2025-01-20 08:55:03.384881,2025-01-20 08:56:42.585399,0 days 00:01:39.200518,1.349987063781441,1.5427110833738962,0.4635273028868589,0.08859586387668271,68,4,Adam,0.0003148211958891948,1,0.11105543604979265,True,COMPLETE
296,52.93,2025-01-20 08:55:36.586951,2025-01-20 08:57:38.163333,0 days 00:02:01.576382,1.3549757951063282,1.580057142149695,0.4407781966972158,0.09846339964677245,68,4,Adam,0.0003009921989792404,1,0.10030766078524977,True,COMPLETE
297,48.58,2025-01-20 08:56:42.655357,2025-01-20 08:58:18.186309,0 days 00:01:35.530952,1.3142058091138755,1.5791207996606385,0.43329283300772903,0.08902765278508651,70,33,Adam,0.00028107817639441766,1,0.28696259171185734,True,COMPLETE
298,52.959999999999994,2025-01-20 08:57:38.253497,2025-01-20 08:59:35.412476,0 days 00:01:57.158979,1.306523570478437,1.5943970751096808,0.437867004961712,0.08505909093033542,70,4,Adam,0.0002117633305893081,1,0.3490120095393955,True,COMPLETE
299,53.010000000000005,2025-01-20 08:58:18.261317,2025-01-20 09:00:06.436567,0 days 00:01:48.175250,1.2968482692891738,1.6043733678706484,0.45373216977953146,0.0788804750510493,71,4,Adam,0.00035616497814062954,1,0.10168369351501758,True,COMPLETE
300,52.959999999999994,2025-01-20 08:59:35.508266,2025-01-20 09:01:22.290673,0 days 00:01:46.782407,1.3009642973733138,1.528886860896447,0.46014156119256444,0.09729589448773135,74,4,Adam,0.0003620414089269097,1,0.46494044252949607,True,COMPLETE
301,52.959999999999994,2025-01-20 09:00:06.510840,2025-01-20 09:01:39.777229,0 days 00:01:33.266389,1.2919008047870655,1.523349212136852,0.4578339855633834,0.08238120220141158,74,4,Adam,0.00035700175693403907,1,0.11546535438984928,True,COMPLETE
302,52.980000000000004,2025-01-20 09:01:22.384460,2025-01-20 09:03:17.341210,0 days 00:01:54.956750,1.3375459844837212,1.573468755652389,0.45480147127606974,0.07843931138948887,72,5,Adam,0.0002468076384300582,1,0.17400620277055637,True,COMPLETE
303,52.96999999999999,2025-01-20 09:01:39.848583,2025-01-20 09:03:20.760113,0 days 00:01:40.911530,1.3386314699524489,1.5970311121732226,0.46834141159456316,0.08202246249582994,71,5,Adam,0.0001902534777159655,1,0.10221443545187774,True,COMPLETE
304,53.03,2025-01-20 09:03:17.427451,2025-01-20 09:05:17.264842,0 days 00:01:59.837391,1.2866665486073483,1.603973926455856,0.4491869862398839,0.08572252253017136,71,5,Adam,0.0003666974742711164,1,0.5909818038970402,True,COMPLETE
305,53.02,2025-01-20 09:03:20.833096,2025-01-20 09:05:03.944176,0 days 00:01:43.111080,1.2721210210587748,1.610265675768223,0.44627118028583174,0.07503499575583993,71,5,Adam,0.00027021053054335003,1,0.5564289382434465,True,COMPLETE
306,52.88,2025-01-20 09:05:04.013587,2025-01-20 09:06:37.322660,0 days 00:01:33.309073,1.2807676917798607,1.6449897145975256,0.44213400279164095,0.07273255013627272,73,3,Adam,0.00026329958056432794,1,0.5541304243432925,True,COMPLETE
307,52.849999999999994,2025-01-20 09:05:17.358479,2025-01-20 09:06:52.623738,0 days 00:01:35.265259,1.2821862994160453,1.6131911738079265,0.44598218438973436,0.07329172442313092,73,3,Adam,0.00028492135569477777,1,0.5651310602995538,True,COMPLETE
308,52.849999999999994,2025-01-20 09:06:37.393861,2025-01-20 09:08:48.088660,0 days 00:02:10.694799,1.2761461386345343,1.6130437914496405,0.47501311671477414,0.09854782779844673,73,4,Adam,0.0002743032891732467,1,2.756732357931539,True,COMPLETE
309,53.010000000000005,2025-01-20 09:06:52.709604,2025-01-20 09:08:59.956918,0 days 00:02:07.247314,1.3658096993841922,1.499729204004461,0.4701666362279136,0.08574015913219482,75,4,Adam,0.0003540220369180995,1,2.7966140234291768,True,COMPLETE
310,51.89,2025-01-20 09:08:48.148482,2025-01-20 09:10:33.354558,0 days 00:01:45.206076,1.3724263413292623,1.5582998117195601,0.6221047705912297,0.09128177738382444,75,4,Adam,0.00038490326797284376,1,0.3294309184442389,True,COMPLETE
311,52.99,2025-01-20 09:09:00.047778,2025-01-20 09:10:37.162319,0 days 00:01:37.114541,1.3737740738142905,1.4910013749499025,0.4733262556764712,0.08637083493593013,75,4,Adam,0.0003582754378364994,1,2.4337142112997325,True,COMPLETE
312,53.04,2025-01-20 09:10:33.420923,2025-01-20 09:12:05.340528,0 days 00:01:31.919605,1.3612418176560173,1.483776569126047,0.47297952504937774,0.07746341413663495,75,4,Adam,0.0002217115205200414,1,2.6890923379501257,True,COMPLETE
313,52.99,2025-01-20 09:10:37.256279,2025-01-20 09:12:17.508171,0 days 00:01:40.251892,1.3589662287434723,1.5184483958977444,0.47615056508257514,0.08277809543440995,75,4,Adam,0.00019419048284551377,1,2.492341535568653,True,COMPLETE
314,52.93,2025-01-20 09:12:05.412101,2025-01-20 09:13:59.532306,0 days 00:01:54.120205,1.3045661319692161,1.4764984840835926,0.4756074327918122,0.07317431637975184,75,5,Adam,0.00018348751057682537,1,2.6417966461440128,True,COMPLETE
315,52.32,2025-01-20 09:12:17.609388,2025-01-20 09:13:08.946480,0 days 00:00:51.337092,1.3001882090406078,1.4630576431761404,0.48026752956334434,0.0724637108610344,9,5,Adam,0.00012428365391883088,1,3.252182602449345,True,COMPLETE
316,52.839999999999996,2025-01-20 09:13:09.026656,2025-01-20 09:15:10.071555,0 days 00:02:01.044899,1.2735049415481816,1.5124492338210958,0.5277273093245617,0.07566081605955109,72,5,Adam,0.00023153682013204608,1,2.271623952445324,True,COMPLETE
317,52.94,2025-01-20 09:13:59.600616,2025-01-20 09:15:47.842602,0 days 00:01:48.241986,1.2658533796057068,1.5446443427804573,0.521234672970976,0.07806327755018574,72,5,Adam,0.00023544838522984355,1,0.36386474156545934,True,COMPLETE
318,52.769999999999996,2025-01-20 09:15:10.173349,2025-01-20 09:17:11.499911,0 days 00:02:01.326562,1.371018427147159,1.594136007548735,0.505978224776262,0.09080451235904488,71,3,Adam,0.00029848445549842593,1,3.022250709779205,True,COMPLETE
319,49.41,2025-01-20 09:15:47.902623,2025-01-20 09:17:18.672546,0 days 00:01:30.769923,1.369479412607557,1.580202713611894,0.5037767234584095,0.09131002424204368,73,30,Adam,0.000306829741614146,1,1.6501555635882574,True,COMPLETE
320,51.370000000000005,2025-01-20 09:17:11.574364,2025-01-20 09:19:02.933562,0 days 00:01:51.359198,1.3293974317368888,1.5643195141626358,0.46536434931523324,0.06739045154654966,74,19,Adam,0.00032222237639664426,1,0.3285266807492034,True,COMPLETE
321,52.949999999999996,2025-01-20 09:17:18.735421,2025-01-20 09:19:14.090882,0 days 00:01:55.355461,1.329894852589563,1.5612923118577935,0.4603843419568269,0.06729043705514187,74,4,Adam,0.0003973442006915347,1,0.34976175031254797,True,COMPLETE
322,53.04,2025-01-20 09:19:03.033664,2025-01-20 09:21:22.708031,0 days 00:02:19.674367,1.31985988105446,1.5420073212248586,0.4580935643977504,0.06778593017073335,70,4,Adam,0.0003794301129074041,1,0.597730352243953,True,COMPLETE
323,52.980000000000004,2025-01-20 09:19:14.161351,2025-01-20 09:20:42.759210,0 days 00:01:28.597859,1.2499703124427426,1.5099505814746323,0.48540026754347587,0.0992319896504453,71,5,Adam,0.000535360805790697,1,0.6050342602117672,True,COMPLETE
324,53.010000000000005,2025-01-20 09:20:42.827350,2025-01-20 09:22:41.457022,0 days 00:01:58.629672,1.2867991531338736,1.446629545041195,0.45037094051528165,0.0790338166136494,70,4,Adam,0.00043090506964211443,1,0.4942905201992822,True,COMPLETE
325,52.38,2025-01-20 09:21:22.790873,2025-01-20 09:23:40.567865,0 days 00:02:17.776992,1.2889429527317005,1.6640443946830878,0.5642179585761137,0.06733206223327177,73,3,Adam,0.00040525188160049045,1,0.4812160703022095,True,COMPLETE
326,52.99,2025-01-20 09:22:41.514515,2025-01-20 09:24:16.741093,0 days 00:01:35.226578,1.2942426411916488,1.4729283279435135,0.4561502564544377,0.08225998176810512,70,3,Adam,0.0003954950685518228,1,2.822815027384481,True,COMPLETE
327,53.010000000000005,2025-01-20 09:23:40.654097,2025-01-20 09:25:42.177415,0 days 00:02:01.523318,1.2939305731911124,1.4614796494970765,0.45366044403454525,0.0804069134249817,70,3,Adam,0.0003756548166202557,1,2.8535381895629675,True,COMPLETE
328,52.580000000000005,2025-01-20 09:24:16.811318,2025-01-20 09:26:00.073124,0 days 00:01:43.261806,1.8313450356085843,1.4457195211292242,0.43176721858066675,0.08197057330254874,70,4,Adam,0.00044372383359207935,1,0.7944420158853935,True,COMPLETE
329,52.81,2025-01-20 09:25:42.272355,2025-01-20 09:27:30.153641,0 days 00:01:47.881286,1.3878757558402737,1.430837245172761,0.4336913678998378,0.08234811391199129,70,2,Adam,0.0005740154338067665,1,0.7651187254756282,True,COMPLETE
330,52.739999999999995,2025-01-20 09:26:00.133825,2025-01-20 09:27:34.345282,0 days 00:01:34.211457,1.4134245593496508,1.419227585241887,0.4508915340338145,0.08862770432510969,70,2,Adam,0.0005694606703313394,1,2.8934644953366355,True,COMPLETE
331,52.66,2025-01-20 09:27:30.250861,2025-01-20 09:30:04.546332,0 days 00:02:34.295471,1.3165919343028951,1.484828628327385,0.45933483591061036,0.0896821189620685,68,2,Adam,0.0003398765030412673,1,2.8692505455246615,True,COMPLETE
332,52.86,2025-01-20 09:27:34.407774,2025-01-20 09:29:05.738451,0 days 00:01:31.330677,1.321599716301645,1.4782939991169164,0.46737260522935664,0.07055811358251327,69,3,Adam,0.0003057929457104136,1,3.3055353919467594,True,COMPLETE
333,51.4,2025-01-20 09:29:05.795318,2025-01-20 09:30:48.794512,0 days 00:01:42.999194,1.2703064886188264,1.5157794777340066,0.6523012768252477,0.09994403232871887,68,4,Adam,0.00034824399531100856,1,2.5847908125626584,True,COMPLETE
334,53.010000000000005,2025-01-20 09:30:04.663429,2025-01-20 09:31:42.932907,0 days 00:01:38.269478,1.273909807174791,1.528829253493363,0.4280333826741382,0.09924631186003387,75,4,Adam,0.00047826125538642214,1,3.9029330710233934,True,COMPLETE
335,53.059999999999995,2025-01-20 09:30:48.866846,2025-01-20 09:32:24.054284,0 days 00:01:35.187438,1.283616647161012,1.5509488148681014,0.44669505490158595,0.07666378901496687,75,4,Adam,0.8516831921123772,1,1.0660262798820601,True,COMPLETE
336,52.92,2025-01-20 09:31:43.012366,2025-01-20 09:33:57.121172,0 days 00:02:14.108806,1.363070802061602,1.5406162801660948,0.4242170193735816,0.07628212816543516,75,3,Adam,0.00046595856507422834,2,1.0252671476897985,True,COMPLETE
337,51.7,2025-01-20 09:32:24.128205,2025-01-20 09:34:16.220421,0 days 00:01:52.092216,1.342975403971133,1.5473770259712754,0.4416021668795887,0.07497807434625006,75,17,Adam,0.00026203395284523365,2,1.2941334149916557,True,COMPLETE
338,51.73,2025-01-20 09:33:57.221978,2025-01-20 09:35:26.834355,0 days 00:01:29.612377,1.3461927940211533,1.4361871473584265,0.4374824811294642,0.06742969798407757,72,16,Adam,0.11224531847265629,1,1.1164265180302941,True,COMPLETE
339,52.93,2025-01-20 09:34:16.289162,2025-01-20 09:35:49.715894,0 days 00:01:33.426732,1.3020959345475247,1.6126138303602715,0.44814990814836186,0.06627972770740422,72,4,Adam,0.3516096370249606,1,1.1177453719387311,True,COMPLETE
340,52.99,2025-01-20 09:35:26.922172,2025-01-20 09:37:39.885961,0 days 00:02:12.963789,1.301371052628276,1.6075693936894961,0.4522118186375767,0.07934076879063746,71,4,Adam,0.0006593302126962762,1,0.6813328471242432,True,COMPLETE
341,52.800000000000004,2025-01-20 09:35:49.776738,2025-01-20 09:37:36.814408,0 days 00:01:47.037670,1.3028565051690713,1.489068960518324,0.46567603449649414,0.08012358219555021,71,3,Adam,0.0006764930667324306,1,5.9839263687898585,True,COMPLETE
342,52.900000000000006,2025-01-20 09:37:36.871427,2025-01-20 09:39:10.017045,0 days 00:01:33.145618,1.3940759451430333,1.565898465721234,0.44854713972015636,0.08036325859210201,74,4,Adam,0.0003885033463128482,1,0.5958349948033035,True,COMPLETE
343,52.75,2025-01-20 09:37:39.972586,2025-01-20 09:39:32.054653,0 days 00:01:52.082067,1.2376373936034455,1.5732498697736699,0.4048716226112636,0.07026386681825533,73,3,Adam,0.008729649266693734,1,1.53231750697643,True,COMPLETE
344,47.370000000000005,2025-01-20 09:39:10.081228,2025-01-20 09:40:50.653245,0 days 00:01:40.572017,1.2592087619340735,1.5209229948473773,0.40868594659224194,0.06989281374985314,73,39,Adam,0.00029146643672037866,1,1.497627731214874,True,COMPLETE
345,52.83,2025-01-20 09:39:32.159877,2025-01-20 09:41:39.457695,0 days 00:02:07.297818,1.27284283726938,1.5201254107986144,0.4221926684916858,0.08830065646007247,70,2,Adam,0.00027486094169290614,1,3.6590937729969246,True,COMPLETE
346,52.89,2025-01-20 09:40:50.720623,2025-01-20 09:42:21.918295,0 days 00:01:31.197672,1.281565505304958,1.6327567338154316,0.4278432120433498,0.08771993057399538,61,5,Adam,0.0004223911371380319,1,3.6601252467019707,True,COMPLETE
347,53.02,2025-01-20 09:41:39.539435,2025-01-20 09:43:27.659198,0 days 00:01:48.119763,1.3466320583969424,1.6073344396750453,0.4714386299622278,0.06389381585701014,60,5,Adam,0.00041745763355734264,1,0.9016542433423858,True,COMPLETE
348,51.67,2025-01-20 09:42:21.981784,2025-01-20 09:44:19.850118,0 days 00:01:57.868334,1.351077762010048,0.2858040166657356,0.46611531401173417,0.07478534395293311,67,4,Adam,0.0003603927116950228,1,0.9245063496268102,True,COMPLETE
349,52.78,2025-01-20 09:43:27.759879,2025-01-20 09:45:32.869106,0 days 00:02:05.109227,1.36086825158752,1.618573943934896,0.47486737697906006,0.06659849332171286,74,5,Adam,0.0005006469910468481,1,0.8620614371264452,True,COMPLETE
350,52.89,2025-01-20 09:44:19.922896,2025-01-20 09:46:17.343282,0 days 00:01:57.420386,1.4132669821720139,1.61897248009449,0.47780859586870067,0.06490750873122732,60,5,Adam,0.0004918507880037091,1,0.5479483022870852,True,COMPLETE
351,50.33,2025-01-20 09:45:32.962775,2025-01-20 09:46:59.268489,0 days 00:01:26.305714,1.4186156193838027,1.6540951167549658,0.7604162392696687,0.06349116534266483,69,5,Adam,0.000577681291021078,1,4.600409306214994,True,COMPLETE
352,52.94,2025-01-20 09:46:17.396836,2025-01-20 09:48:11.490605,0 days 00:01:54.093769,1.2252335597720205,1.6580437407061714,0.39027915200754926,0.06493818799910005,60,5,Adam,0.000613715301201249,1,4.500950332882434,True,COMPLETE
353,52.23,2025-01-20 09:46:59.367752,2025-01-20 09:48:33.853403,0 days 00:01:34.485651,1.329589367899874,1.5849478465331142,0.5858769165882347,0.07146792843319975,61,5,Adam,0.21983249417381412,1,0.10122676887489519,True,COMPLETE
354,52.99,2025-01-20 09:48:11.563030,2025-01-20 09:50:09.839133,0 days 00:01:58.276103,1.3313972513351995,1.5621720210981003,0.4411690072721477,0.0728496846511354,72,4,Adam,0.000419764318737682,1,1.2530562572649875,True,COMPLETE
355,52.980000000000004,2025-01-20 09:48:33.955410,2025-01-20 09:50:35.633434,0 days 00:02:01.678024,1.3825724178901493,1.543220529518179,0.438964776265703,0.08875645651139963,72,4,Adam,0.00023021414527566583,1,1.2349861212238553,True,COMPLETE
356,52.900000000000006,2025-01-20 09:50:09.897851,2025-01-20 09:51:39.239065,0 days 00:01:29.341214,1.3797782579573479,1.544720321078554,0.4745970453097568,0.08904397352892693,64,6,Adam,0.00021161508336766413,1,0.40061125197307224,True,COMPLETE
357,52.959999999999994,2025-01-20 09:50:35.710405,2025-01-20 09:52:44.576048,0 days 00:02:08.865643,1.2406592082557293,1.6005841645306078,0.4672783988346369,0.0645118152104136,75,6,Adam,0.0001712439635189573,1,0.4853399422040469,True,COMPLETE
358,52.910000000000004,2025-01-20 09:51:39.316630,2025-01-20 09:53:38.026087,0 days 00:01:58.709457,1.2392375020078812,1.591733687888486,0.46155635049948235,0.06185459447617569,74,6,Adam,0.0003290795100622608,1,0.7226577974880577,True,COMPLETE
359,52.739999999999995,2025-01-20 09:52:44.658930,2025-01-20 09:54:25.203657,0 days 00:01:40.544727,1.3118151984405808,1.6315620668733182,0.49201183088689115,0.07438009982804364,73,4,Adam,0.0003303057244612884,1,0.7225554063936293,True,COMPLETE
360,48.16,2025-01-20 09:53:38.092037,2025-01-20 09:54:42.007973,0 days 00:01:03.915936,1.3179065442346636,1.641708928802284,0.8711992369905501,0.07814100966125566,25,4,Adam,0.0007152489304185014,1,0.9267567311284605,True,COMPLETE
361,53.04,2025-01-20 09:54:25.308555,2025-01-20 09:56:57.679126,0 days 00:02:32.370571,1.2726226714800015,1.663147935596774,0.4253436203548888,0.05731126799527432,71,5,Adam,0.0004638228816722985,1,0.27789439750653294,True,COMPLETE
362,52.15,2025-01-20 09:54:42.071212,2025-01-20 09:56:10.055202,0 days 00:01:27.983990,1.2801752880214612,0.42910116077397464,0.4257403430025958,0.056232277058575954,71,5,Adam,0.0005113095514834092,1,0.25236182907303467,True,COMPLETE
363,52.839999999999996,2025-01-20 09:56:10.117514,2025-01-20 09:57:49.136141,0 days 00:01:39.018627,1.21957186088077,1.5952950462627848,0.44937011807453997,0.0999953660836707,69,3,Adam,0.05171786714916116,1,0.10175303623371401,True,COMPLETE
364,52.87,2025-01-20 09:56:57.783723,2025-01-20 09:59:01.606667,0 days 00:02:03.822944,1.2074701318711762,1.6817205388551193,0.39690171690949444,0.05600548882861287,73,5,Adam,0.0005943418454378604,1,0.1126969190912102,True,COMPLETE
365,52.690000000000005,2025-01-20 09:57:49.196749,2025-01-20 09:59:39.963150,0 days 00:01:50.766401,1.3459755007618641,1.670713387361914,0.409530360575278,0.05530163825113155,66,5,Adam,0.0006004820802357664,1,0.32295324922617846,True,COMPLETE
366,52.81,2025-01-20 09:59:01.717990,2025-01-20 10:01:14.173061,0 days 00:02:12.455071,1.3466190667803972,1.6514598712352653,0.4050002851036649,0.05255988572599988,75,6,Adam,0.00027221990547844047,1,0.3170713948048959,True,COMPLETE
367,53.080000000000005,2025-01-20 09:59:40.022204,2025-01-20 10:01:40.296740,0 days 00:02:00.274536,1.2619840651998324,1.6534735376493324,0.4243881602601718,0.06352245737717024,71,6,Adam,0.000126432902011806,1,1.7632311220837966,True,COMPLETE
368,52.51,2025-01-20 10:01:14.250535,2025-01-20 10:02:54.274673,0 days 00:01:40.024138,1.2471136168478918,1.6224454687433572,0.4232433237598451,0.06292919991852942,71,12,Adam,0.5809907866586462,1,1.8847435699339985,True,COMPLETE
369,52.949999999999996,2025-01-20 10:01:40.366139,2025-01-20 10:03:38.637598,0 days 00:01:58.271459,1.256972782264186,1.6883824586378557,0.4244447902458815,0.06193033287013763,68,6,Adam,0.00010484143739748204,1,1.4216512152118177,True,COMPLETE
370,52.71,2025-01-20 10:02:54.381325,2025-01-20 10:04:36.722270,0 days 00:01:42.340945,1.2639042931065498,1.6833856049911025,0.3761217544586564,0.06047083479692174,68,6,Adam,0.9016166285819023,1,7.757821976279479,True,COMPLETE
371,52.88,2025-01-20 10:03:38.704210,2025-01-20 10:05:29.622255,0 days 00:01:50.918045,1.2777587335138365,1.6366264854142714,0.3797288409334975,0.0680599917592248,69,5,Adam,0.9095959729334662,1,7.735377345170406,True,COMPLETE
372,50.59,2025-01-20 10:04:36.810545,2025-01-20 10:06:22.942335,0 days 00:01:46.131790,0.4143500835477796,1.635547007120677,0.3978918779378146,0.06950693131653572,71,5,Adam,0.0001354664258981058,1,1.787482807836956,True,COMPLETE
373,46.760000000000005,2025-01-20 10:05:29.687530,2025-01-20 10:07:18.514519,0 days 00:01:48.826989,1.2173229771389196,1.598531659706467,0.9895632018689557,0.05342194322482165,71,5,Adam,0.00013214341562739037,1,1.6130050258449682,True,COMPLETE
374,51.349999999999994,2025-01-20 10:06:23.025619,2025-01-20 10:08:12.503288,0 days 00:01:49.477669,1.9552707352746872,1.5878441693456125,0.6796557509745181,0.050492321407999176,72,6,Adam,0.00013629956931762222,1,2.07490355011266,True,COMPLETE
375,52.78,2025-01-20 10:07:18.577960,2025-01-20 10:08:50.781875,0 days 00:01:32.203915,1.305475736479517,1.6616435515524783,0.4357337776027504,0.049632612824378454,59,6,Adam,0.00010042077424000359,1,1.086748731168603,True,COMPLETE
376,52.88,2025-01-20 10:08:12.593778,2025-01-20 10:10:09.973171,0 days 00:01:57.379393,1.301500564062737,1.6754844287686472,0.43179691328989084,0.058846123339732805,69,5,Adam,0.0007568957192371047,2,1.050265268510081,True,COMPLETE
