number,value,datetime_start,datetime_complete,duration,params_centroids_new_old_ratio,params_gamma_1,params_gamma_2,params_lambda,params_lr,params_n_clusters,params_n_points,params_optimizer,params_reg_lambda,params_reg_type,params_tanh_x,params_use_tanh,state
361,51.05,2025-01-17 23:35:13.406345,2025-01-17 23:42:42.246983,0 days 00:07:28.840638,0.48749874855165426,1.040667446308081,1.093790974287884,0.26834504224851297,0.051615038477921045,22,2,SGD,0.6146034680931882,0,,False,COMPLETE
362,47.67,2025-01-17 23:42:42.336905,2025-01-17 23:46:40.613457,0 days 00:03:58.276552,0.2894475600091036,0.9477528181671152,0.9684051155665713,0.43588461982832394,0.03237221204466122,19,15,Adam,0.7435050425448859,1,7.235955407324038,True,COMPLETE
363,52.44,2025-01-17 23:46:40.690649,2025-01-17 23:54:13.629432,0 days 00:07:32.938783,0.2580701499595814,0.8870537443781622,1.5694362708109761,0.4902834532797052,0.0005100923232628748,13,4,SGD,0.2669553258009577,1,,False,COMPLETE
364,52.88,2025-01-17 23:54:13.724757,2025-01-18 00:00:41.679324,0 days 00:06:27.954567,0.32950045938147465,0.818398093229409,1.0561482632617918,0.4166140163614914,0.03997226127545065,18,3,SGD,0.993022816031538,0,9.998416067022042,True,COMPLETE
365,53.080000000000005,2025-01-18 00:00:41.753726,2025-01-18 00:09:41.748234,0 days 00:08:59.994508,0.35527202515867434,0.9844104819146237,0.9449529092531385,0.44754607714342576,0.044634630266380676,17,3,SGD,0.5229624502839407,1,,False,COMPLETE
366,52.62,2025-01-18 00:09:41.826357,2025-01-18 00:13:17.117184,0 days 00:03:35.290827,0.3730909590071066,1.0108003214798575,0.9337180487617438,0.5087328519188544,0.04827073954870567,14,4,SGD,0.362537534860992,1,,False,COMPLETE
367,52.88,2025-01-22 14:23:37.108066,2025-01-22 14:24:55.274966,0 days 00:01:18.166900,0.349610505501702,0.977775393730039,0.9124699037246038,0.4533339053454806,0.053553214778992705,16,3,SGD,0.5048504237370182,0,,False,COMPLETE
