number,value,datetime_start,datetime_complete,duration,params_gamma_1,params_gamma_2,params_lambda,params_lr,params_n_clusters,params_n_points,params_optimizer,params_reg_lambda,params_reg_type,params_tanh_x,params_use_tanh,state
1239,52.89,2025-01-21 12:25:42.055304,2025-01-21 12:29:10.239479,0 days 00:03:28.184175,0.9812729901565655,1.3094233046101504,0.3915781319512318,0.04362361807899821,19,3,SGD,0.008706361335538478,2,,False,COMPLETE
1240,53.059999999999995,2025-01-21 12:29:10.351268,2025-01-21 12:31:37.331572,0 days 00:02:26.980304,1.0360196799664783,1.2657252268421288,0.418157771310622,0.021620766989388227,16,4,SGD,0.0010691174296221426,2,,False,COMPLETE
1241,52.959999999999994,2025-01-21 12:31:37.449213,2025-01-21 12:35:54.992903,0 days 00:04:17.543690,0.9587381424852327,1.4050258903654145,0.4424579800318099,0.007364969659277102,20,5,SGD,0.0013476173380396418,2,,False,COMPLETE
1242,53.28000000000001,2025-01-21 12:35:55.112279,2025-01-21 12:38:21.205588,0 days 00:02:26.093309,1.0054457696407895,1.3539864547081346,0.42448648070199274,0.033825498863083156,18,4,SGD,0.016022279671950607,2,,False,COMPLETE
1243,52.86,2025-01-21 12:38:21.300596,2025-01-21 12:54:36.510021,0 days 00:16:15.209425,1.078844175181569,1.2785138927100654,0.39503304698856734,0.029428949318617423,21,5,SGD,0.024737312221127208,2,,False,COMPLETE
1244,53.06999999999999,2025-01-21 12:41:57.475337,2025-01-21 12:44:20.294639,0 days 00:02:22.819302,1.0674590386730296,1.3186529228865436,0.4053729059861053,0.0265213788336546,21,5,SGD,0.016990275909510515,0,,False,COMPLETE
1245,52.99,2025-01-21 12:44:20.398512,2025-01-21 12:46:48.300692,0 days 00:02:27.902180,1.11483372977435,1.3515493421765967,0.41419871480745823,0.030543765616288115,19,3,SGD,0.022195775530148006,2,,False,COMPLETE
1246,52.690000000000005,2025-01-21 12:46:48.421209,2025-01-21 12:49:10.982216,0 days 00:02:22.561007,1.0247397106574034,1.3029873984738631,0.38186860181111965,0.03383490779853296,23,5,SGD,0.016914801575538867,2,,False,COMPLETE
1247,53.04,2025-01-21 12:49:11.087267,2025-01-21 12:51:14.362062,0 days 00:02:03.274795,1.0769194685588623,1.3544903028096298,0.40153036389429075,0.033877724973107044,18,4,SGD,0.014032689053901799,2,,False,COMPLETE
1248,53.010000000000005,2025-01-21 12:51:14.483858,2025-01-21 13:08:04.657680,0 days 00:16:50.173822,1.0476894597560409,1.2744634897016973,0.4179167444632669,0.029768158501522868,20,3,SGD,0.012666602495719813,2,,False,COMPLETE
1249,52.769999999999996,2025-01-21 12:54:36.611011,2025-01-21 12:57:06.713587,0 days 00:02:30.102576,1.0390926960325377,0.6738853653166006,0.42546998615232556,0.02868178935207546,18,4,SGD,0.023648007553860328,2,,False,COMPLETE
1250,53.1,2025-01-21 12:57:06.835276,2025-01-21 13:13:58.312802,0 days 00:16:51.477526,0.9988768694165755,1.3297633178241544,0.4171483153369334,0.024823348570594844,20,3,SGD,0.01990824129193305,2,,False,COMPLETE
1251,53.11,2025-01-21 13:08:04.782726,2025-01-21 13:10:36.743339,0 days 00:02:31.960613,1.1254732996162986,1.3321946782978809,0.4298169703670685,0.024448924453133486,18,4,SGD,0.014148580740116132,0,,False,COMPLETE
1252,52.62,2025-01-21 13:10:36.841472,2025-01-21 13:26:48.173065,0 days 00:16:11.331593,1.0228590128821216,1.366436863467123,0.36955218541788143,0.015257860319890593,15,4,SGD,0.015805102340002812,2,,False,COMPLETE
1253,52.87,2025-01-21 13:13:58.432855,2025-01-21 13:17:23.279129,0 days 00:03:24.846274,1.003868939347874,1.370808883407293,0.4043776294537243,0.019099986336155145,15,4,SGD,0.015945971284191417,2,,False,COMPLETE
1254,52.72,2025-01-21 13:17:23.404385,2025-01-21 13:19:42.766189,0 days 00:02:19.361804,1.1079930273583702,1.4331765837269366,0.37387544037830356,0.033793913538387364,17,4,SGD,0.011337126805195484,2,,False,COMPLETE
1255,52.99,2025-01-21 13:19:42.873924,2025-01-21 13:22:03.861828,0 days 00:02:20.987904,1.0233810707418918,1.5043617980007622,0.4350349864266549,0.04736332182921005,22,3,SGD,0.017778938312448315,2,,False,COMPLETE
1256,52.83,2025-01-21 13:22:03.972652,2025-01-21 13:38:37.856543,0 days 00:16:33.883891,1.0557727156950263,1.391846613438087,0.4251388270945302,0.0006093790403006887,19,5,SGD,0.01709493068928757,2,,False,COMPLETE
1257,53.1,2025-01-21 13:26:48.284453,2025-01-21 13:29:18.564901,0 days 00:02:30.280448,1.0634819236440305,1.3021143887110582,0.42438386691749164,0.035673939872471354,19,3,SGD,0.015496597319954385,2,,False,COMPLETE
1258,53.06999999999999,2025-01-21 13:29:18.682083,2025-01-21 13:46:22.639153,0 days 00:17:03.957070,1.1186505302194447,1.4166289074932474,0.40690027076417873,0.002184670690814773,18,4,SGD,0.01871679658558361,2,,False,COMPLETE
1259,52.87,2025-01-21 13:38:37.966006,2025-01-21 13:55:31.822266,0 days 00:16:53.856260,1.0924347038005753,1.4620659794257926,0.4053892403023078,0.002235649518179094,17,4,SGD,0.012175845394383468,0,,False,COMPLETE
1260,52.94,2025-01-21 13:46:22.754795,2025-01-21 14:02:50.737129,0 days 00:16:27.982334,1.000609182007875,1.463192929065105,0.4522234315677108,0.010785010143120095,16,4,SGD,0.01091453883656352,0,,False,COMPLETE
1261,52.93,2025-01-21 13:55:31.933423,2025-01-21 13:57:12.896453,0 days 00:01:40.963030,1.0043353434707245,1.4993315789718846,0.45350387754323856,0.03144357881329011,21,5,SGD,0.011204852710890806,2,,False,COMPLETE
1262,51.99,2025-01-21 13:57:12.999332,2025-01-21 14:00:25.017843,0 days 00:03:12.018511,1.8367614814771775,1.324259607488927,0.439495846443936,0.006765667850081906,14,4,SGD,0.010771932021739438,2,,False,COMPLETE
1263,52.39,2025-01-21 14:00:25.105217,2025-01-21 14:17:07.272124,0 days 00:16:42.166907,0.9863180650092267,1.362137842644555,0.38656948651183665,0.04233742493413013,56,2,SGD,0.02554829042248411,2,,False,COMPLETE
1264,52.93,2025-01-21 14:02:50.829242,2025-01-21 14:06:22.557567,0 days 00:03:31.728325,0.9616863509497926,1.357793601009137,0.3936963017506479,0.03412075375319093,20,3,SGD,0.01402450154112554,2,,False,COMPLETE
1265,52.93,2025-01-21 14:06:22.678174,2025-01-21 14:08:52.465753,0 days 00:02:29.787579,0.9050103022886706,1.4184410371715994,0.436858962419642,0.02732225031871438,23,5,SGD,0.01969365967228822,2,,False,COMPLETE
1266,53.14,2025-01-21 14:08:52.582431,2025-01-21 14:10:55.075755,0 days 00:02:02.493324,1.0485084903146689,1.25047796538247,0.4127685471761289,0.03994392228263052,18,4,SGD,0.010152256710410288,2,,False,COMPLETE
1267,53.03,2025-01-21 14:10:55.202680,2025-01-21 14:27:10.228860,0 days 00:16:15.026180,1.1270864654810457,1.387729120387815,0.4249811723411488,0.02111667525049925,16,4,SGD,0.00010240178469709602,2,,False,COMPLETE
1268,53.09,2025-01-21 14:17:07.395123,2025-01-21 14:21:13.498973,0 days 00:04:06.103850,1.07784363375146,1.3120057287915308,0.4247487411132681,0.009603460646763567,16,4,SGD,0.0013355928180333926,2,,False,COMPLETE
1269,52.910000000000004,2025-01-21 14:21:13.607625,2025-01-21 14:23:48.121034,0 days 00:02:34.513409,1.1281986594792226,1.5092819101465496,0.4726923939766287,0.02174750392973463,20,3,SGD,0.034045705104598936,2,,False,COMPLETE
1270,52.949999999999996,2025-01-21 14:23:48.225423,2025-01-21 14:25:22.149728,0 days 00:01:33.924305,0.9327924649016324,0.7765310861283741,0.4438355447105422,0.04705867398320756,17,4,SGD,0.0012564122104968785,2,,False,COMPLETE
1271,52.86,2025-01-21 14:25:22.467359,2025-01-21 14:28:40.804709,0 days 00:03:18.337350,1.032144684954758,1.3928913447436118,0.4169339766970281,0.031235002453663306,19,5,SGD,0.0014854410198104672,2,,False,COMPLETE
1272,52.81,2025-01-21 14:27:10.327462,2025-01-21 14:28:45.338848,0 days 00:01:35.011386,1.029539180324836,1.4505693400858997,0.4118545564669067,0.03734417304937309,19,5,SGD,0.01271928597340073,2,,False,COMPLETE
1273,51.28,2025-01-21 14:28:40.906589,2025-01-21 14:29:47.959460,0 days 00:01:07.052871,1.0839907128486774,1.4315074497236335,0.6113132878496812,0.03735610856652019,12,4,SGD,0.008078198691780428,2,,False,COMPLETE
1274,52.83,2025-01-21 14:28:45.442732,2025-01-21 14:31:07.266002,0 days 00:02:21.823270,1.0870431938000902,1.2948385937878473,0.465033014159528,0.02540243404311674,22,3,SGD,0.001126267764754727,0,,False,COMPLETE
1275,52.89,2025-01-21 14:29:48.041512,2025-01-21 14:32:08.977751,0 days 00:02:20.936239,0.97093899900074,1.3008558815283346,0.46075972144066196,0.02604070832685096,22,3,SGD,0.0011814191476164097,0,,False,COMPLETE
1276,53.02,2025-01-21 14:31:07.367954,2025-01-21 14:33:20.041182,0 days 00:02:12.673228,0.9906331593263346,1.3438648870010632,0.43749863206668854,0.028386550833122453,14,4,SGD,0.001358712810804363,2,,False,COMPLETE
1277,52.480000000000004,2025-01-21 14:32:09.088138,2025-01-21 14:35:26.978506,0 days 00:03:17.890368,1.0023409293056966,1.3338768454703311,0.35628759576674746,0.044006603734178563,14,4,SGD,0.014468671149214546,2,,False,COMPLETE
1280,52.93,2025-01-22 14:25:52.253243,2025-01-22 14:28:44.827937,0 days 00:02:52.574694,0.9484210071417923,1.2462750501512723,0.3946233567070809,0.03133714974408776,18,4,SGD,0.009628150490289915,2,,False,COMPLETE
