number,value,datetime_start,datetime_complete,duration,params_centroids_new_old_ratio,params_gamma_1,params_gamma_2,params_lambda,params_lr,params_n_clusters,params_n_points,params_optimizer,params_reg_lambda,params_reg_type,params_tanh_x,params_use_tanh,state
269,52.89,2025-01-15 23:54:17.830313,2025-01-15 23:58:51.520101,0 days 00:04:33.689788,0.38552978493702,1.0231406585554002,1.0620551619774947,0.43164757507474455,0.05622502497925794,20,5,SGD,0.46798341581425895,1,9.774948813113083,True,COMPLETE
270,52.86,2025-01-15 23:58:51.606077,2025-01-16 00:02:21.971076,0 days 00:03:30.364999,0.25844484102327825,0.9024619696626429,1.0055993926550488,0.3850491678172287,0.040207494153427524,18,3,SGD,0.6638081075013872,1,8.119578995164844,True,COMPLETE
271,53.080000000000005,2025-01-16 00:02:22.063678,2025-01-16 00:07:02.535453,0 days 00:04:40.471775,0.3220306281604465,0.8491382076207848,0.932059955871488,0.45017605021521917,0.0008072462576612126,17,4,SGD,0.5332370491452397,1,8.429470702195582,True,COMPLETE
272,52.559999999999995,2025-01-16 00:07:02.626483,2025-01-16 00:13:25.247138,0 days 00:06:22.620655,0.33016611642411375,0.8417357974339997,0.9294785676146874,0.4886061084942525,0.0008295325305636281,16,3,SGD,0.5312058879301883,1,,False,COMPLETE
273,52.86,2025-01-16 00:13:25.344535,2025-01-16 00:19:26.379262,0 days 00:06:01.034727,0.3144544371029541,0.8534931106066039,0.8974301973188681,0.4098410292160858,0.0009284044239516843,19,3,SGD,0.989503151668755,1,,False,COMPLETE
274,52.66,2025-01-16 00:19:26.485936,2025-01-16 00:25:32.000645,0 days 00:06:05.514709,0.35687220950096094,0.7940978457890469,0.84192562347129,0.45782311753041854,0.0007370452847839765,15,4,SGD,0.4210228850140322,1,9.190417603110587,True,COMPLETE
275,53.15,2025-01-16 00:25:32.081220,2025-01-16 00:32:25.849251,0 days 00:06:53.768031,0.2698737008221385,0.9637747041416257,0.9590127364794706,0.4233221149764019,0.0006734813383291691,18,4,SGD,0.7670778268802384,1,,False,COMPLETE
276,47.36,2025-01-16 00:32:25.939797,2025-01-16 00:39:17.070103,0 days 00:06:51.130306,0.3410385098455527,0.9555814947329816,0.9216733793909379,0.45130055731866875,0.0008060022664900977,20,16,SGD,0.7838542912967551,1,,False,COMPLETE
277,52.849999999999994,2025-01-16 00:39:17.178858,2025-01-16 00:45:34.281292,0 days 00:06:17.102434,0.39699625838122465,0.881561443176918,0.964470858295988,0.47286470281888277,0.0006600198819352754,18,3,SGD,0.7388242985298009,1,5.323185391279855,True,COMPLETE
278,49.25,2025-01-16 00:45:34.381162,2025-01-16 00:52:59.558367,0 days 00:07:25.177205,0.2711101353991371,0.975156193090311,0.9458908364480334,0.2039831094317251,0.0007528326698816935,19,2,SGD,0.8471067276062962,1,,False,COMPLETE
279,52.92,2025-01-16 00:52:59.647415,2025-01-16 00:56:20.008721,0 days 00:03:20.361306,0.31710881003718283,0.9320024829858125,0.869785175873171,0.4147929046674504,0.027776212311670146,17,4,Adam,0.6525191575655919,1,,False,COMPLETE
280,52.93,2025-01-16 00:56:22.022382,2025-01-16 00:59:32.228208,0 days 00:03:10.205826,0.28851493722634725,1.0484182146806866,0.9678005474177516,0.43359065745110115,0.04359467395596753,21,5,SGD,0.7119063580535385,1,8.402789748479373,True,COMPLETE
281,52.94,2025-01-16 00:59:32.324936,2025-01-16 01:04:59.223096,0 days 00:05:26.898160,0.2676635325482138,0.8733376984061054,0.9176765066641926,0.4002639164163163,0.0006915306146966422,18,3,SGD,0.479081342039604,1,,False,COMPLETE
282,51.29,2025-01-16 01:04:59.322682,2025-01-16 01:09:05.775546,0 days 00:04:06.452864,0.32897307335010545,0.9562627029207551,0.35103384641607493,0.6208719322975227,0.032847872716146864,16,4,SGD,0.9944482308004704,1,9.735096059412335,True,COMPLETE
283,52.790000000000006,2025-01-16 01:09:05.854890,2025-01-16 01:11:18.583520,0 days 00:02:12.728630,0.29943897640260986,0.9088142156815802,1.0428762198736619,0.44804187935938233,0.049124684447694994,19,5,SGD,0.6029894108153839,1,,False,COMPLETE
284,52.580000000000005,2025-01-16 01:11:18.673149,2025-01-16 01:16:18.596434,0 days 00:04:59.923285,0.2820990947315293,0.9968980313210115,0.9867063508850294,0.42260139481387254,0.0006146274716619301,22,2,SGD,0.35812102439146,1,,False,COMPLETE
285,52.849999999999994,2025-01-16 01:16:18.702490,2025-01-16 01:21:48.387742,0 days 00:05:29.685252,0.31627571654951,0.818033110108237,1.069308273291858,0.4676762579291896,0.0008608812321677199,17,3,SGD,0.7924125046654713,1,0.638876089383297,True,COMPLETE
286,52.580000000000005,2025-01-16 01:21:48.486432,2025-01-16 01:27:18.770477,0 days 00:05:30.284045,0.26062485549942216,1.0359885947598237,0.889894323141632,0.38803592671783044,0.034515238808661614,16,4,SGD,0.511448903512709,1,,False,COMPLETE
287,53.02,2025-01-16 01:27:19.763066,2025-01-16 01:32:24.872836,0 days 00:05:05.109770,0.3469291111982208,0.9401353196213516,1.114815299442441,0.4437453965216112,0.03107022117441897,20,3,SGD,0.6511279065175295,1,,False,COMPLETE
288,53.05,2025-01-16 01:32:24.962347,2025-01-16 01:36:01.254204,0 days 00:03:36.291857,0.2951939340746895,1.0751817108525275,0.9521441431229005,0.4084691250463338,0.04348750503064149,18,4,SGD,0.8449506661801213,1,6.414580451270769,True,COMPLETE
289,44.49,2025-01-16 01:36:01.351287,2025-01-16 01:42:47.010240,0 days 00:06:45.658953,0.2751958881855671,0.9939786574774155,1.0398987082833604,0.5064923655685377,0.0006901460096307444,40,40,SGD,0.553215298515833,1,,False,COMPLETE
290,52.849999999999994,2025-01-16 01:42:47.088309,2025-01-16 01:48:29.954688,0 days 00:05:42.866379,0.31338584301961436,0.8913586770230976,1.17482940700528,0.4279587369641865,0.0009876500468931771,13,4,SGD,0.6908304074171874,1,6.832024127887358,True,COMPLETE
291,52.980000000000004,2025-01-16 01:48:30.054469,2025-01-16 01:51:35.665625,0 days 00:03:05.611156,0.248462731127264,0.972886141107426,0.9988297718663618,0.45524979686689027,0.03708404784143026,15,4,SGD,0.4782979384095206,2,,False,COMPLETE
292,52.87,2025-01-16 01:51:35.763902,2025-01-16 02:02:27.290257,0 days 00:10:51.526355,0.3365099335000815,0.9155628062467218,0.9352593042638367,0.4823064152904346,0.0005455224436169173,19,3,SGD,0.43825703462875915,0,,False,COMPLETE
293,48.69,2025-01-16 02:02:27.380404,2025-01-16 02:09:06.080259,0 days 00:06:38.699855,0.29288257975948684,0.5273134772286943,0.8197325688055578,0.23412613785535802,0.018824468520208713,17,3,SGD,0.6155854235777155,1,9.986282196959625,True,COMPLETE
294,52.59,2025-01-16 02:09:06.168377,2025-01-16 02:16:49.196722,0 days 00:07:43.028345,0.5968048292259652,1.0208995212578609,0.9772322450896251,0.41782835309215394,0.0007935024395571796,21,2,SGD,0.7640114802098719,0,,False,COMPLETE
295,53.16,2025-01-16 02:16:49.282357,2025-01-16 02:20:28.527489,0 days 00:03:39.245132,0.42186091974999573,0.9469995903191175,1.0838891224222498,0.44165629811864504,0.04100436454740176,18,4,SGD,0.3666444140396753,1,8.545411657816421,True,COMPLETE
296,51.67,2025-01-16 02:20:28.611812,2025-01-16 02:27:37.944746,0 days 00:07:09.332934,0.4217409479116405,1.0952849870334802,1.1408816966926647,0.4687599197083459,0.021669064622969973,68,1,SGD,0.3452758834877016,1,7.987622099304842,True,COMPLETE
297,49.7,2025-01-16 02:27:38.034717,2025-01-16 02:33:01.836770,0 days 00:05:23.802053,0.4124503896025823,0.29371881345368134,1.0932330163802824,0.44110541034742756,0.04201358232796386,19,5,SGD,0.3962408690073024,1,8.543257997603686,True,COMPLETE
298,52.949999999999996,2025-01-16 02:33:01.921851,2025-01-16 02:36:04.029870,0 days 00:03:02.108019,0.36338286579931434,0.8639589349019333,1.061137071979519,0.4484447143972439,0.048982626815258154,16,4,SGD,0.5080799473149812,1,9.361395757941436,True,COMPLETE
299,52.96999999999999,2025-01-16 02:36:04.129838,2025-01-16 02:39:17.500564,0 days 00:03:13.370726,0.4566803461501292,0.9684025542592458,1.0208835353650996,0.46188854326116713,0.02729633658238636,20,5,Adam,0.0005709377594134572,1,9.12648381004155,True,COMPLETE
302,52.33,2025-01-17 19:33:48.955607,2025-01-17 19:40:34.358246,0 days 00:06:45.402639,0.2780052341554737,0.7339433097995175,1.1135457375745692,0.49346752850117087,0.03541945361732498,14,4,SGD,0.8844092548080257,1,8.8690197214698,True,COMPLETE
303,53.010000000000005,2025-01-17 19:40:34.448769,2025-01-17 19:48:36.899907,0 days 00:08:02.451138,0.39326232407105144,0.9281608116850503,1.0547388543219332,0.39858486393988624,0.05960533598927081,18,3,SGD,0.4040243516029958,1,9.55679575495234,True,COMPLETE
304,52.59,2025-01-17 19:48:36.984214,2025-01-17 19:56:43.981275,0 days 00:08:06.997061,0.19793351733550896,1.0201412064952955,1.0191593078640782,0.4355765772172144,0.03940789074191435,22,2,SGD,0.6376276167723353,1,7.464775657503582,True,COMPLETE
307,53.059999999999995,2025-01-17 20:09:44.090671,2025-01-17 20:17:48.647948,0 days 00:08:04.557277,0.44229251518031926,0.8944116136173267,1.0926051797729264,0.41606369407793453,0.0014470968894298405,18,3,SGD,0.6931314628138916,1,8.306474130972445,True,COMPLETE
308,50.9,2025-01-17 20:09:44.834600,2025-01-17 20:16:53.548467,0 days 00:07:08.713867,0.3285993090623085,0.8443034729241012,1.0825728398768748,0.4161274872661359,0.045824985295121204,71,25,SGD,0.9999843221189025,1,8.24383524209908,True,COMPLETE
309,53.11,2025-01-17 20:16:53.615835,2025-01-17 20:28:55.337224,0 days 00:12:01.721389,0.37483454599317595,0.97986519454025,0.9810952720866223,0.4582239962519284,0.030946145246789993,18,3,SGD,0.006868500185913227,1,8.965737618702882,True,COMPLETE
310,51.470000000000006,2025-01-17 20:17:48.737772,2025-01-17 20:25:31.199366,0 days 00:07:42.461594,0.2544367559316955,1.8911388549502988,0.9906369675750923,0.4741282011249862,0.03046067719160727,16,4,SGD,0.527617628885168,1,8.555343461621893,True,COMPLETE
311,52.55,2025-01-17 20:25:31.289316,2025-01-17 20:30:32.496311,0 days 00:05:01.206995,0.37283653878593415,0.9793118568386703,1.0384567096973576,0.3728342452481335,0.04208539492052996,20,5,SGD,0.7820993893922089,2,,False,COMPLETE
312,52.43,2025-01-17 20:28:55.407420,2025-01-17 20:34:52.896979,0 days 00:05:57.489559,0.3500861686385317,0.9559392723036582,0.9028604506348441,0.371772633263851,0.053012919555732126,20,5,SGD,0.007206506798999898,1,8.85322042580763,True,COMPLETE
313,51.03,2025-01-17 20:30:32.581161,2025-01-17 20:35:51.791871,0 days 00:05:19.210710,0.34936911956919503,0.9389353032173346,0.9622249226369688,0.6419822059003646,0.029255911463738623,18,3,SGD,0.009438408382084556,1,8.982248175478816,True,COMPLETE
314,53.059999999999995,2025-01-17 20:34:52.959699,2025-01-17 20:46:19.697772,0 days 00:11:26.738073,0.37947161349833014,0.9270891762408202,0.9645946740450327,0.4395799724153234,0.036046869694941176,18,3,SGD,0.006777220626562948,1,9.050668825530362,True,COMPLETE
315,52.88,2025-01-17 20:35:51.888223,2025-01-17 20:51:51.601164,0 days 00:15:59.712941,0.38130120258149436,1.048102598370765,0.9870581354038802,0.4489391943459837,0.02555668865691232,14,4,SGD,0.007814879089249832,1,9.51037166264793,True,COMPLETE
316,52.92,2025-01-17 20:46:19.772172,2025-01-17 20:52:23.026108,0 days 00:06:03.253936,0.40289497997302004,1.0509401376647873,1.0029459261922178,0.4568817271052345,0.03299527037365382,14,4,SGD,0.45209351132374376,1,9.343279295431282,True,COMPLETE
317,52.88,2025-01-17 20:51:51.689526,2025-01-17 20:59:42.694756,0 days 00:07:51.005230,0.4058920185257838,0.8779629653675992,0.9257104198994293,0.4314974450470174,0.03308137559279607,15,4,SGD,0.3232105140589294,1,9.31207282882519,True,COMPLETE
318,51.959999999999994,2025-01-17 20:52:23.099235,2025-01-17 21:07:13.218451,0 days 00:14:50.119216,0.3036234518427793,0.8118607749903957,0.8692614982966634,0.4287323782864351,0.0006287096532641737,51,1,SGD,0.008794703454439754,1,8.709634485970213,True,COMPLETE
319,52.629999999999995,2025-01-17 20:59:42.781564,2025-01-17 21:07:30.624774,0 days 00:07:47.843210,0.30702775952863187,0.9007870192606191,0.8825410633721539,0.3969907402665383,0.0006169120621705718,21,3,SGD,0.7412752465206148,1,8.695636388541025,True,COMPLETE
320,52.849999999999994,2025-01-17 21:07:13.291671,2025-01-17 21:13:41.731003,0 days 00:06:28.439332,0.4722965378423375,0.9858065140236464,1.0403724219676311,0.39646588350772016,0.03962560307026671,22,5,SGD,0.8163385898549306,1,7.91574660001035,True,COMPLETE
321,52.959999999999994,2025-01-17 21:07:30.714113,2025-01-17 21:19:17.201137,0 days 00:11:46.487024,0.3270284140634515,0.9908299697000623,0.9531428050913846,0.4817015326324698,0.03887159907773356,17,4,SGD,0.005051610956449353,1,7.86173527206064,True,COMPLETE
322,51.51,2025-01-17 21:13:41.800171,2025-01-17 21:17:45.805254,0 days 00:04:04.005083,0.3221792324145071,0.9986032394775546,0.9392368980148644,0.4565444161983885,0.048097796310201786,17,9,SGD,0.013841430387882374,1,9.702434743310693,True,COMPLETE
323,52.949999999999996,2025-01-17 21:17:45.865837,2025-01-17 21:21:29.566533,0 days 00:03:43.700696,0.28599496428526927,0.9591443550796527,0.9916278782015058,0.4799146746966909,0.03609577266004497,19,3,SGD,0.5900876446420649,1,9.887244434607886,True,COMPLETE
324,53.04,2025-01-17 21:19:17.290037,2025-01-17 21:24:44.040490,0 days 00:05:26.750453,0.28168587173001824,0.955569904327764,1.1506317880115906,0.4134114945557057,0.0449150025621532,19,3,SGD,0.0049267625946473265,1,8.458762708714332,True,COMPLETE
325,49.66,2025-01-17 21:21:29.640337,2025-01-17 21:24:24.640795,0 days 00:02:55.000458,0.36190842380591776,0.8563324484449829,1.1506678289376957,0.7016216636211827,0.04430655548422424,16,4,Adam,0.005695397891001796,1,,False,COMPLETE
326,52.61,2025-01-17 21:24:24.700675,2025-01-17 21:29:24.391267,0 days 00:04:59.690592,0.266056972597672,0.9112238533051338,1.0701057380314456,0.41378554308184834,0.029727579045790098,12,4,SGD,0.0114545776171272,0,,False,COMPLETE
327,52.64,2025-01-17 21:24:44.123176,2025-01-17 21:40:27.779523,0 days 00:15:43.656347,0.26452159664189945,0.9121022962111983,1.0566002780560666,0.43094289799958796,0.0007360020334696755,12,4,SGD,0.0036396388186816,0,,False,COMPLETE
328,52.980000000000004,2025-01-17 21:29:24.452066,2025-01-17 21:35:24.481361,0 days 00:06:00.029295,0.2937231758736189,1.0214728690195856,1.0192698395649136,0.44183637799343134,0.0006808632517175517,16,4,SGD,0.5262073030101672,1,,False,COMPLETE
329,0.0,2025-01-17 21:35:24.552378,2025-01-17 21:44:39.000196,0 days 00:09:14.447818,0.4373016866604758,0.9253793565853095,0.9158325873453862,0.43280521478677586,0.000543529916635374,20,2,SGD,0.6622074497887748,0,9.152640054312878,True,COMPLETE
330,50.5,2025-01-17 21:40:27.880935,2025-01-17 21:43:59.676790,0 days 00:03:31.795855,0.24260710947689323,1.0867840204206525,0.9136617343489137,0.46187554637226624,0.051235773560771705,18,11,SGD,0.657287813603221,1,8.124116053484101,True,COMPLETE
331,48.76,2025-01-17 21:43:59.770129,2025-01-17 21:51:28.630041,0 days 00:07:28.859912,0.43502290274236044,0.9396910564420734,0.9801774536237229,0.779361742209165,0.0005363218343196396,20,2,SGD,0.400621447968272,1,9.190309442076089,True,COMPLETE
332,52.839999999999996,2025-01-17 21:44:39.052618,2025-01-17 21:48:36.005681,0 days 00:03:56.953063,0.3115477724957218,0.7939497433885605,0.9811489629668404,0.4540313773398054,0.035607445625655806,17,3,SGD,0.9970641490961751,1,,False,COMPLETE
333,48.42,2025-01-17 21:48:36.075001,2025-01-17 21:51:29.751965,0 days 00:02:53.676964,0.3448760853435898,0.8848966247528364,1.0060761126032873,0.7805506145712056,0.031011974778367507,15,4,SGD,0.43562387396841773,1,9.5786508927472,True,COMPLETE
334,51.739999999999995,2025-01-17 21:51:28.713244,2025-01-17 21:58:43.439085,0 days 00:07:14.725841,0.33631612417920337,0.8503972364868168,1.1117944322296471,0.3032023327418916,0.04218084576128914,15,4,SGD,0.45377739423365243,1,,False,COMPLETE
335,47.599999999999994,2025-01-17 21:51:29.821311,2025-01-17 21:55:39.437741,0 days 00:04:09.616430,0.2756615538315249,0.9888312022788431,1.0371218680810421,0.4060801645353604,0.04089895194946041,32,22,SGD,0.7935575535055931,0,,False,COMPLETE
336,53.059999999999995,2025-01-17 21:55:39.499454,2025-01-17 21:59:33.939906,0 days 00:03:54.440452,0.33394682565455547,1.0584858948594944,1.1129908087705969,0.4421072687143779,0.02699841444814461,18,3,SGD,0.5433958441401749,1,,False,COMPLETE
337,52.39,2025-01-17 21:58:43.522389,2025-01-17 22:05:24.600375,0 days 00:06:41.077986,0.2992794185179414,1.0644935608361994,0.9471707800311402,0.34219758754844665,0.027587887027153937,18,3,SGD,0.5595401188337787,1,,False,COMPLETE
338,52.21,2025-01-17 21:59:34.002808,2025-01-17 22:06:57.123208,0 days 00:07:23.120400,0.2958167054025465,1.0291703797295713,0.954283107019109,0.34110354364691664,0.037137682505687025,17,3,SGD,0.8756298046393611,1,4.11082842541018,True,COMPLETE
339,52.64,2025-01-17 22:05:24.684180,2025-01-17 22:13:02.105523,0 days 00:07:37.421343,0.24952684301058475,1.024308068941536,1.0203319127928807,0.38700386710602275,0.056579013262282256,21,5,SGD,0.7204395764812638,0,3.6411517217977867,True,COMPLETE
340,49.14,2025-01-17 22:06:57.187485,2025-01-17 22:10:46.746278,0 days 00:03:49.558793,0.31543149003608983,0.9581113022903258,0.8562589041761094,0.42316051843818064,0.057841513906591126,21,14,SGD,0.6945606328767986,0,8.892748688605824,True,COMPLETE
341,52.87,2025-01-17 22:10:46.811000,2025-01-17 22:13:57.722129,0 days 00:03:10.911129,0.3625534419682986,1.1105212767650112,1.014765170032843,0.4698261545152508,0.033014076102594686,16,4,SGD,0.2895868521050634,1,,False,COMPLETE
342,52.96999999999999,2025-01-17 22:13:02.185799,2025-01-17 22:18:22.570771,0 days 00:05:20.384972,0.22031548362802916,0.88970020496195,1.079735638257902,0.4671187932557015,0.03287441069983984,19,3,SGD,0.34891846981524505,1,,False,COMPLETE
343,53.05,2025-01-17 22:13:57.795412,2025-01-17 22:21:16.031322,0 days 00:07:18.235910,0.2797095054917356,0.8926962341157956,1.0754446743062829,0.4441873149152109,0.0007162093835309782,19,3,SGD,0.3763941884914745,1,,False,COMPLETE
344,51.849999999999994,2025-01-17 22:18:22.664693,2025-01-17 22:34:27.551648,0 days 00:16:04.886955,0.2818564596179438,0.9743282050934285,0.20008384169086324,0.4446854303188753,0.0006224510581322736,19,3,SGD,0.0023959206278318912,1,7.730906833075191,True,COMPLETE
345,52.580000000000005,2025-01-17 22:21:16.096565,2025-01-17 22:25:02.618731,0 days 00:03:46.522166,0.7585268711257349,0.972794843157132,0.9079428830485816,0.4954621623755919,0.0005927448707797107,15,4,Adam,0.5614483212774127,0,4.845605735012779,True,COMPLETE
346,53.03,2025-01-17 22:25:02.691233,2025-01-17 22:28:08.027132,0 days 00:03:05.335899,0.25928754862035597,0.9363772765360118,0.9704706313557967,0.42192236692009505,0.047991772568016025,16,4,SGD,0.8627587011744993,1,8.603130591384147,True,COMPLETE
347,52.52,2025-01-17 22:28:08.084587,2025-01-17 22:34:42.149572,0 days 00:06:34.064985,0.3179374403830321,1.0019359374649104,1.0386615827243484,0.4060899706381936,0.0008004603661115007,23,2,SGD,0.6234322115100656,1,,False,COMPLETE
348,53.010000000000005,2025-01-17 22:34:27.624579,2025-01-17 22:43:36.118440,0 days 00:09:08.493861,0.32140730893353725,0.8481597425304145,1.0455566775668461,0.42809805670229134,0.0008025408228337534,17,4,SGD,0.6213867017274205,0,,False,COMPLETE
349,52.959999999999994,2025-01-17 22:34:42.224136,2025-01-17 22:38:39.261133,0 days 00:03:57.036997,0.2986835254010925,0.8353006464629397,0.9947376794413114,0.4274696299647079,0.038375515555408274,17,4,SGD,0.5059322295971311,0,,False,COMPLETE
350,52.78,2025-01-17 22:38:39.319335,2025-01-17 22:41:38.367104,0 days 00:02:59.047769,0.8890691684278338,0.924716421789425,0.9361444563130323,0.4560007724236846,0.04317285691439739,13,4,SGD,0.725788285181149,1,9.42876341017196,True,COMPLETE
351,52.959999999999994,2025-01-17 22:41:38.430525,2025-01-17 22:45:51.139041,0 days 00:04:12.708516,0.4204613497747606,0.8693367784928699,0.8906039426099981,0.4347596451871187,0.03566146156676382,18,3,SGD,0.4599504501253585,1,,False,COMPLETE
352,52.980000000000004,2025-01-17 22:43:36.199127,2025-01-17 22:59:04.244934,0 days 00:15:28.045807,0.2399832926101436,0.9980863006568417,0.8894003864926411,0.4008707867263257,0.01408844078798795,18,3,SGD,0.00016479905859490002,1,8.380414585512487,True,COMPLETE
353,52.86,2025-01-17 22:45:51.208625,2025-01-17 23:00:11.562393,0 days 00:14:20.353768,0.23215099760011781,0.9549117825407691,0.9712947191830311,0.4021557123008432,0.023322817470453575,21,5,SGD,0.000160622706132336,1,9.810669564121298,True,COMPLETE
354,52.949999999999996,2025-01-17 22:59:04.326900,2025-01-17 23:08:00.335185,0 days 00:08:56.008285,0.2712742967573622,0.9515703564861548,0.95963499711501,0.45436481057624084,0.02280110961473709,15,4,SGD,0.8493414786641696,1,,False,COMPLETE
355,51.739999999999995,2025-01-17 23:00:11.626456,2025-01-17 23:08:41.586989,0 days 00:08:29.960533,0.26604821483256047,0.9121974624049551,0.8391436003539502,0.5799387616999971,0.000672964540240304,15,4,SGD,0.8602174222876616,0,,False,COMPLETE
356,52.82,2025-01-17 23:08:00.430212,2025-01-17 23:18:47.446724,0 days 00:10:47.016512,0.29072999857491516,0.9076335930488327,1.0068154532737927,0.4728811263173091,0.0006647961677362808,20,5,SGD,0.5905766954584757,0,,False,COMPLETE
357,53.0,2025-01-17 23:08:41.654101,2025-01-17 23:11:55.963300,0 days 00:03:14.309199,0.3662250705705684,1.0247638751359887,1.0082033554520653,0.47225009162942244,0.03971200999890382,20,5,SGD,0.5036840300147125,1,9.049147195326299,True,COMPLETE
358,50.970000000000006,2025-01-17 23:18:47.529336,2025-01-17 23:22:58.835768,0 days 00:04:11.306432,0.3398698530187031,1.0797519382490113,1.1889315773540725,0.4179167972747132,0.03001661827539358,5,4,SGD,0.699702763116166,1,8.828197817901833,True,COMPLETE
359,52.690000000000005,2025-01-17 23:22:58.920253,2025-01-17 23:28:29.161897,0 days 00:05:30.241644,0.3103926395591438,0.9897850447206186,1.0430642482105559,0.38189390779668675,0.04613702578951131,17,3,SGD,0.042210722581848034,1,,False,COMPLETE
360,52.790000000000006,2025-01-17 23:28:29.247088,2025-01-17 23:35:13.327273,0 days 00:06:44.080185,0.39186446056747404,0.7673256193471145,0.9251633224188699,0.44598876808797205,0.03668360694156858,16,3,SGD,0.42729716146985874,1,9.624993122969169,True,COMPLETE
