number,value,datetime_start,datetime_complete,duration,params_gamma_1,params_gamma_2,params_lambda,params_lr,params_n_clusters,params_n_points,params_optimizer,params_reg_lambda,params_reg_type,params_tanh_x,params_use_tanh,state
469,51.83,2025-01-20 11:30:31.406841,2025-01-20 11:32:18.928837,0 days 00:01:47.521996,0.5877416417355503,1.663789048427385,0.46775250248772116,0.058212751073089014,67,3,Adam,0.19467357748844244,1,1.6198265555944213,True,COMPLETE
470,52.76,2025-01-20 11:31:42.928435,2025-01-20 11:33:47.291369,0 days 00:02:04.362934,1.1652910919538475,1.666414097379728,0.46959629787040946,0.05460624656521011,68,3,Adam,0.00040409138585377247,1,1.6504297342094851,True,COMPLETE
471,53.03,2025-01-20 11:32:18.997159,2025-01-20 11:34:14.983724,0 days 00:01:55.986565,1.208961775165819,1.6939791434900964,0.4456636738813415,0.05292311801842471,62,4,Adam,0.000443707221352213,1,1.4476397938662913,True,COMPLETE
472,52.89,2025-01-20 11:33:47.363895,2025-01-20 11:35:30.405853,0 days 00:01:43.041958,1.533106181423128,1.6890404561210541,0.4459148311283936,0.0636262734736046,70,4,Adam,0.0004703017450980605,1,2.5204465586357374,True,COMPLETE
473,52.76,2025-01-20 11:34:15.049833,2025-01-20 11:36:10.908629,0 days 00:01:55.858796,1.4657758122144717,1.6370898278753154,0.5085455681091285,0.06541667885224972,69,8,Adam,0.00032903258893183363,1,1.8218664051034414,True,COMPLETE
474,51.580000000000005,2025-01-20 11:35:30.507702,2025-01-20 11:36:52.335326,0 days 00:01:21.827624,1.3593453174113912,1.6295028851503603,0.4968513664092926,0.04621737294155057,6,4,Adam,0.09272838243013014,1,1.817015374237615,True,COMPLETE
475,52.980000000000004,2025-01-20 11:36:10.970410,2025-01-20 11:37:43.728018,0 days 00:01:32.757608,1.3618229919944522,1.8006929588178957,0.482590134649058,0.04949831684779486,65,6,Adam,0.00026835781774733365,1,1.2335505310651298,True,COMPLETE
476,52.55,2025-01-20 11:36:52.425742,2025-01-20 11:38:26.359341,0 days 00:01:33.933599,1.2853180853882198,1.9001853625082261,0.411390993618546,0.07056651751715816,70,10,Adam,0.0001521769380553964,1,1.177804461679336,True,COMPLETE
477,52.980000000000004,2025-01-20 11:37:43.784051,2025-01-20 11:40:09.596785,0 days 00:02:25.812734,1.2817391676975871,1.573520635638875,0.4281792261929619,0.05870289251321943,70,6,Adam,0.00015574990867559495,1,1.012036834994845,True,COMPLETE
478,52.88,2025-01-20 11:38:26.444470,2025-01-20 11:40:05.429071,0 days 00:01:38.984601,1.322900719467576,1.5635387929632976,0.4282146386599611,0.05679381480802441,74,7,Adam,0.0007073166481734642,1,0.8447042303953294,True,COMPLETE
479,52.980000000000004,2025-01-20 11:40:05.519280,2025-01-20 11:41:59.860745,0 days 00:01:54.341465,1.1237368092032645,1.7380863766849153,0.4581541738156066,0.06026944064656117,68,6,Adam,0.0005702324328816304,1,1.397312442556521,True,COMPLETE
480,52.849999999999994,2025-01-20 11:40:09.662029,2025-01-20 11:41:46.515921,0 days 00:01:36.853892,1.1162249331815786,1.7442760816372382,0.45551741679766655,0.07025714554244289,68,7,Adam,0.0005744509986331237,1,1.4626266789282165,True,COMPLETE
481,52.93,2025-01-20 11:41:46.576118,2025-01-20 11:43:11.646753,0 days 00:01:25.070635,1.2145078044647515,1.7075512235876205,0.47892902891720696,0.04967991762455864,65,5,Adam,0.0003909223304775633,1,0.4588156379311946,True,COMPLETE
482,53.0,2025-01-20 11:41:59.941665,2025-01-20 11:43:02.037534,0 days 00:01:02.095869,1.2306758593835778,1.833882114902553,0.4785386345980143,0.050578982214004635,22,5,Adam,0.00037343376431857924,1,0.4598461584508201,True,COMPLETE
483,49.68,2025-01-20 11:43:02.116579,2025-01-20 11:44:40.365456,0 days 00:01:38.248877,1.3241762789954334,1.661250172427167,0.49625594719112187,0.06627412708004132,65,28,Adam,0.00046152075756707855,1,2.0422814213165914,True,COMPLETE
484,52.86,2025-01-20 11:43:11.722268,2025-01-20 11:45:08.093832,0 days 00:01:56.371564,1.3356843466505306,1.6662792317270063,0.403840906952604,0.06534382290810249,73,5,Adam,0.0004954792592457495,2,1.6152411221779566,True,COMPLETE
485,52.949999999999996,2025-01-20 11:44:40.467191,2025-01-20 11:46:43.771332,0 days 00:02:03.304141,1.274294191457432,1.6288546325004598,0.4064171619092064,0.06290500614728095,72,5,Adam,0.0001181735981700705,2,0.7262579770640781,True,COMPLETE
486,53.0,2025-01-20 11:45:08.165095,2025-01-20 11:46:59.726350,0 days 00:01:51.561255,1.24976842587358,1.6171476919723455,0.44401253207861235,0.041445980740525704,71,4,Adam,0.00024107672736713016,1,0.7135115180429342,True,COMPLETE
487,51.93,2025-01-20 11:46:43.841275,2025-01-20 11:49:10.677198,0 days 00:02:26.835923,0.6597846560097282,1.4903686963572573,0.5388211515214901,0.0005199592166333192,71,7,Adam,0.0002953076457055687,1,1.3052619279156048,True,COMPLETE
488,52.26,2025-01-20 11:46:59.787611,2025-01-20 11:48:56.936883,0 days 00:01:57.149272,1.3025384074566928,1.495442526712133,0.5664731882001899,0.055144944531799196,62,7,Adam,0.0008005001378856052,1,1.073024678283084,True,COMPLETE
489,47.64,2025-01-20 11:48:56.994622,2025-01-20 11:50:48.040124,0 days 00:01:51.045502,1.1624928326106139,1.704670821691794,0.3854923914944675,0.045007826274770554,67,35,Adam,0.0002870094434342403,1,1.3381024190203914,True,COMPLETE
490,52.769999999999996,2025-01-20 11:49:10.777472,2025-01-20 11:50:14.986855,0 days 00:01:04.209383,1.167858618611382,1.7077978363459174,0.4668418684488495,0.044855504791394975,33,5,Adam,0.0006651647179129655,1,1.5656709701216682,True,COMPLETE
491,52.78,2025-01-20 11:50:15.058940,2025-01-20 11:51:56.115630,0 days 00:01:41.056690,1.3850378838086044,1.5944364712642083,0.5128865800540283,0.07325060874010986,67,4,Adam,0.000346234053184474,1,1.8195199241616011,True,COMPLETE
492,51.38,2025-01-20 11:50:48.109221,2025-01-20 11:52:49.966572,0 days 00:02:01.857351,0.48661767736641826,1.590061403069797,0.43962773342312533,0.07287931772420514,75,3,Adam,0.2547933716475513,1,2.3842912038494575,True,COMPLETE
493,46.489999999999995,2025-01-20 11:51:56.221379,2025-01-20 11:53:52.742652,0 days 00:01:56.521273,0.20511776226597334,1.5523158391380687,0.4318988701450391,0.059090710738461755,75,3,Adam,0.0005277533278945826,1,1.0003182309355791,True,COMPLETE
494,52.300000000000004,2025-01-20 11:52:50.037143,2025-01-20 11:54:11.272569,0 days 00:01:21.235426,1.2617061178083835,0.6934235313810397,0.45814958390065164,0.058286408372673355,63,8,Adam,0.00021113564518905316,1,0.9973578944246417,True,COMPLETE
495,52.769999999999996,2025-01-20 11:53:52.850579,2025-01-20 12:04:46.783112,0 days 00:10:53.932533,1.2407826812888685,1.653036934173397,0.45704158931094074,0.001342175995656951,69,8,SGD,0.00041516991443851315,1,0.3042594255432346,True,COMPLETE
496,51.800000000000004,2025-01-20 11:54:11.343958,2025-01-20 11:57:40.580857,0 days 00:03:29.236899,1.2087618789623022,1.7691936333569451,0.49200102124367073,0.05169116176450212,73,1,SGD,0.0004207624475541487,1,0.3394705854146436,True,COMPLETE
497,52.980000000000004,2025-01-20 11:57:40.655280,2025-01-20 12:00:13.402806,0 days 00:02:32.747526,1.3593231123882683,1.6425023444755582,0.4712977498575468,0.06823696345757116,69,6,Adam,0.015388490825117864,1,1.7009233728471571,True,COMPLETE
498,52.72,2025-01-20 12:00:13.475147,2025-01-20 12:01:57.782345,0 days 00:01:44.307198,1.4368745168520587,1.6719083327381696,0.4187020563009587,0.0549034656599255,71,6,Adam,0.0006876051994841543,1,5.533101302037837,True,COMPLETE
499,49.230000000000004,2025-01-20 12:01:57.853401,2025-01-20 12:03:53.906115,0 days 00:01:56.052714,1.310407944984345,1.734817460199197,0.8319203082846072,0.08022727652120856,66,5,Adam,0.00034657648539292385,1,2.062243816657521,True,COMPLETE
500,53.05,2025-01-20 12:03:53.979287,2025-01-20 12:05:38.499468,0 days 00:01:44.520181,1.0645451060644393,1.5490089636938529,0.45120889720863566,0.061263031704955416,64,4,Adam,0.00045611750254549824,1,0.5647030556263715,True,COMPLETE
501,52.92,2025-01-20 12:04:46.891973,2025-01-20 12:06:47.135484,0 days 00:02:00.243511,1.2845969818207554,1.7945092503377524,0.47961400625454065,0.0620229035040897,64,4,Adam,0.0005172754876850171,1,1.4946668157171188,True,COMPLETE
502,52.43,2025-01-20 12:05:38.574992,2025-01-20 12:07:43.937164,0 days 00:02:05.362172,1.0469952874788997,1.5332086699600007,0.4809877923334527,0.06425305762028095,63,2,Adam,0.0005784866566385861,1,0.8685784973178916,True,COMPLETE
503,52.339999999999996,2025-01-20 12:06:47.236016,2025-01-20 12:08:22.800760,0 days 00:01:35.564744,1.0022145665904834,1.5288113035288429,0.5004979872515234,0.07795545938245221,61,2,Adam,0.0008098332065260092,1,0.5699265796114655,True,COMPLETE
504,52.669999999999995,2025-01-20 12:07:44.039964,2025-01-20 12:09:16.151167,0 days 00:01:32.111203,0.956270280792106,1.5028043722931206,0.4483600001851276,0.07619201071826294,65,3,Adam,0.0008269465389423072,1,0.6027474265508952,True,COMPLETE
505,52.739999999999995,2025-01-20 12:08:22.913914,2025-01-20 12:10:32.542395,0 days 00:02:09.628481,1.0068452567411625,1.5578594711249614,0.4500542192499315,0.07131775261907534,65,3,Adam,0.6116617202358932,1,1.2001222171149688,True,COMPLETE
506,52.839999999999996,2025-01-20 12:09:16.224874,2025-01-20 12:12:08.500304,0 days 00:02:52.275430,1.0709368572589055,1.5673184702648164,0.4665588353721581,0.000591527359353699,64,3,Adam,0.00018916999568904482,1,1.2069629657671412,True,COMPLETE
507,50.8,2025-01-20 12:10:32.624549,2025-01-20 12:12:12.278401,0 days 00:01:39.653852,1.1077459314771099,1.5774131624816046,0.46603905747898605,0.049347267479273774,62,23,Adam,0.00018564633859688117,1,1.914751522923856,True,COMPLETE
508,52.410000000000004,2025-01-20 12:12:08.570928,2025-01-20 12:13:52.635547,0 days 00:01:44.064619,1.7099937589854206,1.602081878723924,0.5161172925208738,0.049582418872134326,62,4,Adam,0.0003059207208963697,2,1.912985462513805,True,COMPLETE
509,52.790000000000006,2025-01-20 12:12:12.359638,2025-01-20 12:13:40.925499,0 days 00:01:28.565861,1.0656022264679639,1.6056989667162638,0.5084530141225166,0.06763554317952099,66,4,Adam,0.04418726913597657,1,1.4487576800894386,True,COMPLETE
510,52.86,2025-01-20 12:13:41.026156,2025-01-20 12:15:31.737567,0 days 00:01:50.711411,1.0315155643084555,1.509609579355913,0.44118646728886285,0.035762203043854184,66,6,Adam,0.0003049533612126667,2,0.7788083371257898,True,COMPLETE
511,52.900000000000006,2025-01-20 12:13:52.702942,2025-01-20 12:15:43.417826,0 days 00:01:50.714884,1.0723376546389234,1.5156464231360514,0.48958005150166833,0.003134104962207943,67,6,Adam,0.0006162981345265496,1,2.2171362878834278,True,COMPLETE
512,52.92,2025-01-20 12:15:31.846609,2025-01-20 12:17:02.946000,0 days 00:01:31.099391,1.3793435458852574,1.613905877926361,0.489168795115382,0.06038602369494753,67,6,Adam,0.0006346365678296433,1,1.7135341630096161,True,COMPLETE
513,52.949999999999996,2025-01-20 12:15:43.493778,2025-01-20 12:17:26.199946,0 days 00:01:42.706168,1.1426254921466656,1.5571366816101282,0.46345454083008675,0.06032988009519766,63,4,Adam,0.0003988785776850246,1,1.5777362831824104,True,COMPLETE
514,53.1,2025-01-20 12:17:03.030960,2025-01-20 12:18:47.511195,0 days 00:01:44.480235,1.1022120862628355,1.5523478294551976,0.45692719706957247,0.0843431164885218,64,4,Adam,0.0003869847091041554,1,1.3720333622458591,True,COMPLETE
515,52.849999999999994,2025-01-20 12:17:26.263278,2025-01-20 12:19:30.465271,0 days 00:02:04.201993,1.3507818153508557,1.701652835855919,0.45069058900329323,0.08363883666899777,73,5,Adam,0.00024422041196065647,1,2.634892381291537,True,COMPLETE
516,52.83,2025-01-20 12:18:47.601114,2025-01-20 12:20:19.616961,0 days 00:01:32.015847,0.9907348133670911,1.6285839431584588,0.4361659654874374,0.09221610554990953,30,5,Adam,0.0004925207931061493,1,1.3670386786300743,True,COMPLETE
517,52.81,2025-01-20 12:19:30.540834,2025-01-20 12:21:31.211130,0 days 00:02:00.670296,1.085858856239247,1.6318390016547022,0.4319572881396194,0.09508459144985665,64,7,Adam,0.0004729766881955951,1,1.327767581567746,True,COMPLETE
518,52.839999999999996,2025-01-20 12:20:19.721338,2025-01-20 12:21:59.479085,0 days 00:01:39.757747,1.0679002265769386,1.7550331537703283,0.4751806498018899,0.0927803654381277,64,7,Adam,0.0004545632730569423,1,1.394410362347301,True,COMPLETE
519,52.75,2025-01-20 12:21:31.285001,2025-01-20 12:23:26.403050,0 days 00:01:55.118049,1.11226353058432,1.7552156659335572,0.47792451178238915,0.08513410855207637,62,8,Adam,0.00034056952772225255,1,1.1496260069877648,True,COMPLETE
520,52.86,2025-01-20 12:21:59.561272,2025-01-20 12:23:39.552492,0 days 00:01:39.991220,1.0927731180511946,1.8259678945866684,0.4777360166003809,0.08607791320623323,61,5,Adam,0.006207639194890581,1,1.631725479907462,True,COMPLETE
521,52.87,2025-01-20 12:23:26.465735,2025-01-20 12:25:05.499081,0 days 00:01:39.033346,1.1365036201692185,1.7030746857226153,0.49700517697273006,0.0802228315065704,61,5,Adam,0.000556137154289393,1,1.6214273907169972,True,COMPLETE
522,52.669999999999995,2025-01-20 12:23:39.652778,2025-01-20 12:25:22.898101,0 days 00:01:43.245323,1.1329013544337174,1.681066741943783,0.5031126927292654,0.07882190529134467,65,4,Adam,0.000694931003407505,1,1.7247747439971406,True,COMPLETE
523,52.99,2025-01-20 12:25:05.566103,2025-01-20 12:26:41.957542,0 days 00:01:36.391439,1.1790719783590446,1.5827408405915975,0.44935884636411316,0.04317754368015213,65,4,Adam,0.0007205111569289828,1,1.80503368660997,True,COMPLETE
524,50.01,2025-01-20 12:25:22.982512,2025-01-20 12:27:22.902287,0 days 00:01:59.919775,1.1926331862964679,1.5909004620483496,0.4484716208548991,0.03966039985074418,64,26,Adam,0.0003734921562828957,1,2.3719595789535894,True,COMPLETE
525,52.78,2025-01-20 12:26:42.023477,2025-01-20 12:28:23.757104,0 days 00:01:41.733627,1.0493246860006256,1.6613160480758258,0.4201961814886552,0.05267102797961659,63,6,Adam,0.0003845833855300097,1,1.0751373790707164,True,COMPLETE
526,52.800000000000004,2025-01-20 12:27:22.992743,2025-01-20 12:29:18.588728,0 days 00:01:55.595985,1.05117050450085,1.6538661061288487,0.42278846079233007,0.05353699615859025,63,6,Adam,0.0004244597237027013,1,0.9762413955259706,True,COMPLETE
527,52.349999999999994,2025-01-20 12:28:23.817707,2025-01-20 12:29:49.228614,0 days 00:01:25.410907,1.2257058743558409,1.7267135865211625,0.4704609333632217,0.07048279313232103,66,11,Adam,0.0002570757442541023,1,2.0972519320128122,True,COMPLETE
528,52.88,2025-01-20 12:29:18.694372,2025-01-20 12:30:51.240490,0 days 00:01:32.546118,1.1528317252873028,1.734377103972946,0.4667461282478886,0.099818863756955,67,7,Adam,0.46244517421970827,1,2.0791459110243715,True,COMPLETE
529,52.93,2025-01-20 12:29:49.291667,2025-01-20 12:31:28.892661,0 days 00:01:39.600994,1.1490510390402038,1.561742625820172,0.4609244148113661,0.07439493071007533,75,7,Adam,0.0005318405776141018,1,1.4752182920193029,True,COMPLETE
530,52.839999999999996,2025-01-20 12:30:51.332646,2025-01-20 12:33:45.670317,0 days 00:02:54.337671,1.237950575536525,1.5427352503193983,0.5384492625422084,0.07338752718194855,74,5,Adam,0.000523022104694857,1,4.052518812756574,True,COMPLETE
531,52.88,2025-01-20 12:31:28.961362,2025-01-20 12:33:00.662534,0 days 00:01:31.701172,1.0952737882080401,1.624381553431947,0.436571879882746,0.06569934566728018,68,5,Adam,0.0003169452147085479,1,1.1867819101062853,True,COMPLETE
532,52.88,2025-01-20 12:33:00.722104,2025-01-20 12:34:41.141434,0 days 00:01:40.419330,1.1942841927457137,1.6977709598634283,0.4903194583400159,0.055823478868374236,74,3,Adam,0.0006140051720730967,2,1.4004752273816297,True,COMPLETE
533,52.81,2025-01-20 12:33:45.767773,2025-01-20 12:36:30.719062,0 days 00:02:44.951289,1.4228978529105685,1.7785645819452176,0.49421721875607566,0.04635970364245408,66,3,SGD,0.0006176897968920009,2,1.345610238496479,True,COMPLETE
534,52.65,2025-01-20 12:34:41.212474,2025-01-20 12:36:48.774923,0 days 00:02:07.562449,1.3069134445005364,1.7865887950307129,0.4044676487694413,0.0456338678034719,66,4,SGD,0.0004293886966023665,1,9.311759321456176,True,COMPLETE
535,52.449999999999996,2025-01-20 12:36:30.814918,2025-01-20 12:38:17.252346,0 days 00:01:46.437428,1.3153207881823712,1.4753840452619649,0.40087900801791343,0.06234269029244323,65,8,Adam,0.0004526187096424764,1,0.9073159168000182,True,COMPLETE
536,52.99,2025-01-20 12:36:48.841247,2025-01-20 12:38:27.731473,0 days 00:01:38.890226,1.2633065758839226,1.8514984537577401,0.45195670859190373,0.06346507340024558,68,6,Adam,0.00026955918052153777,1,0.10494754205297943,True,COMPLETE
537,52.93,2025-01-20 12:38:17.339744,2025-01-20 12:40:07.218284,0 days 00:01:49.878540,1.2601112657720352,1.6084750423563325,0.5160453244124362,0.055381856976465894,69,6,Adam,0.00021846508137117324,1,1.9315045680564953,True,COMPLETE
538,52.300000000000004,2025-01-20 12:38:27.792528,2025-01-20 12:40:08.114696,0 days 00:01:40.322168,1.194830673957338,1.6381750805910325,0.5164144015655372,0.05180833684349781,72,2,Adam,0.00034494497837241127,1,1.85946235390203,True,COMPLETE
539,53.02,2025-01-20 12:40:07.311036,2025-01-20 12:41:55.748382,0 days 00:01:48.437346,1.345257535240938,1.6797186712729026,0.43721552945135844,0.08518250201222974,72,5,Adam,0.00010567963227790141,1,0.454706615766636,True,COMPLETE
540,52.470000000000006,2025-01-20 12:40:08.190651,2025-01-20 12:41:34.311056,0 days 00:01:26.120405,1.3435982013606533,1.6749984834384912,0.4377313025087673,0.08927819553857513,61,9,Adam,0.00014681141616371314,1,1.5221372771591326,True,COMPLETE
541,52.669999999999995,2025-01-20 12:41:34.372981,2025-01-20 12:43:04.072870,0 days 00:01:29.699889,1.3822582004741057,1.5907962953196997,0.48315117199279334,0.06905529130044478,63,3,Adam,0.00010654760027226588,1,5.060566567082042,True,COMPLETE
542,52.7,2025-01-20 12:41:55.856931,2025-01-20 12:43:54.221060,0 days 00:01:58.364129,1.3925106071963107,1.5786330339814714,0.47750601874378246,0.06924761928795829,64,3,Adam,0.0004932217220499317,1,1.1470313325874022,True,COMPLETE
543,52.96999999999999,2025-01-20 12:43:04.145521,2025-01-20 12:44:36.661942,0 days 00:01:32.516421,1.0303824071562575,1.7136278372754008,0.465034436076679,0.05923692724235334,64,4,Adam,0.007802276299687599,1,1.2010965249964722,True,COMPLETE
544,52.73,2025-01-20 12:43:54.307275,2025-01-20 12:45:54.879693,0 days 00:02:00.572418,1.2243185817892381,1.71474435809681,0.36323950837175967,0.059492381696758204,68,4,Adam,0.0007941704753214293,1,1.733380228999539,True,COMPLETE
545,52.839999999999996,2025-01-20 12:44:36.739070,2025-01-20 12:46:02.283540,0 days 00:01:25.544470,1.2349757513264656,1.632704601174897,0.45664720032297856,0.07735914477369908,68,7,Adam,0.0007898034239066188,1,1.6795494444148722,True,COMPLETE
546,51.690000000000005,2025-01-20 12:45:54.971640,2025-01-20 12:48:16.438572,0 days 00:02:21.466932,1.4912275546989773,1.6382978227630582,0.45434014350929813,0.050013256921592,73,16,Adam,0.0003837659171053222,1,0.29997939330614665,True,COMPLETE
547,52.980000000000004,2025-01-20 12:46:02.361165,2025-01-20 12:47:38.520333,0 days 00:01:36.159168,1.2955694620842855,1.5517522319407808,0.42015265875477636,0.05131874341852308,73,5,Adam,0.00036032110730139366,1,0.2938005402955095,True,COMPLETE
548,53.02,2025-01-20 12:47:38.583344,2025-01-20 12:49:14.995737,0 days 00:01:36.412393,1.2856975747556059,1.5024295180656155,0.44968639663999777,0.047408578949818585,70,6,Adam,0.0002850292450116274,1,0.834634609636276,True,COMPLETE
549,52.92,2025-01-20 12:48:16.518721,2025-01-20 12:50:40.924074,0 days 00:02:24.405353,1.2861012757291925,1.4987392450293822,0.4806938100129048,0.04257305760739472,70,6,Adam,0.0005544877134449497,1,0.7269389808823369,True,COMPLETE
550,51.66,2025-01-20 12:49:15.062951,2025-01-20 12:51:05.318220,0 days 00:01:50.255269,1.1792652436674362,1.6618852111170552,0.4880925657266489,0.0643294809286784,66,1,Adam,0.07625700138246039,1,7.146844273882466,True,COMPLETE
551,52.88,2025-01-20 12:50:41.005808,2025-01-20 12:52:53.737351,0 days 00:02:12.731543,1.2473786284552957,1.6707213556307388,0.5038552564957451,0.06397565094416738,75,5,Adam,0.0004582617865059232,1,2.3314978859467606,True,COMPLETE
552,52.93,2025-01-20 12:51:05.378995,2025-01-20 12:52:38.612671,0 days 00:01:33.233676,1.3191890763442473,1.6070756246264384,0.4288878241743959,0.0801997941378915,75,5,Adam,0.0004518137852108997,1,1.4273089416396583,True,COMPLETE
553,52.839999999999996,2025-01-20 12:52:38.665619,2025-01-20 12:54:38.775295,0 days 00:02:00.109676,1.112015619796389,1.743604318960216,0.5045882758822848,0.05663772432559113,67,7,Adam,0.0006702403160100723,1,0.5136938704329015,True,COMPLETE
554,52.800000000000004,2025-01-20 12:52:53.832213,2025-01-20 12:54:55.573025,0 days 00:02:01.740812,1.1035261731396782,1.9392596389074237,0.4602659089688494,0.05614576134871225,67,7,Adam,0.0006295312034446537,1,0.10031896445041245,True,COMPLETE
555,52.839999999999996,2025-01-20 12:54:38.853072,2025-01-20 12:56:18.837588,0 days 00:01:39.984516,1.3505145544777484,1.91924570714022,0.46667232345252124,0.07190746090188176,65,4,Adam,0.0003230095517881036,1,0.10026248357871823,True,COMPLETE
556,52.44,2025-01-20 12:54:55.653995,2025-01-20 12:56:33.052551,0 days 00:01:37.398556,1.4255872598620034,1.5412170585075398,0.3866386435830105,0.07556955115832246,60,6,Adam,0.00024391356805966927,2,0.9919798662886443,True,COMPLETE
557,52.78,2025-01-20 12:56:18.913281,2025-01-20 12:58:05.991527,0 days 00:01:47.078246,1.4548694133812956,1.8868014772704411,0.41367929372075485,0.022629164656212987,71,4,Adam,0.0005422230183674217,2,1.5769802291587098,True,COMPLETE
558,52.73,2025-01-20 12:56:33.172495,2025-01-20 12:58:37.608824,0 days 00:02:04.436329,1.458584254715563,1.8152794260010123,0.41367308143199233,0.09198947445683846,72,2,Adam,0.0005374466319355063,1,1.2416374905217402,True,COMPLETE
559,52.470000000000006,2025-01-20 12:58:06.070179,2025-01-20 12:59:29.668250,0 days 00:01:23.598071,1.2049436912006517,1.8134061429978379,0.44404854763762047,0.09946605858339806,62,2,Adam,0.00043362788120032496,1,1.226785800397996,True,COMPLETE
560,52.92,2025-01-20 12:58:37.706341,2025-01-20 13:00:37.365507,0 days 00:01:59.659166,1.2096269624011216,1.593566620049195,0.4426620461692138,0.05471381739728577,69,5,Adam,0.0004095854521775023,1,2.01522447317676,True,COMPLETE
