number,value,datetime_start,datetime_complete,duration,params_gamma_1,params_gamma_2,params_lambda,params_lr,params_n_clusters,params_n_points,params_optimizer,params_reg_lambda,params_reg_type,params_tanh_x,params_use_tanh,state
561,51.25999999999999,2025-01-20 12:59:29.739502,2025-01-20 13:00:59.779226,0 days 00:01:30.039724,1.2734265667618754,1.6919852517970102,0.5277937612555391,0.03815399907520533,63,19,Adam,0.00017241331375487858,1,1.9372909497967257,True,COMPLETE
562,46.660000000000004,2025-01-20 13:00:37.476895,2025-01-20 13:02:27.813992,0 days 00:01:50.337097,1.2656947776835525,1.6879035586131346,0.4719021823103436,0.06727260095691946,63,40,Adam,0.0001744981006714371,1,1.4911694805270899,True,COMPLETE
563,52.87,2025-01-20 13:00:59.854621,2025-01-20 13:02:33.803448,0 days 00:01:33.948827,1.3241247545710157,1.6391162805050494,0.4722388891113762,0.025958457568507943,65,4,Adam,0.15850846959345574,1,0.4457924788840957,True,COMPLETE
564,52.959999999999994,2025-01-20 13:02:27.899448,2025-01-20 13:05:28.821432,0 days 00:03:00.921984,1.3228093776773262,1.6401363941272744,0.4293794784677329,0.059531528112214946,74,4,Adam,0.0003211514393592043,1,0.6498644394250058,True,COMPLETE
565,52.849999999999994,2025-01-20 13:02:33.878139,2025-01-20 13:04:12.434467,0 days 00:01:38.556328,1.371049337149135,1.7639790241456568,0.4295543096182294,0.06123304973113178,74,6,Adam,0.0003339835139501673,1,1.7518731311454083,True,COMPLETE
566,52.790000000000006,2025-01-20 13:04:12.495980,2025-01-20 13:05:58.938414,0 days 00:01:46.442434,1.1596106433262596,1.4607685858837662,0.4929316645116613,0.04856603627912547,71,8,Adam,0.00022058931953303158,1,0.9709924090096607,True,COMPLETE
567,52.92,2025-01-20 13:05:28.903677,2025-01-20 13:07:36.759433,0 days 00:02:07.855756,1.1365303657027053,1.5788861832327032,0.49330502990665087,0.04876310787276996,71,5,Adam,0.0006695210775245119,1,1.0058037124317365,True,COMPLETE
568,52.93,2025-01-20 13:05:59.016499,2025-01-20 13:07:38.367322,0 days 00:01:39.350823,1.3989140689236075,1.7324192726898093,0.45288103289905385,0.08289329512526925,69,5,Adam,0.11577057026086998,1,2.1651753547541093,True,COMPLETE
569,52.89,2025-01-20 13:07:36.865297,2025-01-20 13:09:39.760914,0 days 00:02:02.895617,1.2403287512240841,1.7260996122214118,0.4548528894190217,0.0007717476031976346,69,3,Adam,0.0005002700365697375,1,1.550253510821175,True,COMPLETE
570,52.78,2025-01-20 13:07:38.427462,2025-01-20 13:09:18.757738,0 days 00:01:40.330276,1.2524192736860835,1.5310312654602183,0.47786118846571435,0.07223416014110003,66,3,Adam,0.00012806216532165973,1,1.4894622265890904,True,COMPLETE
571,52.86,2025-01-20 13:09:18.811001,2025-01-20 13:11:18.771793,0 days 00:01:59.960792,1.2899088753070833,1.6252277521439968,0.46476930655743803,0.05566145076836952,73,6,Adam,0.0003869762710066794,1,1.3002354862831547,True,COMPLETE
572,52.51,2025-01-20 13:09:39.858935,2025-01-20 13:11:24.993643,0 days 00:01:45.134708,1.3005769778069523,1.609041016048954,0.5571368770467412,0.0532086968004068,73,8,Adam,0.00037859305492086894,1,1.3430588575140545,True,COMPLETE
573,52.6,2025-01-20 13:11:18.848304,2025-01-20 13:15:19.189816,0 days 00:04:00.341512,1.3422885247962884,1.6694161084265253,0.4391990102329764,0.06656923336996472,65,8,SGD,0.0005778894350690673,1,4.4275609979601995,True,COMPLETE
574,52.92,2025-01-20 13:11:25.096350,2025-01-20 13:14:44.517993,0 days 00:03:19.421643,1.356236332575415,1.6778588813866782,0.4451061821530389,0.06565696441529761,16,4,SGD,0.0008530621770957308,1,0.31562724220623495,True,COMPLETE
575,52.5,2025-01-20 13:14:44.617527,2025-01-20 13:16:26.692405,0 days 00:01:42.074878,1.2037946412398701,1.5603867180557032,0.5105454303823996,0.043040373281516414,64,9,Adam,0.00027197580021801017,1,1.7634532906326927,True,COMPLETE
576,47.31,2025-01-20 13:15:19.256957,2025-01-20 13:16:51.981667,0 days 00:01:32.724710,0.9655758305349591,1.5786111168124055,0.9203086314624634,0.07495362889377792,67,6,Adam,0.01973530330331984,1,1.805859727973102,True,COMPLETE
577,52.04,2025-01-20 13:16:26.788734,2025-01-20 13:18:34.564323,0 days 00:02:07.775589,1.0749663355601984,0.5556602648056855,0.3926114319741161,0.0009100523290841767,67,6,Adam,0.012663574938464454,1,1.121103530333841,True,COMPLETE
578,52.68000000000001,2025-01-20 13:16:52.048300,2025-01-20 13:18:28.123639,0 days 00:01:36.075339,1.2866245709288713,1.7821381416736317,0.4159198371207081,0.08401413018814677,61,7,Adam,0.00043382016770330043,1,0.7988896406213952,True,COMPLETE
579,52.96999999999999,2025-01-20 13:18:28.226622,2025-01-20 13:20:15.395045,0 days 00:01:47.168423,1.393419211841647,1.7018659851634137,0.4815822842758327,0.06087750086672466,68,5,Adam,0.0004975089080270215,1,9.980026293493106,True,COMPLETE
580,52.83,2025-01-20 13:18:34.680509,2025-01-20 13:20:30.390020,0 days 00:01:55.709511,1.0194234018744384,1.7087222064307077,0.4857546063847242,0.06076025552925398,70,5,Adam,0.0004942182286598405,1,2.5377920144392903,True,COMPLETE
581,52.949999999999996,2025-01-20 13:20:15.473151,2025-01-20 13:21:55.678662,0 days 00:01:40.205511,1.1695425022921444,1.6462399651490802,0.4644623748379666,0.053720700290415,70,7,Adam,0.0007110081137644763,1,2.512187166842362,True,COMPLETE
582,52.910000000000004,2025-01-20 13:20:30.485873,2025-01-20 13:22:34.259954,0 days 00:02:03.774081,1.1723033155928204,1.6559435028301845,0.46196434812377285,0.05165126114116431,72,7,Adam,0.0007062983305419843,2,3.104032047369868,True,COMPLETE
583,53.13,2025-01-20 13:21:55.744927,2025-01-20 13:23:31.264383,0 days 00:01:35.519456,1.235821389705978,1.610734004461446,0.4302792162797227,0.07050259962024942,72,4,Adam,0.00032014058295504774,2,0.5275701028882526,True,COMPLETE
584,52.78,2025-01-20 13:22:34.371584,2025-01-20 13:24:21.406423,0 days 00:01:47.034839,1.2439427375867576,1.611544334462738,0.498318445292652,0.0708368365620081,66,4,Adam,0.00026943956412863617,1,0.4852411795594045,True,COMPLETE
585,52.72,2025-01-20 13:23:31.338139,2025-01-20 13:28:06.892451,0 days 00:04:35.554312,1.2187612543245678,1.6112923429485209,0.41126470190128844,0.0011693258946278565,69,3,Adam,0.0003463947902558606,1,0.5901594991253112,True,COMPLETE
586,52.900000000000006,2025-01-20 13:24:21.512747,2025-01-20 13:26:04.585619,0 days 00:01:43.072872,1.2259188495035875,1.7492303098880324,0.40132985386970954,0.04453076240646628,69,5,Adam,0.0003575845941847769,2,5.823658986575401,True,COMPLETE
587,52.849999999999994,2025-01-20 13:26:04.675747,2025-01-20 13:28:12.302556,0 days 00:02:07.626809,1.2046600481800218,1.619150218599298,0.4224580397016575,0.057756949377327546,71,3,Adam,0.0005975023136446293,2,0.6344853085246345,True,COMPLETE
588,53.11,2025-01-20 13:28:06.968528,2025-01-20 13:29:43.002047,0 days 00:01:36.033519,1.25351868311372,1.657091024864377,0.42868670314972535,0.06254025101075161,71,6,Adam,0.000574936842463527,2,0.3121259717125807,True,COMPLETE
589,52.81,2025-01-20 13:28:12.401301,2025-01-20 13:30:17.451910,0 days 00:02:05.050609,1.2510533351786841,1.6699539373792136,0.4344402582079077,0.06596032515094435,62,6,Adam,0.00044349066351251045,2,8.501058945804319,True,COMPLETE
590,52.94,2025-01-20 13:29:43.066413,2025-01-20 13:31:16.889065,0 days 00:01:33.822652,1.128654335967741,1.644713090152246,0.4225483283536567,0.06928121035888415,68,5,Adam,0.0008692387121580241,1,0.7891783045842318,True,COMPLETE
591,52.76,2025-01-20 13:30:17.546237,2025-01-20 13:32:27.425101,0 days 00:02:09.878864,1.1193323752769422,1.6445328291520336,0.3920881973208434,0.03134871917442012,68,5,Adam,0.0008361094063027711,2,0.8505233860573314,True,COMPLETE
592,52.59,2025-01-20 13:31:16.955545,2025-01-20 13:32:48.932275,0 days 00:01:31.976730,1.2877295830455655,1.5875341872574145,0.37222172789453994,0.049579491532812395,66,4,Adam,0.0005648309258170833,2,0.41605292378059167,True,COMPLETE
593,52.88,2025-01-20 13:32:27.513426,2025-01-20 13:34:29.235870,0 days 00:02:01.722444,1.1724860460289457,1.5825731474784632,0.40725864454575095,0.04821003635209275,71,4,Adam,0.0005282658269013113,2,0.41800952972574995,True,COMPLETE
594,52.959999999999994,2025-01-20 13:32:49.000372,2025-01-20 13:34:23.973065,0 days 00:01:34.972693,1.1843397058511593,1.5990011916957423,0.4042449557615853,0.058108485998813936,70,6,Adam,0.0006316994948183637,2,0.34871097457365074,True,COMPLETE
595,53.03,2025-01-20 13:34:24.045732,2025-01-20 13:36:26.339815,0 days 00:02:02.294083,1.2403476888957292,1.981860367562398,0.4287050987588604,0.039113801027177694,64,4,Adam,0.0005298103076306398,2,1.0871440596215431,True,COMPLETE
596,52.910000000000004,2025-01-20 13:34:29.317646,2025-01-20 13:36:00.855285,0 days 00:01:31.537639,1.228950308115699,1.9932341595907617,0.4364106528421828,0.07836080012045787,65,5,Adam,0.0004364656911253977,2,6.4123293199998805,True,COMPLETE
597,52.87,2025-01-20 13:36:00.974802,2025-01-20 13:37:53.612727,0 days 00:01:52.637925,1.2770256286911392,1.6870327172033166,0.42950338412705125,0.04126014139571087,64,6,Adam,0.0006357569401499786,2,1.0923939330979342,True,COMPLETE
598,52.7,2025-01-20 13:36:26.411065,2025-01-20 13:38:11.761372,0 days 00:01:45.350307,0.8349382205169072,1.6752046898221808,0.41931217936023524,0.062348754890037335,67,6,Adam,0.0006429409193070409,2,0.6603940153135276,True,COMPLETE
599,52.910000000000004,2025-01-20 13:37:53.702447,2025-01-20 13:39:43.863464,0 days 00:01:50.161017,1.3177195781848432,1.5528112253822652,0.4419381353404211,0.06387327621851595,69,5,Adam,0.0007301723188641603,2,0.6786493208256116,True,COMPLETE
600,52.94,2025-01-20 13:38:11.824487,2025-01-20 13:40:08.805109,0 days 00:01:56.980622,1.3143401838167812,1.5435085905186994,0.44171342240202344,0.05385505407352694,70,3,Adam,0.0004033883864464076,2,1.5998378460276297,True,COMPLETE
601,52.87,2025-01-20 13:39:43.955347,2025-01-20 13:41:58.053317,0 days 00:02:14.097970,1.267340876156733,1.6236489791081454,0.4470285720192525,0.052853221194519004,70,3,Adam,0.0004167279700464125,2,1.579451550976649,True,COMPLETE
602,52.94,2025-01-20 13:40:08.867968,2025-01-20 13:41:43.918069,0 days 00:01:35.050101,1.2645669800240449,1.6261206946852556,0.4511426085140424,0.07011494538645202,72,4,Adam,0.0010572320995890308,2,1.4022656895533878,True,COMPLETE
603,52.7,2025-01-20 13:41:43.978680,2025-01-20 13:43:31.922719,0 days 00:01:47.944039,1.1989616212137744,1.6570241881453545,0.3893803405149797,0.05378589847166437,66,6,Adam,0.0004769205194917916,2,0.9270856850240803,True,COMPLETE
604,52.76,2025-01-20 13:41:58.138076,2025-01-20 13:43:54.627212,0 days 00:01:56.489136,1.082322791030294,1.6623020817358105,0.38181977556031943,0.0898569930141441,66,6,Adam,0.0005017917518025331,2,1.3179608943945325,True,COMPLETE
605,52.89,2025-01-20 13:43:31.986992,2025-01-20 13:44:59.248519,0 days 00:01:27.261527,1.1508217955280948,1.712176489478084,0.4173457896429451,0.058712399093322244,68,5,Adam,0.0004820711148794896,2,0.310675549684937,True,COMPLETE
606,52.739999999999995,2025-01-20 13:43:54.719913,2025-01-20 13:45:39.894196,0 days 00:01:45.174283,1.5786535442261653,1.699066803655038,0.41513346422727865,0.07599730925675885,59,5,Adam,0.0005749254076750483,2,0.4840731326286048,True,COMPLETE
607,52.83,2025-01-20 13:44:59.315692,2025-01-20 13:47:35.387795,0 days 00:02:36.072103,1.3016462034711374,1.574216737536109,0.42883393029021466,0.07617467055124491,63,5,Adam,0.0005586958450322742,2,0.24749644155500378,True,COMPLETE
608,52.370000000000005,2025-01-20 13:45:40.014415,2025-01-20 13:48:09.311276,0 days 00:02:29.296861,1.2178376489156904,1.6092995316611551,0.4332550237005928,0.06735589905661411,62,2,SGD,0.0007666792939848217,2,1.2479566845669425,True,COMPLETE
609,52.94,2025-01-20 13:47:35.452456,2025-01-20 13:49:40.039815,0 days 00:02:04.587359,1.2133292517280172,1.6129793977401654,0.4570707897358498,0.04690194335078893,71,7,Adam,0.7156193200074347,2,1.2354898671767407,True,COMPLETE
610,52.94,2025-01-20 13:48:09.392604,2025-01-20 13:50:04.704483,0 days 00:01:55.311879,1.2606485261181195,1.6354133923815426,0.45574577309784936,0.06139327704619775,72,7,Adam,0.00038771005666020283,2,0.8791620459385916,True,COMPLETE
611,50.54,2025-01-20 13:49:40.181227,2025-01-20 13:51:03.814738,0 days 00:01:23.633511,1.3285318029535402,1.6546929670344206,0.34666105547385884,0.005016723556993926,68,21,Adam,0.0003332174544545573,2,0.8827243410552128,True,COMPLETE
612,52.790000000000006,2025-01-20 13:50:04.801077,2025-01-20 13:52:16.527502,0 days 00:02:11.726425,1.0424637903517624,1.683200935877192,0.4020176288693738,0.08420724941198425,68,4,Adam,0.00032071430419354545,1,1.7078744315529648,True,COMPLETE
613,52.959999999999994,2025-01-20 13:51:03.890701,2025-01-20 13:52:38.017091,0 days 00:01:34.126390,1.2903628608729778,1.5284748937693227,0.4456629473704136,0.03446312536401722,65,4,Adam,0.0006666137807927431,1,1.5983830778350887,True,COMPLETE
614,49.17,2025-01-20 13:52:16.815108,2025-01-20 13:53:47.644164,0 days 00:01:30.829056,1.2807182272675934,1.5240858248693818,0.443566731159095,0.0566210835116445,64,29,Adam,0.0004502429044958122,1,1.933984223018396,True,COMPLETE
615,51.839999999999996,2025-01-20 13:52:38.097225,2025-01-20 13:53:59.574231,0 days 00:01:21.477006,1.2438589953860775,1.7179419369810478,0.4645268978526647,0.057317734691071646,63,1,Adam,0.0004121124280600959,1,1.9600287037171316,True,COMPLETE
616,52.959999999999994,2025-01-20 13:53:47.745382,2025-01-20 13:55:38.747462,0 days 00:01:51.002080,1.3340175079888867,1.729304668872919,0.4666379530341408,0.06406491937513784,72,7,Adam,0.0004015359611512744,1,0.6517950769720116,True,COMPLETE
617,51.94,2025-01-20 13:53:59.649683,2025-01-20 13:55:26.937541,0 days 00:01:27.287858,1.3336796712727728,0.3630740492411758,0.4250221404863445,0.06606705450518674,70,6,Adam,0.43559505458165887,1,1.4497167852712227,True,COMPLETE
618,52.51,2025-01-20 13:55:27.015100,2025-01-20 13:57:01.652301,0 days 00:01:34.637201,1.1876238262045873,1.5824092364266045,0.4685903759542319,0.044777302820957834,67,2,Adam,0.004880793597810746,1,1.0721869017708516,True,COMPLETE
619,52.559999999999995,2025-01-20 13:55:38.841449,2025-01-20 13:57:59.460986,0 days 00:02:20.619537,1.1659400575629735,1.584183383305442,0.410583743408956,0.04424225241934015,67,2,Adam,0.0005731999914128095,1,0.2772883358897795,True,COMPLETE
620,53.16,2025-01-20 13:57:01.725999,2025-01-20 13:58:39.873025,0 days 00:01:38.147026,1.1482112765557968,1.6425643996096873,0.43580628556702966,0.04972006131766428,61,4,Adam,0.0006008111490808361,1,0.1458518133518724,True,COMPLETE
621,52.22,2025-01-20 13:57:59.548858,2025-01-20 13:59:36.942736,0 days 00:01:37.393878,1.0942263542604171,1.6479233236181863,0.3232992903580353,0.07160021871317154,60,4,Adam,0.0008280034330449009,1,1.3998859076083727,True,COMPLETE
622,53.03,2025-01-20 13:58:39.948690,2025-01-20 14:00:15.060540,0 days 00:01:35.111850,1.2268192145409238,1.681957143993824,0.4485374779393716,0.04864701330024202,61,4,Adam,0.0009891636841299237,1,0.13864085369501666,True,COMPLETE
623,52.82,2025-01-20 13:59:37.032233,2025-01-20 14:01:52.373316,0 days 00:02:15.341083,1.202491191848174,1.6866874431874526,0.4483585272391321,0.049600792697893775,59,3,Adam,0.0005011295668491009,1,0.12263710715731158,True,COMPLETE
624,52.82,2025-01-20 14:00:15.125678,2025-01-20 14:01:38.575774,0 days 00:01:23.450096,1.1563333326520024,1.6986181526340365,0.4387914839934764,0.0819260100405315,58,3,Adam,0.000493492746904557,1,0.1799153384119311,True,COMPLETE
625,52.76,2025-01-20 14:01:38.641831,2025-01-20 14:03:05.020123,0 days 00:01:26.378292,1.2036814462409726,1.6455197320279198,0.4761482831025596,0.09081366682886118,62,4,Adam,0.0006611350643502125,1,0.473128663808628,True,COMPLETE
626,52.71,2025-01-20 14:01:52.493334,2025-01-20 14:03:37.152632,0 days 00:01:44.659298,1.2563109599649962,1.6412332512672612,0.4809685197502183,0.09205952621827275,71,3,Adam,0.0007016239825942778,2,0.42141176295735283,True,COMPLETE
627,52.900000000000006,2025-01-20 14:03:05.074985,2025-01-20 14:05:18.177089,0 days 00:02:13.102104,1.3685026529588273,1.7523255023056945,0.4602237177211581,0.03781734894495112,70,3,SGD,0.00037265684222905014,2,0.4414087899063179,True,COMPLETE
628,52.86,2025-01-20 14:03:37.254860,2025-01-20 14:05:41.655254,0 days 00:02:04.400394,1.363291144175514,1.7596107669791012,0.46051540256176043,0.040650202055985026,61,5,SGD,0.00036865593001287147,1,0.2727021922343065,True,COMPLETE
629,52.849999999999994,2025-01-20 14:05:18.237189,2025-01-20 14:06:49.977059,0 days 00:01:31.739870,1.2975573453375198,1.5504960634510305,0.4345924086222009,0.0716857573152556,61,5,Adam,0.0003108474604713354,1,0.24919799197428671,True,COMPLETE
630,52.66,2025-01-20 14:05:41.743914,2025-01-20 14:07:34.207134,0 days 00:01:52.463220,1.2964213850891668,0.9054396694034749,0.43235788709332124,0.07079069599879709,72,5,Adam,0.00030949530021966723,1,0.11247525674832758,True,COMPLETE
631,53.1,2025-01-20 14:06:50.056315,2025-01-20 14:08:38.794928,0 days 00:01:48.738613,1.2447214775941489,1.6103252678772888,0.4293714345105918,0.05944239041887143,72,4,Adam,0.00059394868318408,1,0.6458339525790204,True,COMPLETE
632,53.02,2025-01-20 14:07:34.307241,2025-01-20 14:09:49.787444,0 days 00:02:15.480203,1.2429245794350756,1.6056576403386333,0.47490132384857897,0.05971586727792592,69,4,Adam,0.0005687772707857609,1,0.5840933897563387,True,COMPLETE
633,52.75,2025-01-20 14:08:38.859121,2025-01-20 14:10:27.087546,0 days 00:01:48.228425,1.2407117692378915,1.597003579718189,0.48283360076074844,0.061705614126886486,73,3,Adam,0.00046281089649638133,1,0.631125735689381,True,COMPLETE
634,49.69,2025-01-20 14:09:49.897102,2025-01-20 14:12:01.844230,0 days 00:02:11.947128,1.2570731516829654,1.5722137414497726,0.7575278970616445,0.0638349533446695,72,2,Adam,0.0004476948023442313,1,0.5790284840861026,True,COMPLETE
635,52.89,2025-01-20 14:10:27.155545,2025-01-20 14:11:33.188022,0 days 00:01:06.032477,1.2691986492989251,1.5482385524310809,0.4476256733926008,0.08033422960165983,26,4,Adam,0.0004302259822176586,1,0.4573993768775677,True,COMPLETE
636,52.53,2025-01-20 14:11:33.262526,2025-01-20 14:13:21.191490,0 days 00:01:47.928964,1.3122656719368107,1.4981348319659669,0.4586806173915533,0.05259835704184382,73,2,Adam,0.0005358547468113969,1,0.7497203452600651,True,COMPLETE
637,52.78,2025-01-20 14:12:01.957416,2025-01-20 14:14:05.042592,0 days 00:02:03.085176,1.3230828932329237,1.721402745490017,0.4557882822120033,0.05267736818776438,73,3,Adam,0.0005629959244224668,1,0.32522385184925423,True,COMPLETE
638,52.88,2025-01-20 14:13:21.258225,2025-01-20 14:15:17.550769,0 days 00:01:56.292544,1.2136517181018929,1.7251181722063291,0.4184983048431451,0.0566327456808976,71,4,Adam,0.0007356725301384098,1,0.36648108375297084,True,COMPLETE
639,52.629999999999995,2025-01-20 14:14:05.137048,2025-01-20 14:16:38.967425,0 days 00:02:33.830377,1.8265762192343216,1.61123173991902,0.4337903193083855,0.09911933226415058,72,4,Adam,0.0003655364426913129,1,1.8416820864964791,True,COMPLETE
640,51.190000000000005,2025-01-20 14:15:17.623120,2025-01-20 14:17:04.934796,0 days 00:01:47.311676,1.2762003249546103,1.6690397154194794,0.6735739235586213,0.09979621115895813,71,4,Adam,0.000274040276796288,2,1.8022232369400235,True,COMPLETE
641,52.839999999999996,2025-01-20 14:16:39.059350,2025-01-20 14:18:12.807482,0 days 00:01:33.748132,1.2752975211054278,1.6674155237904684,0.4913907803594964,0.06940919441093393,36,5,Adam,0.00046021409844279707,2,0.10098021686426648,True,COMPLETE
642,52.92,2025-01-20 14:17:05.009026,2025-01-20 14:18:32.085780,0 days 00:01:27.076754,1.2292381031648956,1.6649736899271095,0.4883304762982436,0.06945132063786383,70,5,Adam,0.0004674790064997026,1,0.7512495055583779,True,COMPLETE
643,52.900000000000006,2025-01-20 14:18:12.891736,2025-01-20 14:19:50.783949,0 days 00:01:37.892213,1.4113185720995225,1.8690325610243708,0.4709820211176971,0.07800271302671553,70,3,Adam,0.0006236650657733321,1,0.7762885060439726,True,COMPLETE
644,51.88,2025-01-20 14:18:32.160787,2025-01-20 14:20:06.623646,0 days 00:01:34.462859,1.4055786037475098,1.5654698847940631,0.6179021661425527,0.07755180717628249,69,3,Adam,0.009659715417505115,1,3.574208922517431,True,COMPLETE
645,52.38,2025-01-20 14:19:50.878017,2025-01-20 14:21:36.957456,0 days 00:01:46.079439,1.1834689066042465,1.5586694416635098,0.587988587747443,0.045403529061560755,69,4,Adam,0.00090296895450875,1,2.1682610924403667,True,COMPLETE
646,52.99,2025-01-20 14:20:06.685871,2025-01-20 14:22:07.210650,0 days 00:02:00.524779,1.1869547267041716,1.6221145507015053,0.44532478437959955,0.04514122074199208,73,5,Adam,0.0008823133120408856,1,2.1537712844325654,True,COMPLETE
647,52.87,2025-01-20 14:21:37.052678,2025-01-20 14:23:46.430186,0 days 00:02:09.377508,1.347059357388223,1.6205163435937213,0.4440175463867284,0.06044281867700062,73,5,Adam,0.0003679512504893398,1,0.5709286912360959,True,COMPLETE
648,51.970000000000006,2025-01-20 14:22:07.267320,2025-01-20 14:23:53.395764,0 days 00:01:46.128444,1.3332832717625382,1.7001093512227012,0.40948863724262285,0.060503077270144145,74,1,Adam,0.0003566949168831274,1,0.5577446631560037,True,COMPLETE
649,50.529999999999994,2025-01-20 14:23:46.548568,2025-01-20 14:25:47.309308,0 days 00:02:00.760740,1.3022081660531508,0.2354454912266306,0.4088917976519282,0.05066214217529252,71,1,Adam,0.00029499749581481956,1,1.681449628259132,True,COMPLETE
650,52.26,2025-01-20 14:23:53.469822,2025-01-20 14:25:35.014133,0 days 00:01:41.544311,1.99125455464721,1.5234806763455024,0.5222095811970097,0.0501977083959954,71,4,Adam,0.00025243896797035015,1,0.25000030374175514,True,COMPLETE
651,52.410000000000004,2025-01-20 14:25:35.077457,2025-01-20 14:26:13.941385,0 days 00:00:38.863928,1.294905304018274,1.7888036890105028,0.507140818574364,0.06678958427483814,10,4,Adam,0.0005594639386714167,1,1.6327700878477742,True,COMPLETE
652,52.83,2025-01-20 14:25:47.420535,2025-01-20 14:27:14.258403,0 days 00:01:26.837868,1.2264406671285175,1.8004850550196738,0.5052837498574481,0.06579277172742497,68,5,Adam,0.0005382549517907082,1,1.5199116733673543,True,COMPLETE
