number,value,datetime_start,datetime_complete,duration,params_gamma_1,params_gamma_2,params_lambda,params_lr,params_n_clusters,params_n_points,params_optimizer,params_reg_lambda,params_reg_type,params_tanh_x,params_use_tanh,state
1041,52.89,2025-01-21 02:31:53.846478,2025-01-21 02:34:18.495798,0 days 00:02:24.649320,1.0856522908626136,1.2852577602628312,0.40533228464915394,0.021014087959925876,16,4,SGD,0.0008615543561907694,2,,False,COMPLETE
1042,52.49,2025-01-21 02:32:21.008486,2025-01-21 02:35:41.579261,0 days 00:03:20.570775,1.0215374763102238,1.283169225524291,0.3563532273873437,0.02480027183306457,16,4,SGD,0.0009338353306091673,0,,False,COMPLETE
1043,53.06999999999999,2025-01-21 02:34:18.606072,2025-01-21 02:36:44.451353,0 days 00:02:25.845281,1.047170122447243,1.3585591879924406,0.4575759144021608,0.02324444650846046,17,4,SGD,0.0010475478455903324,0,,False,COMPLETE
1044,53.05,2025-01-21 02:35:41.679649,2025-01-21 02:38:08.421009,0 days 00:02:26.741360,0.942205550270606,1.3578411765973901,0.4586981082875918,0.02129900279222878,18,4,SGD,0.0011882550859575027,2,,False,COMPLETE
1045,52.839999999999996,2025-01-21 02:36:44.559213,2025-01-21 02:38:59.794593,0 days 00:02:15.235380,0.943897104646605,1.3286412627665132,0.4189899910886094,0.028176984412112655,14,4,SGD,0.0011871083229276292,2,,False,COMPLETE
1046,52.849999999999994,2025-01-21 02:38:08.541520,2025-01-21 02:54:45.793761,0 days 00:16:37.252241,1.056421725309127,1.388188057259811,0.41561480483442526,0.02368192513232075,14,4,SGD,0.0007580902700915462,2,,False,COMPLETE
1047,53.09,2025-01-21 02:38:59.916193,2025-01-21 02:55:48.750226,0 days 00:16:48.834033,0.9818526568311593,1.3884221994028945,0.4381626232231121,0.02430582892635306,19,3,SGD,0.0007962035375103012,2,,False,COMPLETE
1048,52.82,2025-01-21 02:54:45.906168,2025-01-21 03:11:38.776323,0 days 00:16:52.870155,0.8121155797687145,1.3114120257345436,0.436279255991948,0.019499134324070896,20,3,SGD,0.0013462847456482175,2,,False,COMPLETE
1049,52.690000000000005,2025-01-21 02:55:48.863878,2025-01-21 03:00:14.141617,0 days 00:04:25.277739,0.806022482035864,1.4497406431494224,0.3952022020513045,0.03391098882113765,20,3,SGD,0.001008804419442233,2,,False,COMPLETE
1050,53.23,2025-01-21 03:00:14.243648,2025-01-21 03:02:50.369211,0 days 00:02:36.125563,1.0008145740424477,1.3174291197773158,0.4313625698266278,0.03600039362134027,18,4,SGD,0.0013630587040461357,2,,False,COMPLETE
1051,52.78,2025-01-21 03:02:50.464618,2025-01-21 03:19:45.971737,0 days 00:16:55.507119,0.9980915463834055,1.2950434086100242,0.41245568853342046,0.0318806432260214,19,5,SGD,0.0013375018967097794,2,,False,COMPLETE
1052,53.15,2025-01-21 03:11:38.879083,2025-01-21 03:15:07.080260,0 days 00:03:28.201177,0.9862446864451562,1.259634330834961,0.4068530273771611,0.017261787792418683,18,4,SGD,0.0009516833074955496,2,,False,COMPLETE
1053,52.739999999999995,2025-01-21 03:15:07.185295,2025-01-21 03:32:01.342808,0 days 00:16:54.157513,0.8779093733291786,1.2433120392919423,0.3696691774175306,0.020588118545784895,18,4,SGD,0.001039489337579823,2,,False,COMPLETE
1054,52.790000000000006,2025-01-21 03:19:46.101599,2025-01-21 03:24:10.414075,0 days 00:04:24.312476,0.8751903184826392,1.253369453844823,0.37168763821004414,0.017196762295313056,18,4,SGD,0.0010461615257567167,2,,False,COMPLETE
1055,52.690000000000005,2025-01-21 03:24:10.523327,2025-01-21 03:41:02.507897,0 days 00:16:51.984570,0.9178518954074323,1.2155914907531684,0.3830911094128058,0.029439087724986948,16,4,SGD,0.0009405057490722477,2,,False,COMPLETE
1056,52.81,2025-01-21 03:32:01.450149,2025-01-21 03:50:32.186599,0 days 00:18:30.736450,0.9649596604037664,1.2807630247384467,0.38892691614546177,0.020209928678394076,16,4,SGD,0.0009070174944612127,2,,False,COMPLETE
1057,52.89,2025-01-21 03:41:02.638842,2025-01-21 03:43:24.080093,0 days 00:02:21.441251,0.96715461724357,1.2383428321898071,0.3904874845369264,0.027865696195441967,21,5,SGD,0.0011845841716899026,2,,False,COMPLETE
1058,52.900000000000006,2025-01-21 03:43:24.179010,2025-01-21 03:46:57.458284,0 days 00:03:33.279274,1.006325847824046,1.2903475584857516,0.3982936076086262,0.021873893729897224,17,4,SGD,0.001215138213421899,2,,False,COMPLETE
1059,53.04,2025-01-21 03:46:57.571555,2025-01-21 03:50:48.026953,0 days 00:03:50.455398,0.9365302550569266,1.2672599631398842,0.40215873840995764,0.01781931015245329,18,4,SGD,0.023974732384217188,2,,False,COMPLETE
1060,53.2,2025-01-21 03:50:32.290641,2025-01-21 03:53:00.446065,0 days 00:02:28.155424,0.9993951373723109,1.3116076407186692,0.4099342369066146,0.025999580748808163,18,4,SGD,0.0013865268751304678,2,,False,COMPLETE
1061,52.839999999999996,2025-01-21 03:50:48.331990,2025-01-21 04:07:45.777650,0 days 00:16:57.445660,1.0075519285108314,1.3477544032232347,0.40599097998985706,0.02504940850355453,19,5,SGD,0.0013476159981631857,2,,False,COMPLETE
1062,53.059999999999995,2025-01-21 03:53:00.565539,2025-01-21 04:09:39.719514,0 days 00:16:39.153975,1.0233484739403151,1.3394562698132857,0.41935948514188226,0.02718908220215368,20,3,SGD,0.0013940660126070374,2,,False,COMPLETE
1063,52.89,2025-01-21 04:07:45.871589,2025-01-21 04:11:15.457289,0 days 00:03:29.585700,1.0362388681924428,1.3201614622833227,0.42157595046295754,0.025092969229841694,22,3,SGD,0.016271539561805548,2,,False,COMPLETE
1064,52.99,2025-01-21 04:09:39.827386,2025-01-21 04:11:56.340443,0 days 00:02:16.513057,1.0266271693650593,1.319537438969999,0.42442963849595583,0.029539437746081167,15,4,SGD,0.0018362085144377077,2,,False,COMPLETE
1065,52.73,2025-01-21 04:11:15.592041,2025-01-21 04:14:43.520646,0 days 00:03:27.928605,0.9669327997504743,1.3140947833408867,0.38465539161406304,0.030606156912841492,15,4,SGD,0.0018808913162259048,2,,False,COMPLETE
1066,52.92,2025-01-21 04:11:56.431039,2025-01-21 04:15:19.100279,0 days 00:03:22.669240,0.9732480772038239,1.35917860392504,0.3896886801651192,0.034049819914734686,17,4,SGD,0.0014990597193505406,2,,False,COMPLETE
1067,52.94,2025-01-21 04:14:43.620847,2025-01-21 04:17:01.286947,0 days 00:02:17.666100,1.0089308203095748,1.3606965517845537,0.4067617504186049,0.03144619591443715,17,4,SGD,0.0014741886223639915,2,,False,COMPLETE
1068,53.080000000000005,2025-01-21 04:15:19.193682,2025-01-21 04:17:34.270179,0 days 00:02:15.076497,0.9182262730817133,1.3572757422574684,0.42516634886600285,0.028657465823416085,20,5,SGD,0.0012572569263358164,2,,False,COMPLETE
1069,52.839999999999996,2025-01-21 04:17:01.419463,2025-01-21 04:19:29.584707,0 days 00:02:28.165244,1.0612286908131248,1.384892987107091,0.4282474470354875,0.025904171745955055,27,5,SGD,0.0011765251387087653,2,,False,COMPLETE
1070,52.89,2025-01-21 04:17:34.385904,2025-01-21 04:20:52.602213,0 days 00:03:18.216309,1.072782819035484,1.3188415569757221,0.43035044876622314,0.02481408711167914,21,3,SGD,0.0011505376227119687,2,,False,COMPLETE
1071,52.55,2025-01-21 04:19:29.709895,2025-01-21 04:22:44.350655,0 days 00:03:14.640760,1.0638758103767052,1.3368632205581865,0.36321357137590327,0.034302449686936756,13,4,SGD,0.002271400716797726,2,,False,COMPLETE
1072,52.65,2025-01-21 04:20:52.730530,2025-01-21 04:24:08.586237,0 days 00:03:15.855707,1.0376178363801323,1.3115928516574322,0.4048660446897079,0.03473238995506234,13,4,SGD,0.0022416795687238526,2,,False,COMPLETE
1073,52.949999999999996,2025-01-21 04:22:44.460297,2025-01-21 04:26:50.698277,0 days 00:04:06.237980,0.9911941403890879,1.4137292846595377,0.4074647525075187,0.027144571616636675,19,3,SGD,0.00162239477062516,2,,False,COMPLETE
1074,52.96999999999999,2025-01-21 04:24:08.704362,2025-01-21 04:27:59.812270,0 days 00:03:51.107908,0.934749996772225,1.4128865080751323,0.4468742192867665,0.022917562917322273,19,3,SGD,0.0016879067765205589,2,,False,COMPLETE
1075,49.94,2025-01-21 04:26:50.804340,2025-01-21 04:28:07.028245,0 days 00:01:16.223905,0.9215568268517572,1.3912186246386118,0.4478703024397904,0.02860992757899244,16,11,SGD,0.0017324138755915746,2,,False,COMPLETE
1076,53.04,2025-01-21 04:27:59.915336,2025-01-21 04:30:22.013420,0 days 00:02:22.098084,1.0409393259271567,1.3815907108654621,0.418671138492575,0.029584143041710965,16,4,SGD,0.0012918426609008534,2,,False,COMPLETE
1077,53.12,2025-01-21 04:28:07.125691,2025-01-21 04:30:35.086502,0 days 00:02:27.960811,1.0034352553097998,1.2785341026979613,0.42861460959272146,0.031226854306731028,17,4,SGD,0.0013534507831003046,2,,False,COMPLETE
1078,53.23,2025-01-21 04:30:22.102479,2025-01-21 04:32:44.023320,0 days 00:02:21.920841,0.9892832878890039,1.2728549468498702,0.4312585060585564,0.03653854732446391,18,4,SGD,0.0011007400685552162,0,,False,COMPLETE
1079,53.1,2025-01-21 04:30:35.205402,2025-01-21 04:32:58.869264,0 days 00:02:23.663862,0.95375780056093,1.3498369981333695,0.4390850502699246,0.033648186622086663,23,5,SGD,0.001003789045018253,0,,False,COMPLETE
1080,52.81,2025-01-21 04:32:44.116840,2025-01-21 04:49:22.900171,0 days 00:16:38.783331,0.9632359801510584,1.2245076874362266,0.3992712989595632,0.03681719897588841,23,5,SGD,0.001432101024870148,0,,False,COMPLETE
1081,52.739999999999995,2025-01-21 04:32:58.961023,2025-01-21 04:35:21.400535,0 days 00:02:22.439512,0.9622180097894648,1.2379604773993573,0.3934476897308138,0.039498186172274685,20,5,SGD,0.0020195067677150577,2,,False,COMPLETE
1082,51.35999999999999,2025-01-21 04:35:21.507037,2025-01-21 04:38:52.988837,0 days 00:03:31.481800,0.43816724635753634,1.2423223348385946,0.41598027091319106,0.03350362905947431,21,3,SGD,0.00271090829596322,0,,False,COMPLETE
1083,53.06999999999999,2025-01-21 04:38:53.104793,2025-01-21 04:40:27.685756,0 days 00:01:34.580963,0.9746764254995252,1.2649012038284966,0.45918229537343536,0.03773565687383334,18,4,SGD,0.007672909700642409,0,,False,COMPLETE
1084,52.769999999999996,2025-01-21 04:40:27.779096,2025-01-21 04:57:03.570256,0 days 00:16:35.791160,1.0021144841740453,1.1793242836311362,0.40512178653253167,0.038586155651981584,19,5,SGD,0.0014174657007352592,0,,False,COMPLETE
1085,53.04,2025-01-21 04:49:23.009151,2025-01-21 04:51:50.373079,0 days 00:02:27.363928,0.900486854220342,1.3008530790329151,0.4136294812686002,0.0363162818947258,19,3,SGD,0.0011450177464690185,0,,False,COMPLETE
1086,52.35999999999999,2025-01-21 04:51:50.489259,2025-01-21 04:54:05.332075,0 days 00:02:14.842816,0.6370230736526817,1.2752102618595968,0.4712781594311001,0.03877022667212244,18,4,SGD,0.0014802741479992278,0,,False,COMPLETE
1087,53.04,2025-01-21 04:54:05.451408,2025-01-21 05:10:02.532350,0 days 00:15:57.080942,1.0030754598275475,1.3012817737561135,0.44946449625548013,0.031823238195925835,20,3,SGD,0.002008604640911099,0,,False,COMPLETE
1088,49.769999999999996,2025-01-21 04:57:03.687685,2025-01-21 04:58:40.201692,0 days 00:01:36.514007,0.9908107724482493,1.2083853631989023,0.4532454489067428,0.04174114832592589,20,13,SGD,0.0018600309963108293,0,,False,COMPLETE
1089,52.35999999999999,2025-01-21 04:58:40.302391,2025-01-21 05:01:19.900825,0 days 00:02:39.598434,0.9077784876462425,1.3011458178143014,0.37314163265378575,0.03390156539794918,11,4,SGD,0.0011381704733942819,0,,False,COMPLETE
1090,52.800000000000004,2025-01-21 05:01:20.016949,2025-01-21 05:05:38.971856,0 days 00:04:18.954907,1.021902915848627,1.3091325293885123,0.4355690496757087,0.03251933681166707,22,3,SGD,0.0008110145092245425,0,,False,COMPLETE
1091,52.89,2025-01-21 05:05:39.073102,2025-01-21 05:07:56.436368,0 days 00:02:17.363266,0.9322317594862986,1.4479270149966759,0.4219646199678137,0.040363434012812345,21,3,SGD,0.0016726381387736206,2,,False,COMPLETE
1092,52.910000000000004,2025-01-21 05:07:56.555534,2025-01-21 05:11:51.968377,0 days 00:03:55.412843,0.8605613209370955,1.277249359910746,0.38445819786872504,0.03595523380646641,18,4,SGD,0.002393093928549036,0,,False,COMPLETE
1093,53.05,2025-01-21 05:10:02.645117,2025-01-21 05:12:31.836602,0 days 00:02:29.191485,0.955661458250892,1.4281750366102708,0.4342614253285903,0.0361961809926796,15,4,SGD,0.0024698244157508563,0,,False,COMPLETE
1094,52.23,2025-01-21 05:11:52.069326,2025-01-21 05:28:17.276283,0 days 00:16:25.206957,1.757641903047218,1.420017548024125,0.432819826725842,0.042156696763807316,16,4,SGD,0.001263602047449964,0,,False,COMPLETE
1095,53.080000000000005,2025-01-21 05:12:31.953621,2025-01-21 05:14:00.382619,0 days 00:01:28.428998,1.0241020778943493,1.2128645770483921,0.41690158466879795,0.04229886843816952,17,4,SGD,0.0012706243872036903,2,,False,COMPLETE
1096,52.959999999999994,2025-01-21 05:14:00.497391,2025-01-21 05:16:29.240417,0 days 00:02:28.743026,1.045038658172152,1.3263153990963512,0.46433399566415484,0.029719666698031194,15,4,SGD,0.0008845255338740564,2,,False,COMPLETE
1097,51.89,2025-01-21 05:16:29.347303,2025-01-21 05:20:34.015996,0 days 00:04:04.668693,0.9882587747870581,1.3930246439788878,0.2974404888990787,0.04395558191253317,18,4,SGD,0.0010563454552485541,0,,False,COMPLETE
1098,52.94,2025-01-21 05:20:34.146281,2025-01-21 05:37:10.721932,0 days 00:16:36.575651,0.9463719522641735,1.3740387537013068,0.4474214358792173,0.03131788523181222,16,4,SGD,0.001401999202858732,0,,False,COMPLETE
1099,52.89,2025-01-21 05:28:17.382347,2025-01-21 05:35:06.649479,0 days 00:06:49.267132,0.9454465746160026,1.3672474443397156,0.4504616409306727,0.0053426397689266825,21,5,SGD,0.0015200445900209246,0,,False,COMPLETE
1100,52.86,2025-01-21 05:35:06.770655,2025-01-21 05:37:31.829636,0 days 00:02:25.058981,1.050121753910587,1.4540219108949264,0.4058059782564206,0.03224535147560174,26,5,SGD,0.0017918925213346343,0,,False,COMPLETE
1101,52.370000000000005,2025-01-21 05:37:10.870943,2025-01-21 05:39:21.824791,0 days 00:02:10.953848,1.0361197011196777,1.4573378506526466,0.3490025221267015,0.03707124285782699,19,5,SGD,0.0018643431092608528,2,,False,COMPLETE
1102,53.04,2025-01-21 05:37:31.923447,2025-01-21 05:40:43.579823,0 days 00:03:11.656376,1.0887178005395435,1.2596848356895396,0.42045167893442903,0.04015731217460543,19,3,SGD,0.0009293682907913408,0,,False,COMPLETE
1103,45.61,2025-01-21 05:39:21.947856,2025-01-21 05:40:30.042579,0 days 00:01:08.094723,1.100417803498709,1.2531032720735438,0.9512290895980537,0.03549578076021196,14,4,SGD,0.0009128043288391775,0,,False,COMPLETE
1104,53.26,2025-01-21 05:40:30.146263,2025-01-21 05:57:32.141340,0 days 00:17:01.995077,1.0101497932166377,1.3324181206316164,0.41974001914251663,0.04225536512069964,18,4,SGD,0.0011119428481714806,2,,False,COMPLETE
1105,53.080000000000005,2025-01-21 05:40:43.692871,2025-01-21 05:43:17.330420,0 days 00:02:33.637549,0.9935066316636166,1.3315266144085725,0.47175192953234407,0.027214850173969653,18,4,SGD,0.0011409658320475607,2,,False,COMPLETE
1106,52.7,2025-01-21 05:43:17.444578,2025-01-21 06:00:22.366366,0 days 00:17:04.921788,0.9026049355591861,1.415469912752599,0.39444232224817266,0.045013518759429334,22,3,SGD,0.0015376427060207587,2,,False,COMPLETE
1107,52.76,2025-01-21 05:57:32.250248,2025-01-21 06:13:32.676256,0 days 00:16:00.426008,0.9880588066721683,1.2842783827910762,0.38414142310166766,0.044122085590817976,22,5,SGD,0.00083488382660041,2,,False,COMPLETE
1108,52.88,2025-01-21 06:00:22.478218,2025-01-21 06:03:48.465130,0 days 00:03:25.986912,0.9783150868477524,1.3158563338432994,0.379905421222097,0.04233589869529043,17,4,SGD,0.0007876498047552621,2,,False,COMPLETE
1109,52.839999999999996,2025-01-21 06:03:48.583333,2025-01-21 06:06:07.174592,0 days 00:02:18.591259,0.9928170767528567,1.2881529327977232,0.3983852193370097,0.04107481844501458,20,5,SGD,0.00295986553884943,2,,False,COMPLETE
1110,53.02,2025-01-21 06:06:07.284674,2025-01-21 06:08:26.172203,0 days 00:02:18.887529,0.94528297456847,1.3352246800194942,0.40984417737816653,0.037610535799489864,17,4,SGD,0.0007620185755041018,2,,False,COMPLETE
1111,52.559999999999995,2025-01-21 06:08:26.289751,2025-01-21 06:11:48.568161,0 days 00:03:22.278410,1.0246255450645374,1.2869595541169865,0.36350550337879695,0.04526710662123087,15,4,SGD,0.0010653900087648253,2,,False,COMPLETE
1112,52.82,2025-01-21 06:11:48.659968,2025-01-21 06:15:11.302677,0 days 00:03:22.642709,0.9681946569362301,1.1383414360502497,0.3816908787114453,0.03635212730016692,20,3,SGD,0.001037824143672627,2,,False,COMPLETE
1113,53.1,2025-01-21 06:13:32.786274,2025-01-21 06:15:42.182776,0 days 00:02:09.396502,0.9106716558578483,1.3301544377973848,0.42328369035257785,0.038598239989843214,20,3,SGD,0.0012921182322009402,2,,False,COMPLETE
1114,53.14,2025-01-21 06:15:11.410683,2025-01-21 06:17:19.281976,0 days 00:02:07.871293,0.9033233238601368,1.3251498138407114,0.4181726933976723,0.040033538771333005,18,4,SGD,0.0013143134882152518,2,,False,COMPLETE
1115,52.94,2025-01-21 06:15:42.295003,2025-01-21 06:17:54.767556,0 days 00:02:12.472553,1.0380127507756192,1.2255644621254285,0.4025355545544592,0.03423644911613559,17,4,SGD,0.002109282601097413,2,,False,COMPLETE
1116,52.12,2025-01-21 06:17:19.613695,2025-01-21 06:34:00.532503,0 days 00:16:40.918808,1.015900597121102,1.2137825776712847,0.40088360701808773,0.033964314469859876,43,1,SGD,0.0016463057187307117,2,,False,COMPLETE
1117,52.51,2025-01-21 06:17:54.876734,2025-01-21 06:24:14.611728,0 days 00:06:19.734994,1.0097586338425426,1.3461787915374144,0.4135499951517295,0.030809308338300728,50,2,SGD,0.0016277601715521338,2,,False,COMPLETE
1118,52.93,2025-01-21 06:24:14.701526,2025-01-21 06:25:48.040501,0 days 00:01:33.338975,0.9544282691185557,1.3654128477193725,0.43432854964007417,0.04641338749800987,16,4,SGD,0.0010401374213469768,2,,False,COMPLETE
1119,52.75,2025-01-21 06:25:48.161686,2025-01-21 06:29:07.283120,0 days 00:03:19.121434,1.016180114758405,1.3050989071632098,0.39753564998354374,0.04386923926337629,14,4,SGD,0.0015307948050592964,0,,False,COMPLETE
1120,45.73,2025-01-21 06:29:07.382838,2025-01-21 06:40:55.387098,0 days 00:11:48.004260,1.059626055049086,1.3741235277921617,0.4267957199650986,0.035098598370483534,24,20,SGD,0.0009256829090705595,2,,False,COMPLETE
1121,52.96999999999999,2025-01-21 06:34:00.665708,2025-01-21 06:35:38.751129,0 days 00:01:38.085421,0.9763583857648371,1.3785637162406996,0.42753832098571154,0.039904458436609565,19,5,SGD,0.0009756991421214446,2,,False,COMPLETE
1122,49.16,2025-01-21 06:35:38.850694,2025-01-21 06:37:28.855742,0 days 00:01:50.005048,0.224368378197642,0.32006810294790766,0.4324735793419833,0.046247419328790326,24,5,SGD,0.0007751244222305314,2,,False,COMPLETE
1123,52.93,2025-01-21 06:37:28.958853,2025-01-21 06:39:51.790822,0 days 00:02:22.831969,1.0587327378048432,1.2603348556956888,0.4161373510273829,0.03563696891970544,21,3,SGD,0.001994389663374799,2,,False,COMPLETE
1124,53.010000000000005,2025-01-21 06:39:51.911455,2025-01-21 06:43:40.401471,0 days 00:03:48.490016,0.9311371417604409,1.3583703650703096,0.43008667170121556,0.03199336182267398,19,3,SGD,0.0011763242925691925,2,,False,COMPLETE
1125,53.13,2025-01-21 06:40:55.509238,2025-01-21 06:43:13.989083,0 days 00:02:18.479845,0.9330090568575451,1.185821086751792,0.43821363617708714,0.030470180717906897,18,4,SGD,0.001153143777845019,2,,False,COMPLETE
1126,45.23,2025-01-21 06:43:14.090812,2025-01-21 06:46:30.734839,0 days 00:03:16.644027,0.9806486312073311,1.3218744803815583,0.980512632873914,0.04192242134695343,16,4,SGD,0.0013356700693119784,2,,False,COMPLETE
1127,52.559999999999995,2025-01-21 06:43:40.535999,2025-01-21 06:46:56.742892,0 days 00:03:16.206893,1.024373508542845,1.3014439652796408,0.4095950316961448,0.037481501320066134,12,4,SGD,0.001392598898575891,0,,False,COMPLETE
1128,52.75,2025-01-21 06:46:30.842812,2025-01-21 06:48:36.729473,0 days 00:02:05.886661,1.0148555008570297,1.27116048096322,0.4078384501675756,0.03890186897544579,14,4,SGD,0.0024187941469599066,0,,False,COMPLETE
1129,52.690000000000005,2025-01-21 06:46:56.836856,2025-01-21 06:50:09.865628,0 days 00:03:13.028772,1.0590094627296918,1.2571073755071838,0.3869727937593069,0.04673063346989179,14,4,SGD,0.0026706750294722965,2,,False,COMPLETE
1130,52.980000000000004,2025-01-21 06:48:36.839519,2025-01-21 07:05:08.516903,0 days 00:16:31.677384,0.869449148194515,1.4895384318849916,0.4476755555116999,0.004526529110954749,17,4,SGD,0.001939797911136766,2,,False,COMPLETE
1131,49.61,2025-01-21 06:50:09.985721,2025-01-21 07:07:03.563879,0 days 00:16:53.578158,0.8735804922167028,1.3935597896153344,0.22007586817598362,0.04210037219646478,21,3,SGD,0.0017917251669666652,2,,False,COMPLETE
1132,52.92,2025-01-21 07:05:08.615356,2025-01-21 07:07:20.590518,0 days 00:02:11.975162,0.9944429208011943,1.3910259431273229,0.4214046568373983,0.04607009656416133,21,3,SGD,0.0007504362115414268,2,,False,COMPLETE
1133,52.94,2025-01-21 07:07:03.655264,2025-01-21 07:08:41.142636,0 days 00:01:37.487372,0.9734854047967632,1.343807893350959,0.41960003396140666,0.04639999080265073,19,5,SGD,0.0008794697801672609,2,,False,COMPLETE
1134,52.81,2025-01-21 07:07:20.715786,2025-01-21 07:08:54.271761,0 days 00:01:33.555975,0.9594042004529809,1.3381968562912963,0.45716454581539,0.035864965813411066,19,5,SGD,0.0010108539711109461,2,,False,COMPLETE
1135,52.21,2025-01-21 07:08:41.232891,2025-01-21 07:11:03.386476,0 days 00:02:22.153585,1.1002803743275094,1.335794977709809,0.3378213856842716,0.03201977739998351,23,5,SGD,0.00108893694342919,2,,False,COMPLETE
1136,52.27,2025-01-21 07:08:54.371586,2025-01-21 07:12:03.719530,0 days 00:03:09.347944,1.1044640081124986,1.292200100529377,0.3313802120925694,0.028137690794163343,16,4,SGD,0.0014941566559874848,2,,False,COMPLETE
1137,52.52,2025-01-21 07:11:03.499997,2025-01-21 07:13:15.632706,0 days 00:02:12.132709,1.0442106145877874,1.4150045908897977,0.36631883312465957,0.028698661330417683,16,4,SGD,0.0015240598605296978,2,,False,COMPLETE
1138,53.23,2025-01-21 07:12:03.826677,2025-01-21 07:14:23.635190,0 days 00:02:19.808513,1.0409217205939645,1.4254349665910266,0.44126028414962715,0.029210620142887424,17,4,SGD,0.01305556323776626,2,,False,COMPLETE
1139,53.11,2025-01-21 07:13:15.730842,2025-01-21 07:14:46.624982,0 days 00:01:30.894140,1.0448347170735917,1.5001275947435182,0.44025852192336523,0.040069506584467604,18,4,SGD,0.013185228135060428,2,,False,COMPLETE
