number,value,datetime_start,datetime_complete,duration,params_gamma_1,params_gamma_2,params_lambda,params_lr,params_n_clusters,params_n_points,params_optimizer,params_reg_lambda,params_reg_type,params_tanh_x,params_use_tanh,state
377,52.669999999999995,2025-01-20 10:08:50.851195,2025-01-20 10:10:16.908432,0 days 00:01:26.057237,1.3145082501046796,1.563421590665681,0.41623488758696847,0.06504238896877283,67,3,Adam,0.011559432719253492,2,8.796801628683575,True,COMPLETE
378,52.49,2025-01-20 10:10:10.073501,2025-01-20 10:12:19.097081,0 days 00:02:09.023580,1.2176598917906802,1.5532622220220014,0.4135046361515591,0.06972309828504496,66,3,Adam,0.0004655074370895245,1,0.6144200284146487,True,COMPLETE
379,52.92,2025-01-20 10:10:16.981630,2025-01-20 10:12:20.941448,0 days 00:02:03.959818,1.2543390518386948,1.6057878229522369,0.48711818235524784,0.071992957470202,73,6,Adam,0.00017214214997153383,1,0.5792551984812723,True,COMPLETE
380,52.949999999999996,2025-01-20 10:12:19.200410,2025-01-20 10:14:46.307862,0 days 00:02:27.107452,1.2616270827098464,1.6183677650564667,0.45261758379005174,0.05794506118838921,72,6,Adam,0.0004230152631811388,1,1.3827090734941727,True,COMPLETE
381,53.059999999999995,2025-01-20 10:12:21.004702,2025-01-20 10:14:03.903782,0 days 00:01:42.899080,1.2726241389107762,1.6986217389663154,0.44451917441816263,0.05633232976723362,62,4,Adam,0.0004365316880069756,1,1.420342860575356,True,COMPLETE
382,50.9,2025-01-20 10:14:03.969922,2025-01-20 10:15:27.733316,0 days 00:01:23.763394,1.2308606774439526,1.693432439372129,0.24277576141422147,0.0556684455804018,61,5,Adam,0.0005289956761173879,1,1.3529397663207487,True,COMPLETE
383,53.0,2025-01-20 10:14:46.389794,2025-01-20 10:16:33.596123,0 days 00:01:47.206329,1.2141544331032397,1.69151025972369,0.43531157804259957,0.055644527438130795,65,5,Adam,0.1446691455646499,1,1.5394317281894303,True,COMPLETE
384,53.169999999999995,2025-01-20 10:15:27.807281,2025-01-20 10:17:13.424723,0 days 00:01:45.617442,1.211298272295861,1.7112808291530592,0.43678370270915257,0.05173931161330044,64,4,Adam,0.0006845862434574522,1,1.731870312035313,True,COMPLETE
385,47.29,2025-01-20 10:16:33.700609,2025-01-20 10:18:46.964842,0 days 00:02:13.264233,1.2755489343766855,1.653205955625831,0.437434595311708,0.04905992634412888,63,36,Adam,0.0006306408549995757,1,1.6962455643738958,True,COMPLETE
386,53.14,2025-01-20 10:17:13.485533,2025-01-20 10:18:38.102399,0 days 00:01:24.616866,1.2700398688338006,1.7170439965057804,0.4419335253636507,0.04931545035786206,63,4,Adam,0.0006660698789882764,1,1.7326965751390837,True,COMPLETE
387,52.080000000000005,2025-01-20 10:18:38.156289,2025-01-20 10:20:08.232610,0 days 00:01:30.076321,1.2670395318884327,1.7027000969051789,0.5413911658228032,0.04774961613567946,65,2,Adam,0.0006194384654590814,1,1.7790854181972666,True,COMPLETE
388,52.18000000000001,2025-01-20 10:18:47.048379,2025-01-20 10:20:29.638323,0 days 00:01:42.589944,1.1968412415893517,1.743802804543495,0.5047141739260013,0.04900399959138363,65,2,Adam,0.000521043572896997,1,1.769377130716593,True,COMPLETE
389,52.900000000000006,2025-01-20 10:20:08.293791,2025-01-20 10:21:44.888931,0 days 00:01:36.595140,1.2002575191578506,1.727859000743379,0.45962591208602505,0.06199638770648898,62,6,Adam,0.000706063710669914,1,1.7085422581473504,True,COMPLETE
390,52.93,2025-01-20 10:20:29.731343,2025-01-20 10:22:29.206859,0 days 00:01:59.475516,1.3353045050201005,1.7103800696126312,0.461760594702135,0.06275890476027395,62,4,Adam,0.00043761942179722463,1,2.0369286689164285,True,COMPLETE
391,52.93,2025-01-20 10:21:44.943920,2025-01-20 10:23:30.322899,0 days 00:01:45.378979,1.320564645398945,1.6684809330771586,0.48401183404303083,0.06308626206724584,64,4,Adam,0.06704824691965941,1,1.3670037711348269,True,COMPLETE
392,50.39,2025-01-20 10:22:29.312622,2025-01-20 10:24:18.171225,0 days 00:01:48.858603,1.2364466665134433,1.7296959785585946,0.48545634445507196,0.055814506138813634,64,25,Adam,0.0005125468234034718,1,1.5063667314317786,True,COMPLETE
393,52.83,2025-01-20 10:23:30.380610,2025-01-20 10:25:10.567481,0 days 00:01:40.186871,1.2403468679466436,1.7266023118730962,0.427050620153057,0.05352020095645428,63,5,Adam,0.00046468536703265535,1,1.187889305857164,True,COMPLETE
394,52.71,2025-01-20 10:24:18.249843,2025-01-20 10:26:04.408172,0 days 00:01:46.158329,1.2827285896596328,1.7103439819653417,0.4247089417265281,0.052913185382319976,63,6,Adam,0.0006794494472555477,1,1.147790902569858,True,COMPLETE
395,52.910000000000004,2025-01-20 10:25:10.630990,2025-01-20 10:26:48.167307,0 days 00:01:37.536317,1.2910037471195168,1.6610631813676586,0.4437151684862471,0.06831990214030233,66,6,Adam,0.0005512543434902591,1,0.8374943022548679,True,COMPLETE
396,53.03,2025-01-20 10:26:04.482916,2025-01-20 10:28:20.152102,0 days 00:02:15.669186,1.3025903506586438,1.6530133895104262,0.44070271274669415,0.06942591494769437,67,4,Adam,0.00039679314221229125,1,0.7977872557522356,True,COMPLETE
397,52.93,2025-01-20 10:26:48.229905,2025-01-20 10:28:36.579123,0 days 00:01:48.349218,1.3211732736552495,1.6444063880038349,0.47007815710587825,0.059894062581647894,67,4,Adam,0.00038936303235878963,1,0.43920307583234064,True,COMPLETE
398,52.910000000000004,2025-01-20 10:28:20.238399,2025-01-20 10:30:14.725752,0 days 00:01:54.487353,1.2651482495801156,1.6955885406188647,0.4358994828952273,0.07318688416776178,67,3,Adam,0.00024308984791993158,1,0.4748246740775834,True,COMPLETE
399,52.87,2025-01-20 10:28:36.632769,2025-01-20 10:30:22.674183,0 days 00:01:46.041414,1.2596539264764455,1.6944885562889753,0.44138629445106586,0.07343951191268573,67,3,Adam,0.0007674992093477635,1,0.2825858469591209,True,COMPLETE
400,52.64,2025-01-20 10:30:14.808551,2025-01-20 10:32:23.768624,0 days 00:02:08.960073,1.2220621736520172,1.826875840298539,0.39434591024344057,0.07480484873696687,69,3,Adam,0.0007356874770431038,1,0.3412319851105906,True,COMPLETE
401,52.89,2025-01-20 10:30:22.737698,2025-01-20 10:32:15.390261,0 days 00:01:52.652563,1.1813462068591634,1.7725115323850533,0.39619539488565564,0.08335739032254655,69,4,Adam,0.0003040148672296834,1,0.66574300619421,True,COMPLETE
402,52.669999999999995,2025-01-20 10:32:15.448057,2025-01-20 10:33:59.148879,0 days 00:01:43.700822,1.3035960189286842,1.654195764136297,0.41749720856253963,0.06668950310027268,66,5,Adam,0.0005322380315099096,1,0.9320777429876256,True,COMPLETE
403,53.0,2025-01-20 10:32:23.853507,2025-01-20 10:34:13.122828,0 days 00:01:49.269321,1.30452426743819,1.6413945955082636,0.44964233376846224,0.06632902628596345,65,4,Adam,0.00020250185347241102,1,0.9442733567924335,True,COMPLETE
404,53.28000000000001,2025-01-20 10:33:59.202341,2025-01-20 10:35:24.096105,0 days 00:01:24.893764,1.2455870929414385,1.6593736107606647,0.449544378964119,0.05830182147470829,64,4,Adam,0.0002057645706016849,1,1.8818174004676451,True,COMPLETE
405,53.0,2025-01-20 10:34:13.420684,2025-01-20 10:36:13.195264,0 days 00:01:59.774580,1.2459481378413504,1.740855944806814,0.4217322642383067,0.05856518508944984,70,4,Adam,0.0003208073941986502,1,1.6234557166198789,True,COMPLETE
406,52.64,2025-01-20 10:35:24.158507,2025-01-20 10:36:57.689790,0 days 00:01:33.531283,1.206082120742509,1.7438089229514209,0.4182925258863986,0.04610724062494636,64,2,Adam,0.0006424864721357438,1,1.613537186120657,True,COMPLETE
407,52.81,2025-01-20 10:36:13.286775,2025-01-20 10:37:30.733525,0 days 00:01:17.446750,1.2308538655460448,1.682875978689274,0.45650350888226715,0.04656398685771509,13,4,Adam,0.00016032964098589887,1,1.9350605745376963,True,COMPLETE
408,52.910000000000004,2025-01-20 10:36:57.760398,2025-01-20 10:40:16.027329,0 days 00:03:18.266931,1.2225105437347057,1.6798708279806216,0.4610861389064848,0.05112089069917858,64,3,Adam,0.00014999312208703266,1,5.478086906288005,True,COMPLETE
409,52.88,2025-01-20 10:37:30.810030,2025-01-20 10:38:57.089896,0 days 00:01:26.279866,1.3640675770617874,1.7123599468548467,0.4350483364122173,0.053013654975878156,64,3,Adam,0.0004609684682776101,1,2.284939330170765,True,COMPLETE
410,52.6,2025-01-20 10:38:57.198679,2025-01-20 10:40:56.660504,0 days 00:01:59.461825,1.1967672049733313,1.7664307877947605,0.5133020609860508,0.05719203060049806,64,3,Adam,0.0003683669695470033,1,1.9071786223677232,True,COMPLETE
411,52.790000000000006,2025-01-20 10:40:16.099601,2025-01-20 10:42:03.484863,0 days 00:01:47.385262,1.1711508383838627,1.8038777364849787,0.5004965471882559,0.057752751994743175,67,5,Adam,0.00020136314172615572,1,1.9422413667760066,True,COMPLETE
412,52.89,2025-01-20 10:40:56.766526,2025-01-20 10:42:34.367832,0 days 00:01:37.601306,1.2793550306689074,1.6444023318900776,0.40464322308725764,0.05925346115417242,73,5,Adam,0.0005654418566093526,1,1.3094115941550686,True,COMPLETE
413,53.059999999999995,2025-01-20 10:42:03.555462,2025-01-20 10:43:44.074643,0 days 00:01:40.519181,1.2831634233368283,1.6471145728645216,0.47713789989333344,0.06278442005525986,66,6,Adam,0.0005579327711031903,1,1.4303113718757152,True,COMPLETE
414,53.1,2025-01-20 10:42:34.464276,2025-01-20 10:44:24.064712,0 days 00:01:49.600436,1.3225993454411749,1.5713319621979478,0.4807405454970397,0.06630902762800728,68,6,Adam,0.000464980107315152,1,1.4391050646897796,True,COMPLETE
415,53.05,2025-01-20 10:43:44.148920,2025-01-20 10:45:22.576719,0 days 00:01:38.427799,1.3299540474184295,1.7056470948483449,0.48218034529167764,0.05020522004406534,66,6,Adam,0.0004240682607967056,1,1.4363293628913016,True,COMPLETE
416,53.05,2025-01-20 10:44:24.160010,2025-01-20 10:46:17.532853,0 days 00:01:53.372843,1.3872936767358028,1.66457740056332,0.47684312306244064,0.04991310906083007,66,6,Adam,0.0004245175237823425,1,1.4573940758912438,True,COMPLETE
417,52.7,2025-01-20 10:45:22.631400,2025-01-20 10:46:43.878468,0 days 00:01:21.247068,1.378296720291759,1.670289251961,0.4782618833066481,0.051255448489079,65,7,Adam,0.00039435638914506687,1,1.4260490051745869,True,COMPLETE
418,52.559999999999995,2025-01-20 10:46:17.629639,2025-01-20 10:47:59.912012,0 days 00:01:42.282373,1.4088094208231694,1.71726492478353,0.5000255803663556,0.047216478647469314,66,8,Adam,0.0004483317488928727,1,1.4420940176200063,True,COMPLETE
419,52.61,2025-01-20 10:46:43.947119,2025-01-20 10:48:26.668845,0 days 00:01:42.721726,1.4164920569846682,1.7070027856046388,0.5171842456107982,0.046176601680143925,66,8,Adam,0.0003085546299207427,1,1.5732648353716596,True,COMPLETE
420,52.910000000000004,2025-01-20 10:48:00.006377,2025-01-20 10:49:30.605778,0 days 00:01:30.599401,1.4038052837134982,1.701111427364647,0.4865551388073077,0.05169309526923214,66,6,Adam,0.00011126738026055527,1,1.646662761759026,True,COMPLETE
421,52.89,2025-01-20 10:48:26.741708,2025-01-20 10:50:14.681338,0 days 00:01:47.939630,1.440144064925898,1.6674102742348422,0.48572602235544976,0.001809145973303437,66,6,Adam,0.00023617900198867427,1,1.742778667901291,True,COMPLETE
422,52.73,2025-01-20 10:49:30.700895,2025-01-20 10:51:01.749461,0 days 00:01:31.048566,1.4508779934968383,1.5702658912223446,0.4811462144142607,0.05648739397725211,68,7,Adam,0.0003414739128672064,1,1.8020711644985403,True,COMPLETE
423,52.64,2025-01-20 10:50:14.742161,2025-01-20 10:51:34.506547,0 days 00:01:19.764386,1.3529651173091914,1.5575384660804723,0.528987456419384,0.055042019851649616,64,7,Adam,0.00032658633801876756,1,1.4895437103657283,True,COMPLETE
424,52.92,2025-01-20 10:51:01.830780,2025-01-20 10:52:53.499634,0 days 00:01:51.668854,1.3548441824973934,1.6398663754478071,0.5026299858434532,0.06167229646168335,68,6,Adam,0.00046287632641061916,2,1.2394519931360901,True,COMPLETE
425,53.06999999999999,2025-01-20 10:51:34.573757,2025-01-20 10:52:58.168443,0 days 00:01:23.594686,1.3723827488068294,1.6210256938064052,0.47151630992206073,0.061774126884069414,68,6,Adam,0.00045874586916129826,2,1.3200347224674753,True,COMPLETE
426,52.300000000000004,2025-01-20 10:52:53.595187,2025-01-20 10:54:24.051568,0 days 00:01:30.456381,1.380282697540599,1.752187139845981,0.4725030895789259,0.050837420066870996,68,11,Adam,0.00026284352316996505,1,2.1795570134897115,True,COMPLETE
427,52.68000000000001,2025-01-20 10:52:58.239485,2025-01-20 10:54:37.126054,0 days 00:01:38.886569,1.3939366214659419,1.7457524353708895,0.47063224428129685,0.044668128202454735,65,7,Adam,0.00048318982795293817,2,2.154663237882789,True,COMPLETE
428,52.769999999999996,2025-01-20 10:54:24.144788,2025-01-20 10:56:01.851480,0 days 00:01:37.706692,1.3858328596194478,1.6744295085802137,0.4967632276895078,0.061091024249239456,65,7,Adam,0.0004786738640770914,2,1.3373821073368797,True,COMPLETE
429,52.92,2025-01-20 10:54:37.183904,2025-01-20 10:56:17.826740,0 days 00:01:40.642836,1.3366921777962961,1.6835235214925455,0.4962422447073457,0.061800126128492304,67,6,Adam,0.0006608299785194847,2,1.2701638756424711,True,COMPLETE
430,52.580000000000005,2025-01-20 10:56:01.956114,2025-01-20 10:57:53.895572,0 days 00:01:51.939458,1.4695468301018755,1.6308406395938972,0.5059881900425833,0.05300877181982171,62,6,Adam,0.0006224354351307329,2,1.2916494222987651,True,COMPLETE
431,52.88,2025-01-20 10:56:17.891202,2025-01-20 10:57:50.275982,0 days 00:01:32.384780,1.3395175637739978,1.622792143725272,0.5203466615836004,0.05240652086754224,68,6,Adam,0.0005899801597350976,1,6.966717924548758,True,COMPLETE
432,53.0,2025-01-20 10:57:50.343825,2025-01-20 10:59:26.582747,0 days 00:01:36.238922,1.3272711447594705,1.71466377118864,0.4701584075441512,0.05741690698070177,66,6,Adam,0.0004161148971364574,2,1.174111769784785,True,COMPLETE
433,52.62,2025-01-20 10:57:53.993204,2025-01-20 10:59:39.824696,0 days 00:01:45.831492,1.3432679617494288,1.7171803396039933,0.4686278014472908,0.06358051413564952,63,8,Adam,0.0004206562040656096,2,1.5494980982428839,True,COMPLETE
434,52.910000000000004,2025-01-20 10:59:26.642948,2025-01-20 11:00:51.117859,0 days 00:01:24.474911,1.3509107056230218,1.5779096287992047,0.4813243419008143,0.06406844913796791,69,7,Adam,0.025611897223962135,2,1.5436213839406108,True,COMPLETE
435,52.93,2025-01-20 10:59:39.913429,2025-01-20 11:01:11.808026,0 days 00:01:31.894597,1.3749344184745746,1.530372223826954,0.48136863245653716,0.043587487738032685,69,7,Adam,0.0005287823377710247,2,1.754386468080661,True,COMPLETE
436,47.5,2025-01-20 11:00:51.178510,2025-01-20 11:02:36.710452,0 days 00:01:45.531942,1.4167250162512004,1.5336235417140032,0.9633191175445062,0.043782421865600114,68,7,Adam,0.0005031270125811083,1,9.64878722498269,True,COMPLETE
437,53.0,2025-01-20 11:01:11.897231,2025-01-20 11:02:51.106028,0 days 00:01:39.208797,1.3248477639836693,1.6647637162104927,0.4598493317327632,0.048363880848183355,68,6,Adam,0.0001843504305026368,1,1.8462741282487245,True,COMPLETE
438,52.410000000000004,2025-01-20 11:02:36.772609,2025-01-20 11:03:28.604403,0 days 00:00:51.831794,1.4907510523838197,1.665834109314628,0.46439211639981826,0.04953035669856281,19,6,Adam,0.00017531905839044445,1,1.9788425746447,True,COMPLETE
439,52.51,2025-01-20 11:02:51.188225,2025-01-20 11:04:33.883185,0 days 00:01:42.694960,1.3158344607001633,1.630179668688224,0.46001052146270555,0.05608423729149018,66,9,Adam,0.00038188630055712493,1,1.0555690778411142,True,COMPLETE
440,52.56999999999999,2025-01-20 11:03:28.657951,2025-01-20 11:05:04.702357,0 days 00:01:36.044406,1.0119499728175054,1.6135606451786897,0.4864309198863944,0.05720298534714779,66,9,Adam,0.0003584767330269636,1,1.1361445626540636,True,COMPLETE
441,52.669999999999995,2025-01-20 11:04:33.962267,2025-01-20 11:06:01.435825,0 days 00:01:27.473558,1.04478991482237,1.5704531742670484,0.4906337121852722,0.06685008958017635,64,5,Adam,0.0007491084070253148,1,1.3652177045896794,True,COMPLETE
442,50.949999999999996,2025-01-20 11:05:04.771365,2025-01-20 11:07:01.334983,0 days 00:01:56.563618,1.2630827709425891,1.576564021689557,0.5144163103221224,0.06563884823761605,62,21,Adam,0.0002894372966467345,1,1.4165295741817907,True,COMPLETE
443,51.339999999999996,2025-01-20 11:06:01.539697,2025-01-20 11:07:38.431367,0 days 00:01:36.891670,1.2561773282649091,1.6972198183707587,0.6047047899294976,0.06627367209687356,74,14,Adam,0.00028385365947662927,1,1.611726202226182,True,COMPLETE
444,52.35999999999999,2025-01-20 11:07:01.404756,2025-01-20 11:08:46.291518,0 days 00:01:44.886762,1.3079098203732082,1.7068975510066355,0.44778301170745377,0.002402995370897209,70,13,Adam,0.000446983361790289,1,1.6672391814507188,True,COMPLETE
445,52.94,2025-01-20 11:07:38.523534,2025-01-20 11:09:25.108575,0 days 00:01:46.585041,1.31571258783435,1.7632339238411532,0.45087291158109793,0.002341721215210405,70,6,Adam,0.00045630029614759904,1,1.114228030974626,True,COMPLETE
446,52.76,2025-01-20 11:08:46.359701,2025-01-20 11:10:49.554632,0 days 00:02:03.194931,1.367067686351441,1.7425353628665894,0.54652719755036,0.060526890137017446,69,6,Adam,0.0005628932459510224,1,2.0046863047557744,True,COMPLETE
447,52.82,2025-01-20 11:09:25.192750,2025-01-20 11:11:11.156470,0 days 00:01:45.963720,1.1810480769952292,1.6428431956668006,0.47268368889236706,0.05768987068236794,67,8,Adam,0.00022215064389713,1,1.4722122011611094,True,COMPLETE
448,52.629999999999995,2025-01-20 11:10:49.620573,2025-01-20 11:12:31.300607,0 days 00:01:41.680034,1.4286484079583106,1.6403429778659186,0.47247419156565823,0.05207142979648374,67,8,Adam,0.00021543480730454602,1,1.4302225072742007,True,COMPLETE
449,52.75,2025-01-20 11:11:11.257074,2025-01-20 11:13:00.202246,0 days 00:01:48.945172,1.4443352662923061,1.667006103234253,0.43447747578511464,0.05120464345983971,65,5,Adam,0.0006549904503149199,1,0.11152127092044095,True,COMPLETE
450,52.849999999999994,2025-01-20 11:12:31.360956,2025-01-20 11:14:35.436391,0 days 00:02:04.075435,1.231187567586963,1.5986212429896756,0.5058205970656251,0.06991231546330078,65,5,Adam,0.0006471264203992148,1,1.0358086729871152,True,COMPLETE
451,50.6,2025-01-20 11:13:00.294474,2025-01-20 11:15:26.665797,0 days 00:02:26.371323,1.2179058157593698,1.5867327179089004,0.7199547107955189,0.07100307770309285,74,5,Adam,0.00035972082667028036,1,1.0051319333541395,True,COMPLETE
452,52.87,2025-01-20 11:14:35.509899,2025-01-20 11:16:22.633971,0 days 00:01:47.124072,1.2897034613426728,1.7776675135082982,0.4566134980539852,0.060529551465621736,73,5,Adam,0.3441096626722303,1,1.8635451821864022,True,COMPLETE
453,52.769999999999996,2025-01-20 11:15:26.769540,2025-01-20 11:17:41.207943,0 days 00:02:14.438403,1.2911852735763103,1.6839309373814775,0.45332434040867525,0.06031832184882392,63,7,Adam,0.034899643014463924,1,1.879444887542236,True,COMPLETE
454,52.71,2025-01-20 11:16:22.686799,2025-01-20 11:17:51.745817,0 days 00:01:29.059018,1.3958804704589978,1.973092319485095,0.4884097199789318,0.055161216536537855,63,7,Adam,0.0001287018233846884,1,1.7636448758431875,True,COMPLETE
455,52.900000000000006,2025-01-20 11:17:41.332233,2025-01-20 11:20:06.369083,0 days 00:02:25.036850,1.3855208632042681,1.5208790104505483,0.4385078791246059,0.07727777724032768,75,6,Adam,0.0004887250272123393,1,1.2772681939864428,True,COMPLETE
456,52.92,2025-01-20 11:17:51.813483,2025-01-20 11:19:28.889950,0 days 00:01:37.076467,1.2600278572830543,1.5351213379764204,0.43522586038204863,0.07532746129434927,75,6,Adam,0.0004732449005890104,1,1.244707079120093,True,COMPLETE
457,53.010000000000005,2025-01-20 11:19:28.949221,2025-01-20 11:20:58.093453,0 days 00:01:29.144232,1.3339018161276595,1.717489393115027,0.46901646710179645,0.04785597331919353,70,4,Adam,0.0005532347334336301,1,0.25388386481822955,True,COMPLETE
458,52.769999999999996,2025-01-20 11:20:06.460132,2025-01-20 11:22:29.713900,0 days 00:02:23.253768,1.332158096049043,1.7296859250677203,0.5283251132314748,0.06572316311287227,72,4,SGD,0.0003174933481363776,1,0.27181345899985143,True,COMPLETE
459,52.05,2025-01-20 11:20:58.171709,2025-01-20 11:23:36.548228,0 days 00:02:38.376519,1.1844609572052487,1.6483372793812685,0.2837086597259407,0.0631374968227334,72,4,SGD,0.00032607796280679954,1,0.7783562646324325,True,COMPLETE
460,52.86,2025-01-20 11:22:29.806718,2025-01-20 11:24:23.120944,0 days 00:01:53.314226,1.2565067239999195,1.6218515238225741,0.5047378477884328,0.052775412827856534,69,6,Adam,0.0007566220477440585,2,1.631053082181662,True,COMPLETE
461,52.94,2025-01-20 11:23:36.626110,2025-01-20 11:25:10.341002,0 days 00:01:33.714892,1.2504867558347343,1.6102978177713207,0.4992588067432204,0.053575599777398106,68,6,Adam,0.0008006030148759985,2,2.2678652505889523,True,COMPLETE
462,53.05,2025-01-20 11:24:23.196960,2025-01-20 11:26:19.538059,0 days 00:01:56.341099,1.365423948137606,1.685677401116472,0.48409564198681176,0.04211368031040464,68,5,Adam,0.00039071239313690544,1,2.2999103327291195,True,COMPLETE
463,52.949999999999996,2025-01-20 11:25:10.400753,2025-01-20 11:27:02.576370,0 days 00:01:52.175617,1.3119888929146628,1.683163969661014,0.4229947593051841,0.04131837666091971,73,5,Adam,0.0004111026155109943,1,0.11088080823859095,True,COMPLETE
464,52.959999999999994,2025-01-20 11:26:19.627254,2025-01-20 11:28:11.768830,0 days 00:01:52.141576,1.3677038878234065,1.6922741518110611,0.4896908542577157,0.0409546269648574,66,5,Adam,0.0003979073528282765,1,2.3597027223333025,True,COMPLETE
465,52.86,2025-01-20 11:27:02.874168,2025-01-20 11:28:59.864366,0 days 00:01:56.990198,1.3559185631403394,1.7746808406973864,0.48904729233326033,0.04819179708917871,66,7,Adam,0.0002576352223607734,1,2.1736229677942114,True,COMPLETE
466,52.449999999999996,2025-01-20 11:28:11.861486,2025-01-20 11:29:50.663352,0 days 00:01:38.801866,1.4193323735528396,1.763735741207558,0.4781358818908077,0.046974774939178475,64,2,Adam,0.0005503000020281325,1,2.015448250169019,True,COMPLETE
467,52.15,2025-01-20 11:28:59.928101,2025-01-20 11:30:31.351413,0 days 00:01:31.423312,1.40616914564252,1.733762013920628,0.5236688317963302,0.044645388327381394,64,2,Adam,0.000542963817825712,1,2.1690714419811354,True,COMPLETE
468,48.84,2025-01-20 11:29:50.776070,2025-01-20 11:31:42.850842,0 days 00:01:52.074772,1.3942414631658049,1.720903710650437,0.5236921452796485,0.057436869809742,67,31,Adam,0.0006263735058593076,1,2.025420128500393,True,COMPLETE
