number,value,datetime_start,datetime_complete,duration,params_gamma_1,params_gamma_2,params_lambda,params_lr,params_n_clusters,params_n_points,params_optimizer,params_reg_lambda,params_reg_type,params_tanh_x,params_use_tanh,state
842,53.02,2025-01-20 18:19:19.267262,2025-01-20 18:21:25.948288,0 days 00:02:06.681026,1.0960647214035382,1.6686117786195147,0.4272245051041458,0.07730865944635999,70,5,Adam,0.0009566399579669103,2,4.621274397090974,True,COMPLETE
843,49.27,2025-01-20 18:21:26.052171,2025-01-20 18:30:26.290507,0 days 00:09:00.238336,1.1205881957138408,1.705589395749786,0.39746279404789264,0.04985248439162249,57,27,SGD,0.0016045161544153098,2,4.108983983492002,True,COMPLETE
844,52.99,2025-01-20 18:21:26.724615,2025-01-20 18:38:37.467113,0 days 00:17:10.742498,1.1364482208164464,1.7022719266400685,0.4600714653118136,0.05065660864424571,36,4,SGD,0.0015802094112024384,2,4.16065439160069,True,COMPLETE
845,53.14,2025-01-20 18:30:26.409444,2025-01-20 18:46:27.528977,0 days 00:16:01.119533,1.136065077616997,1.601952879706232,0.4598143432969415,0.07213256859926685,75,3,SGD,0.001913171818062383,2,7.64114757598255,True,COMPLETE
846,52.96999999999999,2025-01-20 18:38:37.580888,2025-01-20 18:40:44.685309,0 days 00:02:07.104421,1.1423605316890515,1.6104093867893483,0.4109102147034231,0.07069380528187412,75,3,Adam,0.0018957070839820576,2,7.76775097224034,True,COMPLETE
847,52.800000000000004,2025-01-20 18:40:44.816350,2025-01-20 18:42:55.588626,0 days 00:02:10.772276,1.1022966804014998,0.7275428897116698,0.4429431944607636,0.06245560185603978,70,2,Adam,0.0027048019226243356,2,4.555009146765309,True,COMPLETE
848,52.62,2025-01-20 18:42:55.728331,2025-01-20 18:45:20.876098,0 days 00:02:25.147767,1.1523587999348002,1.6448781190605706,0.3663197710339793,0.07653089839324727,73,3,Adam,0.0021587913192852542,2,4.863764288728455,True,COMPLETE
849,52.910000000000004,2025-01-20 18:45:20.977622,2025-01-20 18:47:38.986628,0 days 00:02:18.009006,1.046020683758145,1.7529076057596022,0.46381059882040354,0.05934414577754839,71,5,Adam,0.001451262929930893,2,4.939791840623912,True,COMPLETE
850,52.2,2025-01-20 18:46:27.625390,2025-01-20 18:50:39.437380,0 days 00:04:11.811990,1.0564049603241088,1.5847630341044294,0.42734476678781874,0.0896030533327223,75,1,SGD,0.0029735486065960255,2,7.390038720682057,True,COMPLETE
851,50.24999999999999,2025-01-20 18:47:39.100312,2025-01-20 18:52:30.493794,0 days 00:04:51.393482,1.0665955802808336,1.5871634324240236,0.23239396312087285,0.0880641418217642,75,2,SGD,0.002240119537574604,2,5.968263369056273,True,COMPLETE
852,52.949999999999996,2025-01-20 18:50:39.530328,2025-01-20 18:54:13.053924,0 days 00:03:33.523596,1.1201445956731413,1.527692117786098,0.4459842316565978,0.08059683126889595,75,2,SGD,0.002249403752006495,2,7.410081971876797,True,COMPLETE
853,52.2,2025-01-20 18:52:30.600644,2025-01-20 19:08:42.850678,0 days 00:16:12.250034,1.1006042996484056,1.5364256752851997,0.44349361500494944,0.0059788323953509056,75,1,SGD,0.0018216473252194215,2,3.706145528453981,True,COMPLETE
854,52.739999999999995,2025-01-20 18:54:13.167186,2025-01-20 18:56:41.771906,0 days 00:02:28.604720,1.642596476922003,1.5436713451774764,0.4158732051242269,0.07723461102377806,75,3,SGD,0.0018846730698496318,2,7.830266185548545,True,COMPLETE
855,52.900000000000006,2025-01-20 18:56:41.888058,2025-01-20 19:00:48.104432,0 days 00:04:06.216374,1.1354823222548818,1.6135490153740888,0.3985022844360767,0.0706799683593851,74,3,SGD,0.0016760764180294803,2,8.267714008801775,True,COMPLETE
856,52.23,2025-01-20 19:00:48.213378,2025-01-20 19:03:13.976617,0 days 00:02:25.763239,1.1009619198450422,1.5667399093328962,0.4297092329805619,0.08340931315217318,73,1,Adam,0.0013554178176933295,2,8.555286817798729,True,COMPLETE
857,52.87,2025-01-20 19:03:14.087153,2025-01-20 19:06:52.472718,0 days 00:03:38.385565,1.1032987808930388,1.624494892435806,0.4548403408978195,0.06952518385498509,73,3,SGD,0.0017915879276992762,2,7.659948713494972,True,COMPLETE
858,53.12,2025-01-20 19:06:52.565992,2025-01-20 19:09:34.254573,0 days 00:02:41.688581,1.1500160582276815,1.5941423849262626,0.4425323175628242,0.07566671639918339,74,4,SGD,0.003692956733464119,2,7.799789271855362,True,COMPLETE
859,52.71,2025-01-20 19:08:42.954288,2025-01-20 19:10:58.277862,0 days 00:02:15.323574,1.1646414762002848,1.6018503347639519,0.3840932083488731,0.07526489362242587,74,4,SGD,0.0027239255432640634,2,8.953256155800316,True,COMPLETE
860,52.96999999999999,2025-01-20 19:09:34.357057,2025-01-20 19:12:29.571331,0 days 00:02:55.214274,1.1538830224254966,1.585791463859244,0.4617165169283799,0.0903167174414654,75,2,SGD,0.004491431820636099,2,7.445669737234468,True,COMPLETE
861,52.86,2025-01-20 19:10:58.373171,2025-01-20 19:14:55.428550,0 days 00:03:57.055379,0.9975519667111714,1.5677965150616944,0.46006205591372956,0.09208757665008933,75,2,SGD,0.006786462444971014,2,8.026377517166553,True,COMPLETE
862,52.76,2025-01-20 19:12:29.688062,2025-01-20 19:14:09.926220,0 days 00:01:40.238158,1.1270452367185855,1.4620292057297595,0.4564923164145885,0.08242633182082111,29,4,SGD,0.0032512836057986476,2,7.596172535116511,True,COMPLETE
863,53.080000000000005,2025-01-20 19:14:10.059860,2025-01-20 19:16:19.350700,0 days 00:02:09.290840,1.0787161120786413,1.5611075351117123,0.44295009374857347,0.09317866704104916,74,3,SGD,0.0038560365772550456,2,7.298151797044843,True,COMPLETE
864,52.89,2025-01-20 19:14:55.533988,2025-01-20 19:17:16.706349,0 days 00:02:21.172361,1.0872727860118727,1.6405585282598494,0.44631037570943255,0.07954506412811135,73,3,SGD,0.0036617191210404445,2,8.069210016087743,True,COMPLETE
865,52.86,2025-01-20 19:16:19.482129,2025-01-20 19:18:27.390585,0 days 00:02:07.908456,1.1411269126490036,1.6405941913978348,0.41751134427089437,0.08010551543109705,73,3,SGD,0.0026723216007912436,2,7.917200725021511,True,COMPLETE
866,52.92,2025-01-20 19:17:16.806939,2025-01-20 19:20:13.026510,0 days 00:02:56.219571,1.1311144602283383,1.5252283120432306,0.419600905702795,0.07757977473932255,74,4,SGD,0.0028243378196954765,2,7.910457887374323,True,COMPLETE
867,53.169999999999995,2025-01-20 19:18:27.497166,2025-01-20 19:21:07.389923,0 days 00:02:39.892757,1.1614966772480728,1.5340476409754713,0.4308318708336146,0.07275174952434975,74,4,SGD,0.002516548490474212,2,,False,COMPLETE
868,52.73,2025-01-20 19:20:13.154888,2025-01-20 19:22:42.437370,0 days 00:02:29.282482,0.8955784772405398,1.5950443182248073,0.43489356135410906,0.07033862084055599,75,4,SGD,0.0022297275026705483,2,,False,COMPLETE
869,52.89,2025-01-20 19:21:07.494224,2025-01-20 19:23:10.731477,0 days 00:02:03.237253,1.1676948404200709,1.520588065432288,0.4057165227051052,0.06906629762134875,75,4,SGD,0.0033039292223330657,2,,False,COMPLETE
870,52.81,2025-01-20 19:22:42.514248,2025-01-20 19:26:17.645165,0 days 00:03:35.130917,1.1739949338155928,1.4848768840661823,0.40735199495154195,0.06809133946967134,73,3,SGD,0.003468500922672547,2,,False,COMPLETE
871,52.71,2025-01-20 19:23:10.810511,2025-01-20 19:27:02.297351,0 days 00:03:51.486840,1.1810815568288027,1.4823560224155143,0.40374266555960625,0.06508613645634795,73,2,SGD,0.0023281966065833316,2,8.209921268631824,True,COMPLETE
872,52.739999999999995,2025-01-20 19:26:17.755542,2025-01-20 19:30:11.195646,0 days 00:03:53.440104,1.1673585766669632,1.647409031865118,0.42952615013650064,0.0649000534304513,72,2,SGD,0.002845824676865764,2,,False,COMPLETE
873,53.09,2025-01-20 19:27:02.377785,2025-01-20 19:30:05.356891,0 days 00:03:02.979106,1.1460824859915417,1.6598699433782877,0.43040563503290885,0.0742571971653457,72,5,SGD,0.00219080403391743,2,,False,COMPLETE
874,51.88,2025-01-20 19:30:05.446118,2025-01-20 19:47:44.415191,0 days 00:17:38.969073,1.1701397456009714,1.6297245976798882,0.2871270462360348,0.06456933072768103,74,3,SGD,0.0046959557569482705,2,,False,COMPLETE
875,52.82,2025-01-20 19:30:11.301620,2025-01-20 19:48:02.235589,0 days 00:17:50.933969,1.1905706407706793,1.61593194415872,0.3834739995084855,0.07237869078753817,74,3,SGD,0.004101080077368856,2,,False,COMPLETE
876,48.64,2025-01-20 19:47:44.524270,2025-01-20 19:52:30.384517,0 days 00:04:45.860247,0.2866251596506493,1.5787330808570492,0.380519942174522,0.07250364043688658,75,4,SGD,0.001990805019690232,2,7.7764101285068055,True,COMPLETE
877,49.38,2025-01-20 19:48:02.338816,2025-01-20 19:51:44.209587,0 days 00:03:41.870771,0.30529251374464306,1.573457956754117,0.41679730407404547,0.01855572064362613,75,5,SGD,0.0024967679088179397,2,,False,COMPLETE
878,52.88,2025-01-20 19:51:44.338130,2025-01-20 19:53:22.122086,0 days 00:01:37.783956,1.136964438732252,1.5399788914743477,0.4379296343607196,0.07479408505520044,49,4,SGD,0.001989164854768581,2,,False,COMPLETE
879,53.03,2025-01-20 19:52:30.504322,2025-01-20 19:54:12.361775,0 days 00:01:41.857453,1.1164992471445359,1.5366547259682513,0.4374357000083411,0.06179188890025838,72,5,SGD,0.001546004737787751,2,,False,COMPLETE
880,53.080000000000005,2025-01-20 19:53:22.225180,2025-01-20 19:55:19.495107,0 days 00:01:57.269927,1.116725341807773,1.6586426378112296,0.42164063724546696,0.06496949682665773,72,5,SGD,0.0024964784987289127,2,,False,COMPLETE
881,52.86,2025-01-20 19:54:12.467505,2025-01-20 20:13:00.882639,0 days 00:18:48.415134,1.19720866910886,1.6753295173803164,0.4143735084474192,0.06444801824094906,73,3,SGD,0.0027251686183899994,2,,False,COMPLETE
882,52.73,2025-01-20 19:55:19.600087,2025-01-20 20:13:22.899191,0 days 00:18:03.299104,1.1999440227012133,1.607995002626831,0.3944658669810311,0.05931073698244419,73,3,SGD,0.0015760363305305245,2,,False,COMPLETE
883,52.68000000000001,2025-01-20 20:13:01.000499,2025-01-20 20:17:01.093539,0 days 00:04:00.093040,1.155501705423703,1.4208332510798956,0.39488481578845175,0.057820672174428676,71,4,SGD,0.0017932269856012618,2,,False,COMPLETE
884,52.959999999999994,2025-01-20 20:13:23.016169,2025-01-20 20:16:27.220227,0 days 00:03:04.204058,1.1589712110520216,1.5111401621206733,0.4528617269994227,0.08183035516529902,71,4,SGD,0.0019099026976511285,2,,False,COMPLETE
885,53.13,2025-01-20 20:16:27.321590,2025-01-20 20:18:38.461018,0 days 00:02:11.139428,1.1482906069182206,1.4418885179648566,0.44078952564661705,0.06953823478904483,75,5,SGD,0.0013477120797691622,2,,False,COMPLETE
886,53.23,2025-01-20 20:17:01.196114,2025-01-20 20:18:13.969636,0 days 00:01:12.773522,1.1978315614074753,1.590542348795345,0.44235616393430494,0.07105849638955913,18,4,SGD,0.0012515378351709687,2,,False,COMPLETE
887,52.93,2025-01-20 20:18:14.076807,2025-01-20 20:33:34.162911,0 days 00:15:20.086104,1.1830081975624782,1.6198267746404815,0.43105467648517926,0.07519628376397139,14,4,SGD,0.0012585618458552886,2,,False,COMPLETE
888,52.910000000000004,2025-01-20 20:18:38.586211,2025-01-20 20:23:02.817604,0 days 00:04:24.231393,1.1290675066499603,1.492016693662358,0.42690399718352545,0.07538558200409796,75,2,SGD,0.0013359448740391847,2,,False,COMPLETE
889,53.13,2025-01-20 20:23:02.920957,2025-01-20 20:24:32.208746,0 days 00:01:29.287789,1.1775284590305224,1.3628737682783139,0.4344573557750649,0.08402315106016892,17,4,SGD,0.001142402141842569,2,,False,COMPLETE
890,52.86,2025-01-20 20:24:32.336885,2025-01-20 20:26:01.465609,0 days 00:01:29.128724,1.1487250784982774,1.3587074365002327,0.4137888802272041,0.09065551726492904,15,4,SGD,0.001187688105983861,2,,False,COMPLETE
891,53.0,2025-01-20 20:26:01.599020,2025-01-20 20:27:33.518989,0 days 00:01:31.919969,1.1110046713803536,1.3901646838857014,0.4042966441586411,0.0936316610415416,20,4,SGD,0.0011315032742660078,2,,False,COMPLETE
892,50.05,2025-01-20 20:27:33.609613,2025-01-20 20:29:21.496335,0 days 00:01:47.886722,1.0664987669417707,1.4749195041440157,0.7367826597316922,0.08762811825241827,55,2,SGD,0.0010864154316719405,2,,False,COMPLETE
893,53.169999999999995,2025-01-20 20:29:21.589635,2025-01-20 20:44:57.909966,0 days 00:15:36.320331,1.1784299198827088,1.4431918906435774,0.42690020015161817,0.08558779058633845,18,4,SGD,0.0013358488323347475,2,,False,COMPLETE
894,53.09,2025-01-20 20:33:34.278177,2025-01-20 20:48:51.323634,0 days 00:15:17.045457,1.15295649938744,1.4175146994832617,0.4173934339766238,0.08440621265289479,18,4,SGD,0.0014698575128266214,2,,False,COMPLETE
895,52.949999999999996,2025-01-20 20:44:58.008998,2025-01-20 21:00:34.094158,0 days 00:15:36.085160,1.1914779722013142,1.3685783531682543,0.4403690812562324,0.09521830017417623,19,4,SGD,0.0014085910125955512,2,,False,COMPLETE
896,53.05,2025-01-20 20:48:51.441855,2025-01-20 21:04:20.648813,0 days 00:15:29.206958,1.1939672171425746,1.3300227936180755,0.43954272001914513,0.09797786591493658,16,4,SGD,0.0013842945050539747,2,,False,COMPLETE
897,53.1,2025-01-20 21:00:34.206234,2025-01-20 21:01:42.362627,0 days 00:01:08.156393,1.0879200311228059,1.4101334890712638,0.43817433917396514,0.09447595172575994,16,4,SGD,0.0014351455505429362,2,,False,COMPLETE
898,53.13,2025-01-20 21:01:42.472484,2025-01-20 21:03:05.122365,0 days 00:01:22.649881,1.1229299217967343,1.2858035108983827,0.42951330983967445,0.08592052460599582,17,4,SGD,0.0010700963571461716,2,,False,COMPLETE
899,52.86,2025-01-20 21:03:05.222666,2025-01-20 21:04:21.498476,0 days 00:01:16.275810,1.0251145412252884,1.4049285081815892,0.40182953973820285,0.09956046535946354,17,4,SGD,0.0010467323567376235,2,,False,COMPLETE
900,53.080000000000005,2025-01-20 21:04:20.783433,2025-01-20 21:05:32.418891,0 days 00:01:11.635458,1.0305673289338024,1.3346738571809478,0.40092533341768744,0.09932416708872917,18,4,SGD,0.0011001695764291954,2,,False,COMPLETE
901,53.0,2025-01-20 21:04:21.599986,2025-01-20 21:05:47.272530,0 days 00:01:25.672544,1.060934551938895,1.2841954427772393,0.4179749650816879,0.08629911895327345,21,4,SGD,0.0009723804262666729,2,,False,COMPLETE
902,52.23,2025-01-20 21:05:32.534562,2025-01-20 21:21:51.227934,0 days 00:16:18.693372,1.1045624743942373,1.2626562020946237,0.32235450655016334,0.08543426246175521,20,4,SGD,0.0009843529711746298,2,,False,COMPLETE
903,53.15,2025-01-20 21:05:47.362595,2025-01-20 21:07:09.846917,0 days 00:01:22.484322,1.092052008949783,1.4394060109711562,0.4477362432150915,0.08267266341767712,18,4,SGD,0.0012295412541508946,2,,False,COMPLETE
904,53.11,2025-01-20 21:07:09.958250,2025-01-20 21:23:39.190228,0 days 00:16:29.231978,1.0752742484210114,1.3950221082460732,0.4521749335491971,0.09050556819437613,18,4,SGD,0.0013081832593327802,2,,False,COMPLETE
905,53.14,2025-01-20 21:21:51.355261,2025-01-20 21:23:20.351937,0 days 00:01:28.996676,1.0638298590921216,1.3786592054962556,0.45344399709309513,0.09636853517967925,18,4,SGD,0.001192669951224441,2,,False,COMPLETE
906,53.059999999999995,2025-01-20 21:23:20.479367,2025-01-20 21:40:03.080291,0 days 00:16:42.600924,0.9812311339635371,1.3822344992348514,0.46283617950553524,0.09379347972369924,18,4,SGD,0.001181230844513049,2,,False,COMPLETE
907,53.05,2025-01-20 21:23:39.297713,2025-01-20 21:40:22.977183,0 days 00:16:43.679470,1.0240591114988482,1.3745433749049814,0.46502495117127923,0.09873458474138329,17,4,SGD,0.0011577254257635332,2,,False,COMPLETE
908,53.05,2025-01-20 21:40:03.189556,2025-01-20 21:55:17.712038,0 days 00:15:14.522482,1.0381131700071509,1.2969033870252333,0.45647485206745475,0.09251028273413474,16,4,SGD,0.0011005722306365272,2,,False,COMPLETE
909,53.06999999999999,2025-01-20 21:40:23.078758,2025-01-20 21:41:35.366839,0 days 00:01:12.288081,1.0484600027615318,1.3143485337941005,0.44974001164285776,0.08855764491233112,15,4,SGD,0.0010668612992210179,2,,False,COMPLETE
910,53.1,2025-01-20 21:41:35.472173,2025-01-20 21:42:58.952127,0 days 00:01:23.479954,1.083240264026243,1.345973387773328,0.44939423751460816,0.09102232724761943,17,4,SGD,0.0009522312288368839,2,,False,COMPLETE
911,53.010000000000005,2025-01-20 21:42:59.059285,2025-01-20 21:44:27.624272,0 days 00:01:28.564987,1.049787214236695,1.4148390433713258,0.42592075623404047,0.09889946186353755,19,4,SGD,0.0013100851488164074,2,,False,COMPLETE
912,53.02,2025-01-20 21:44:27.739168,2025-01-20 21:45:57.394821,0 days 00:01:29.655653,1.0924650461718055,1.4364386155132922,0.45514922369124705,0.0883619209679655,20,4,SGD,0.0015408630699640423,2,,False,COMPLETE
913,53.14,2025-01-20 21:45:57.520636,2025-01-20 21:47:24.124575,0 days 00:01:26.603939,1.0049649282247233,1.431665287531784,0.43597068385140275,0.08429650637611308,22,4,SGD,0.0012900874927575885,2,,False,COMPLETE
914,53.14,2025-01-20 21:47:24.229168,2025-01-20 21:49:06.671120,0 days 00:01:42.441952,1.0037029574743948,1.3599119991826933,0.4278982276273662,0.09819415296813967,22,4,SGD,0.000942588597350385,2,,False,COMPLETE
915,53.03,2025-01-20 21:49:06.783542,2025-01-20 21:50:25.740312,0 days 00:01:18.956770,0.937778624449655,1.3430367416927178,0.4346443909436273,0.09787585654814539,19,4,SGD,0.0010245681831981043,2,,False,COMPLETE
916,52.800000000000004,2025-01-20 21:50:25.852056,2025-01-20 21:51:52.942000,0 days 00:01:27.089944,0.9716886022862876,1.2982226719628576,0.36560157486034484,0.09029672880583046,21,4,SGD,0.0009224277293252758,2,,False,COMPLETE
917,53.059999999999995,2025-01-20 21:51:53.033771,2025-01-20 21:53:23.430602,0 days 00:01:30.396831,0.9676619060716506,1.4284882729241641,0.41831781948484464,0.09989242010422533,22,4,SGD,0.0008982389406545041,2,,False,COMPLETE
918,53.11,2025-01-20 21:53:23.513902,2025-01-20 21:54:49.445138,0 days 00:01:25.931236,1.0006416820260218,1.436499353835989,0.43643738299921325,0.09999201185955116,24,4,SGD,0.0011347425233394057,2,,False,COMPLETE
919,49.15,2025-01-20 21:54:49.549262,2025-01-20 21:55:45.369203,0 days 00:00:55.819941,0.9453196096497147,1.3889090458557625,0.4087081240389311,0.08873846586936336,23,15,SGD,0.0009991907624885255,2,,False,COMPLETE
920,52.94,2025-01-20 21:55:17.838538,2025-01-20 21:56:33.656322,0 days 00:01:15.817784,0.9495847546803516,1.364729210625018,0.40733150775901517,0.08657947574851896,22,4,SGD,0.0009306308990512323,2,,False,COMPLETE
921,53.169999999999995,2025-01-20 21:55:45.473373,2025-01-20 21:57:02.245289,0 days 00:01:16.771916,0.9939651067211257,1.3693700633249493,0.4277754071437989,0.08553198015528068,22,4,SGD,0.0009007580982877995,2,,False,COMPLETE
922,52.76,2025-01-20 21:56:33.756760,2025-01-20 21:57:34.015712,0 days 00:01:00.258952,0.9187068748123199,1.3687538509437198,0.4323934222294641,0.08379301641819631,13,4,SGD,0.0012207154459151842,2,,False,COMPLETE
923,52.73,2025-01-20 21:57:02.357518,2025-01-20 21:59:04.114577,0 days 00:02:01.757059,0.8926854235166162,1.3932204965843256,0.38948750533900695,0.08943498975237475,24,4,SGD,0.0012481238054749626,2,,False,COMPLETE
924,53.03,2025-01-20 21:57:34.113317,2025-01-20 21:58:52.762568,0 days 00:01:18.649251,1.0097112845018386,1.4119949158765277,0.44331582671370195,0.09809159681887311,23,4,SGD,0.000855662585921796,2,,False,COMPLETE
925,52.87,2025-01-20 21:58:52.909204,2025-01-20 22:00:14.044432,0 days 00:01:21.135228,0.9783600300442332,1.3543572766109833,0.38262526566643407,0.0904293692886957,21,4,SGD,0.00125316602440072,2,,False,COMPLETE
926,51.800000000000004,2025-01-20 21:59:04.202155,2025-01-20 22:00:29.170040,0 days 00:01:24.967885,0.9191529630470929,1.4395511454696939,0.4204716229314299,0.0828067987268793,21,10,SGD,0.000896474255339263,2,,False,COMPLETE
927,53.2,2025-01-20 22:00:14.148939,2025-01-20 22:01:31.819974,0 days 00:01:17.671035,1.0372910185128532,1.4419450965166032,0.41930591694952446,0.09937106253914704,20,4,SGD,0.0008840379426340268,2,,False,COMPLETE
928,53.05,2025-01-20 22:00:29.262028,2025-01-20 22:01:38.602383,0 days 00:01:09.340355,0.9973738203565145,1.424432776950555,0.4648355404544194,0.08657107481692111,19,4,SGD,0.0008975142882308645,2,,False,COMPLETE
929,52.980000000000004,2025-01-20 22:01:31.911648,2025-01-20 22:02:44.158649,0 days 00:01:12.247001,1.0211355218501044,1.445135736287432,0.39543672264088037,0.09610318061964601,19,4,SGD,0.0010081670219549807,2,,False,COMPLETE
930,52.959999999999994,2025-01-20 22:01:38.706935,2025-01-20 22:02:59.232756,0 days 00:01:20.525821,0.9764078130643408,1.3819371481380356,0.4006954991202187,0.09359693246638646,20,4,SGD,0.0008608836983889619,2,,False,COMPLETE
931,52.980000000000004,2025-01-20 22:02:44.267614,2025-01-20 22:04:05.985119,0 days 00:01:21.717505,0.9838788509242276,1.4313151949891576,0.40812248097467135,0.09854820470474306,20,4,SGD,0.0008551091123713294,0,,False,COMPLETE
932,51.370000000000005,2025-01-20 22:02:59.341852,2025-01-20 22:05:01.114765,0 days 00:02:01.772913,1.0284366870665616,1.4615545165941621,0.2660749744963947,0.09590406934263575,23,4,SGD,0.00141992904898711,0,,False,COMPLETE
933,53.14,2025-01-20 22:04:06.087987,2025-01-20 22:05:27.651620,0 days 00:01:21.563633,0.9973829042370266,1.4603164233770989,0.4197355661773304,0.08293587859676986,21,4,SGD,0.0013732051780097716,2,,False,COMPLETE
934,52.800000000000004,2025-01-20 22:05:01.218498,2025-01-20 22:07:03.127711,0 days 00:02:01.909213,0.8717023719915331,1.447019059240613,0.3748882736103613,0.08396410163377278,22,4,SGD,0.0013384877713129154,2,,False,COMPLETE
935,52.73,2025-01-20 22:05:27.774020,2025-01-20 22:07:24.578591,0 days 00:01:56.804571,0.9662479827761986,1.4488611674696512,0.3691014898956304,0.08443858097785448,22,4,SGD,0.0011733597506284022,2,,False,COMPLETE
936,52.16,2025-01-20 22:07:03.224039,2025-01-20 22:09:08.539607,0 days 00:02:05.315568,0.9561775190374818,1.414637583103431,0.35408226516318403,0.08397589505072423,25,3,SGD,0.0011003003526589392,2,,False,COMPLETE
937,48.24,2025-01-20 22:07:24.666876,2025-01-20 22:08:55.560715,0 days 00:01:30.893839,0.9811321374408677,1.4064609559446732,0.41498598339858617,0.08463984440942035,25,17,SGD,0.0009867794271633285,2,,False,COMPLETE
938,53.04,2025-01-20 22:08:55.674798,2025-01-20 22:10:17.057415,0 days 00:01:21.382617,0.951712029670429,1.3731993144551078,0.3989288730250147,0.09818126843629872,21,4,SGD,0.0015379863579941268,2,,False,COMPLETE
939,52.89,2025-01-20 22:09:08.631816,2025-01-20 22:10:29.812822,0 days 00:01:21.181006,1.0262261964084052,1.467227819018213,0.39122493584184964,0.09212887005638234,21,4,SGD,0.001701654661407367,2,,False,COMPLETE
