number,value,datetime_start,datetime_complete,duration,params_gamma_1,params_gamma_2,params_lambda,params_lr,params_n_clusters,params_n_points,params_optimizer,params_reg_lambda,params_reg_type,params_tanh_x,params_use_tanh,state
0,51.1,2025-01-20 00:34:32.964606,2025-01-20 00:37:24.812679,0 days 00:02:51.848073,0.669246014263961,1.8380876125010144,0.5782499412570317,0.03906718294489592,74,18,SGD,0.00029458150714460087,0,4.03306119519475,True,COMPLETE
1,48.65,2025-01-20 00:37:24.887931,2025-01-20 00:39:50.473451,0 days 00:02:25.585520,1.297529246658031,1.477508405593293,0.8432716942930958,0.001668520142209477,73,11,Adam,0.0001176272375623182,2,,False,COMPLETE
2,49.919999999999995,2025-01-20 00:39:50.543666,2025-01-20 00:41:50.001103,0 days 00:01:59.457437,0.4951043023453906,1.9793110279529376,0.4773136858453737,0.08776506904380767,62,32,Adam,0.01218083286707807,0,,False,COMPLETE
3,49.220000000000006,2025-01-20 00:41:50.072611,2025-01-20 00:43:12.163512,0 days 00:01:22.090901,1.8836035406831075,1.4015354791939434,0.21986259924875995,0.001199773003325248,23,9,Adam,0.3224555456045164,2,,False,COMPLETE
4,44.67,2025-01-20 00:42:13.626783,2025-01-20 00:43:01.181570,0 days 00:00:47.554787,0.7397081994966239,0.4257084879038016,0.7848230544392161,0.015130915827336756,12,12,SGD,0.13174405321408555,2,,False,COMPLETE
5,49.14,2025-01-20 00:43:01.241140,2025-01-20 00:44:28.073591,0 days 00:01:26.832451,0.7205077758576783,1.3790247203770658,0.2691007654734778,0.09325069753754912,49,19,Adam,0.19717777756301552,0,,False,COMPLETE
6,39.32,2025-01-20 00:43:12.248242,2025-01-20 00:45:17.378694,0 days 00:02:05.130452,0.6057889515573152,1.788199596015357,0.9614613273370529,0.0027855274304301072,32,30,Adam,0.0011218160787467473,0,1.780520176117222,True,COMPLETE
7,47.36,2025-01-20 00:44:28.146042,2025-01-20 00:45:21.027191,0 days 00:00:52.881149,1.7628291776575686,1.2337978131599479,0.8329825722543795,0.09268453854254767,23,11,Adam,0.0016392835699434653,2,2.7587221927006453,True,COMPLETE
8,44.81,2025-01-20 00:45:17.472856,2025-01-20 00:46:58.701385,0 days 00:01:41.228529,0.6261967806747448,1.7174552408566741,0.9819692748825923,0.0033338432896571537,70,10,Adam,0.07902837930390263,1,5.366009782628885,True,COMPLETE
9,45.18,2025-01-20 00:45:21.084584,2025-01-20 00:48:19.835074,0 days 00:02:58.750490,0.41490997569946864,1.5575282868623785,0.22647294624493597,0.011653722288407917,23,11,SGD,0.00024175709985096205,2,,False,COMPLETE
10,49.85,2025-01-20 00:46:58.775047,2025-01-20 00:48:36.493695,0 days 00:01:37.718648,1.0136706596182492,1.5985669901399673,0.36509178454635993,0.02171010139420616,54,23,Adam,0.0004890266953252528,1,,False,COMPLETE
11,52.18000000000001,2025-01-20 00:48:19.890543,2025-01-20 00:50:12.826119,0 days 00:01:52.935576,1.2386341345518548,0.6959953505217833,0.5537996273103752,0.02992411373999785,47,2,SGD,0.009494418852435044,1,9.55014516589428,True,COMPLETE
12,44.06,2025-01-20 00:48:36.573327,2025-01-20 00:50:22.926665,0 days 00:01:46.353338,0.20261173705153873,1.9500832663052636,0.543040443632807,0.03784047657023772,61,37,SGD,0.011874053913282959,0,8.14481747564879,True,COMPLETE
13,50.8,2025-01-20 00:50:12.881049,2025-01-20 00:53:02.821875,0 days 00:02:49.940826,1.3205065908117763,0.7932262528213352,0.6077623132866944,0.03603674058497354,46,1,SGD,0.012947830067868248,1,9.95135558026248,True,COMPLETE
14,49.66,2025-01-20 00:50:22.989047,2025-01-20 00:54:29.402192,0 days 00:04:06.413145,1.3855900160320336,0.7938088631783191,0.6850603008997114,0.030999506925964516,38,1,SGD,0.0030177603021009185,1,9.797352270855612,True,COMPLETE
15,49.96,2025-01-20 00:53:02.870517,2025-01-20 01:03:02.894528,0 days 00:10:00.024011,1.0257013947552045,0.8064976610612906,0.6631530681245814,0.0006085960018206333,37,1,SGD,0.002896425871807043,1,5.218405407132706,True,COMPLETE
16,51.629999999999995,2025-01-20 00:54:29.474495,2025-01-20 01:04:30.006398,0 days 00:10:00.531903,1.0118864098315572,0.9079966702016836,0.4523084054259574,0.000531557329889805,62,18,SGD,0.034239529097081535,1,5.293363143457528,True,COMPLETE
17,50.970000000000006,2025-01-20 01:03:02.938942,2025-01-20 01:05:23.555788,0 days 00:02:20.616846,1.60358685958189,0.370984519229103,0.4494153670728192,0.006727541986944971,4,2,SGD,0.9210034665718736,0,6.801554164231176,True,COMPLETE
18,47.449999999999996,2025-01-20 01:04:30.080159,2025-01-20 01:05:59.197706,0 days 00:01:29.117547,1.610379767744139,0.21186864492250967,0.42791064138010043,0.006722504705855488,60,24,SGD,0.04421767608149203,1,6.764268099125127,True,COMPLETE
19,49.76,2025-01-20 01:05:23.624865,2025-01-20 01:16:04.993544,0 days 00:10:41.368679,0.9208879740324615,0.9896970523461103,0.3500529589073166,0.006514313898707037,60,24,SGD,0.036355115002404,1,0.1422076448319025,True,COMPLETE
20,50.82,2025-01-20 01:05:59.276820,2025-01-20 01:21:03.905810,0 days 00:15:04.628990,1.154939246749877,0.998026888479423,0.3508820613264638,0.0005552397839130107,46,16,SGD,0.04609700019404939,1,0.5483027367153834,True,COMPLETE
21,52.12,2025-01-20 01:16:05.047965,2025-01-20 01:23:51.763707,0 days 00:07:46.715742,1.2230702465881542,0.5995956529928302,0.5121983939785199,0.001032499141942028,48,6,SGD,0.005079311040204895,1,8.031098563542223,True,COMPLETE
22,51.39,2025-01-20 01:21:03.990777,2025-01-20 01:22:53.448596,0 days 00:01:49.457819,0.9406195673582416,0.5978988016005861,0.5543688096738519,0.053515127489775785,75,17,SGD,0.006100306700271351,0,3.371432995521751,True,COMPLETE
23,52.43,2025-01-20 01:22:53.516016,2025-01-20 01:25:34.389662,0 days 00:02:40.873646,0.9105097417910147,0.5854495057379885,0.5319030019733543,0.011894267629347624,68,6,SGD,0.004590591105969278,1,3.467132197146144,True,COMPLETE
24,52.339999999999996,2025-01-20 01:23:51.830490,2025-01-20 01:34:20.260646,0 days 00:10:28.430156,1.1991051839613012,0.618740437198375,0.5097223899083779,0.001083024314726016,52,5,SGD,0.022662218473887757,1,8.497024692204288,True,COMPLETE
25,50.77,2025-01-20 01:25:34.467859,2025-01-20 01:27:31.610524,0 days 00:01:57.142665,1.2052683985955048,0.6383916414111367,0.6869026598269644,0.011114358746387306,53,6,SGD,0.005603383233405908,1,8.364833327192635,True,COMPLETE
26,51.73,2025-01-20 01:27:31.678284,2025-01-20 01:29:26.428170,0 days 00:01:54.749886,1.5171293326497532,0.5108929353170021,0.5155366462340059,0.0038702186899178953,31,5,SGD,0.000945862033827106,1,8.306032845462514,True,COMPLETE
27,51.080000000000005,2025-01-20 01:29:26.498196,2025-01-20 01:31:46.748754,0 days 00:02:20.250558,0.7968907350632897,0.6695694919739138,0.639739045202072,0.01743956453054927,42,6,SGD,0.004744655827565128,1,6.894985560241718,True,COMPLETE
28,49.94,2025-01-20 01:31:46.822510,2025-01-20 01:36:18.190011,0 days 00:04:31.367501,1.179307429307799,0.2014977315191751,0.7421975797004619,0.0012667973442880979,51,5,SGD,0.020411556479435683,1,9.179884226191179,True,COMPLETE
29,50.1,2025-01-20 01:34:20.320129,2025-01-20 01:38:07.361971,0 days 00:03:47.041842,1.4044191881437162,0.23298802088185983,0.7335364718269646,0.010244696200005014,68,4,SGD,0.02156903702941115,1,9.148411757109246,True,COMPLETE
30,51.44,2025-01-20 01:36:18.266825,2025-01-20 01:44:37.330446,0 days 00:08:19.063621,1.4304182115833182,1.1683289876338516,0.5726540883648736,0.02376164389081522,70,15,SGD,0.019479034560734843,1,4.272337789420418,True,COMPLETE
31,51.41,2025-01-20 01:38:07.418976,2025-01-20 01:39:41.814746,0 days 00:01:34.395770,0.8765543062404106,1.132307242076231,0.5812625622986491,0.004452563157792454,67,15,SGD,0.002376391420611874,1,4.0725746957924045,True,COMPLETE
32,51.93,2025-01-20 01:39:41.867069,2025-01-20 01:50:10.664106,0 days 00:10:28.797037,1.245459715686697,0.5010618004711842,0.5039362745955032,0.0009114570554361877,56,8,SGD,0.0069083914291655085,1,7.49182749389929,True,COMPLETE
33,51.88,2025-01-20 01:44:37.425893,2025-01-20 01:58:23.421859,0 days 00:13:45.995966,1.2126507916460698,0.3987284225017245,0.4895245090483888,0.002059138540246759,45,7,SGD,0.004442612542490759,1,8.181831268051065,True,COMPLETE
34,52.21,2025-01-20 01:50:10.713609,2025-01-20 01:56:14.280150,0 days 00:06:03.566541,1.0917993636947556,0.716370123439197,0.40458611151401996,0.002356142551049082,42,7,SGD,0.009207390357022869,1,6.089523559814522,True,COMPLETE
35,51.92,2025-01-20 01:56:14.340977,2025-01-20 01:59:21.221963,0 days 00:03:06.880986,1.0652374966234464,0.721952291477972,0.3828286635022724,0.0022024019246384675,42,8,SGD,0.009149942614938462,1,6.178883327304915,True,COMPLETE
36,52.22,2025-01-20 01:58:23.504040,2025-01-20 02:12:22.769260,0 days 00:13:59.265220,1.1053871821887982,0.7218898820867041,0.40176119351046913,0.0018328427036201885,34,3,SGD,0.009297745485345966,2,,False,COMPLETE
37,52.5,2025-01-20 01:59:21.289454,2025-01-20 02:09:22.188877,0 days 00:10:00.899423,0.8127768734998271,0.9263474691609257,0.4141772544465067,0.0013530477864362406,32,3,SGD,0.08211771918334611,2,,False,COMPLETE
38,51.559999999999995,2025-01-20 02:09:22.258843,2025-01-20 02:19:30.699428,0 days 00:10:08.440585,0.8603684874491672,0.9128001256735997,0.3022598529901853,0.0007492133733288829,32,3,SGD,0.11798827946318671,2,,False,COMPLETE
39,51.5,2025-01-20 02:12:22.835095,2025-01-20 02:16:53.513951,0 days 00:04:30.678856,0.8615443584382662,0.9655691464264716,0.2965922813329523,0.0015208979484801785,28,3,Adam,0.26722707150011,2,,False,COMPLETE
40,50.260000000000005,2025-01-20 02:16:53.601999,2025-01-20 02:19:59.206485,0 days 00:03:05.604486,0.47501111644407407,0.891710676654389,0.30258173295175617,0.0007868213788719828,15,4,Adam,0.0989065610792192,2,,False,COMPLETE
41,52.12,2025-01-20 02:19:30.759557,2025-01-20 02:20:45.215602,0 days 00:01:14.456045,0.5419295731568012,0.49325342506376424,0.4150007773364769,0.0015394494379354765,17,4,Adam,0.06317822648815873,2,,False,COMPLETE
42,51.76,2025-01-20 02:19:59.280812,2025-01-20 02:29:34.385757,0 days 00:09:35.104945,0.7014273835690241,0.4827909747644409,0.41908625541099004,0.0019188547558387063,36,13,SGD,0.016365035990681023,2,,False,COMPLETE
43,52.33,2025-01-20 02:20:45.281046,2025-01-20 02:30:45.428907,0 days 00:10:00.147861,0.6977439585865437,1.0589690079197898,0.4028248886218788,0.002396926693190675,35,9,SGD,0.022661559605622855,2,,False,COMPLETE
44,51.22,2025-01-20 02:29:34.461388,2025-01-20 02:39:04.564907,0 days 00:09:30.103519,0.7961856378710166,0.3138368299464584,0.39366979777430816,0.0027411127401582923,27,10,SGD,0.5286159704645048,2,,False,COMPLETE
45,52.339999999999996,2025-01-20 02:30:45.493407,2025-01-20 02:37:47.992154,0 days 00:07:02.498747,0.7701342013209717,1.2605005765951331,0.47541832931830136,0.002926443888066048,27,9,SGD,0.028177446355536543,2,,False,COMPLETE
46,50.49,2025-01-20 02:37:48.040634,2025-01-20 02:40:34.233296,0 days 00:02:46.192662,0.3589192081536021,1.3133905939781947,0.4739397503206064,0.005089213979958392,23,9,SGD,0.47476432142290487,2,,False,COMPLETE
47,50.31,2025-01-20 02:39:04.665704,2025-01-20 02:43:37.988634,0 days 00:04:33.322930,0.3379521438918139,1.340906108953288,0.4676642895875047,0.004438758059227589,25,9,SGD,0.16120119616045311,2,,False,COMPLETE
48,49.97,2025-01-20 02:40:34.290610,2025-01-20 02:50:52.770030,0 days 00:10:18.479420,0.6532319787954248,1.26924844680999,0.6042421963022535,0.00125790115276188,28,13,SGD,0.18487017716593473,2,,False,COMPLETE
49,48.730000000000004,2025-01-20 02:43:38.060772,2025-01-20 02:44:56.431089,0 days 00:01:18.370317,0.618783888263908,1.0782048074149237,0.6137724500893066,0.003144871237085486,19,12,Adam,0.06875750434604004,2,,False,COMPLETE
50,44.62,2025-01-20 02:44:56.523096,2025-01-20 02:46:12.973774,0 days 00:01:16.450678,0.7419027043674409,1.2492151212187816,0.9062809369993108,0.008096760807813259,28,12,SGD,0.024917420258507923,2,,False,COMPLETE
51,48.46,2025-01-20 02:46:13.049413,2025-01-20 02:58:30.656948,0 days 00:12:17.607535,1.9693375275704517,1.4306075263139024,0.5328227089568031,0.0012300173558137577,40,20,SGD,0.02833523810473243,2,,False,COMPLETE
52,52.18000000000001,2025-01-20 02:50:52.823891,2025-01-20 03:01:06.427387,0 days 00:10:13.603496,0.9607891741519318,1.0697058287732644,0.3343106579439533,0.0011534649866562828,34,3,SGD,0.027891970472615372,2,,False,COMPLETE
53,52.54,2025-01-20 02:58:30.747870,2025-01-20 03:14:47.290379,0 days 00:16:16.542509,0.9851322569248724,1.0773795989111161,0.4459009053836131,0.0015559822118841851,34,2,SGD,0.014813486061947585,2,,False,COMPLETE
54,52.23,2025-01-20 03:01:06.486677,2025-01-20 03:11:17.396374,0 days 00:10:10.909697,0.7728299685364628,0.8131506458498082,0.4373678506463407,0.0016329318394825106,34,2,SGD,0.052295133557481874,2,,False,COMPLETE
55,51.449999999999996,2025-01-20 03:11:17.449023,2025-01-20 03:21:38.471974,0 days 00:10:21.022951,0.5413443750204149,0.7975450600750162,0.44848924929497413,0.002646065937520319,31,1,SGD,0.053831231327031125,2,,False,COMPLETE
56,50.96000000000001,2025-01-20 03:14:47.369371,2025-01-20 03:28:48.016127,0 days 00:14:00.646756,0.990730816289035,1.1531027440508328,0.24990795765951263,0.002915395837911729,20,5,SGD,0.014618475685292622,0,,False,COMPLETE
57,50.23,2025-01-20 03:21:38.530073,2025-01-20 03:31:31.350785,0 days 00:09:52.820712,0.9857330668725969,1.1398648051926838,0.22604257158442126,0.0008559670984300609,20,5,SGD,0.014271729720363108,0,,False,COMPLETE
58,48.5,2025-01-20 03:28:48.095175,2025-01-20 03:33:05.527187,0 days 00:04:17.432012,0.8909458714477879,1.024956588109254,0.5380418693639776,0.0009481840008293848,64,37,SGD,0.0013563177569926891,2,,False,COMPLETE
59,46.83,2025-01-20 03:31:31.404974,2025-01-20 03:34:18.558140,0 days 00:02:47.153166,0.8401910502555422,1.5404845881872302,0.37305475970403446,0.0010004806145911573,64,40,SGD,0.00012042230133944733,2,,False,COMPLETE
60,47.85,2025-01-20 03:33:05.618946,2025-01-20 03:34:31.011556,0 days 00:01:25.392610,0.8175074095039072,1.4367340409496232,0.4850694513832138,0.0014940310578011365,39,28,Adam,0.040016117208615504,2,,False,COMPLETE
61,51.59,2025-01-20 03:34:18.610487,2025-01-20 03:36:08.494692,0 days 00:01:49.884205,0.5649385045897197,1.6939677133754483,0.4868406923120963,0.0006514145137118474,57,7,Adam,0.08511431183072027,2,,False,COMPLETE
62,52.33,2025-01-20 03:34:31.096399,2025-01-20 03:49:59.386125,0 days 00:15:28.289726,0.7418779490630073,0.9038289402561019,0.451045777600996,0.0007031357201318764,35,2,SGD,0.08818480696519239,2,,False,COMPLETE
63,52.370000000000005,2025-01-20 03:36:08.560992,2025-01-20 03:46:12.841975,0 days 00:10:04.280983,0.755898182821,0.8465986071116531,0.443225078040331,0.0035820255332974006,35,2,SGD,0.036584376422958795,2,,False,COMPLETE
64,51.38,2025-01-20 03:46:12.896564,2025-01-20 03:56:23.764330,0 days 00:10:10.867766,0.7001816377315531,1.2113335456459402,0.34019749066007077,0.0033797088395962783,36,1,SGD,0.03075298947767893,2,,False,COMPLETE
65,52.21,2025-01-20 03:49:59.463800,2025-01-20 03:59:22.505173,0 days 00:09:23.041373,0.9291430898444253,1.1944433802135204,0.3399516359155268,0.014367787561648748,30,4,SGD,0.03160149627089642,2,,False,COMPLETE
66,52.03,2025-01-20 03:56:23.817601,2025-01-20 03:57:22.175145,0 days 00:00:58.357544,1.3270532138630788,0.6023113529924712,0.5208355064287843,0.013592420322151407,31,6,SGD,0.011246044791953628,2,,False,COMPLETE
67,52.470000000000006,2025-01-20 03:57:22.230728,2025-01-20 04:08:12.781623,0 days 00:10:50.550895,1.1340310452693654,0.955469122497224,0.5580475537048419,0.005699063460999079,72,8,SGD,0.018904385617437226,0,,False,COMPLETE
68,52.480000000000004,2025-01-20 03:59:22.585944,2025-01-20 04:14:15.553620,0 days 00:14:52.967676,1.1422150601011842,1.0539373370289626,0.43046633188560096,0.0052117171781956555,45,10,SGD,0.0072808540783280565,0,,False,COMPLETE
69,51.5,2025-01-20 04:08:12.851378,2025-01-20 04:19:10.475782,0 days 00:10:57.624404,1.1353517742016077,0.9588558423311704,0.6332249938764402,0.008662545073443304,73,8,SGD,0.0035033461754447183,0,,False,COMPLETE
70,51.559999999999995,2025-01-20 04:14:15.636119,2025-01-20 04:29:48.147021,0 days 00:15:32.510902,1.1258202802872823,0.9570272546149449,0.6419022209172389,0.009644743272096072,72,7,SGD,0.003560309903481353,0,2.7622945203471705,True,COMPLETE
71,52.28,2025-01-20 04:19:10.532077,2025-01-20 04:30:07.589642,0 days 00:10:57.057565,1.2761785347120151,0.8743531482360813,0.5754918300301336,0.005726803590659679,71,7,SGD,0.00219951153602009,0,1.8164214676025092,True,COMPLETE
72,51.55,2025-01-20 04:29:48.234912,2025-01-20 04:46:16.415087,0 days 00:16:28.180175,1.0404881585618229,0.8480653023220821,0.552125290964821,0.005658300344850922,49,11,SGD,0.006903651157943333,0,,False,COMPLETE
73,52.629999999999995,2025-01-20 04:30:07.648351,2025-01-20 04:35:07.156955,0 days 00:04:59.508604,0.8990841077400124,0.8568143358767535,0.5051661189037391,0.003874206704148081,50,5,SGD,0.007055653069409812,0,,False,COMPLETE
74,52.300000000000004,2025-01-20 04:35:07.228047,2025-01-20 04:37:56.055345,0 days 00:02:48.827298,1.0033122401914452,0.8266331992797351,0.5579977876188816,0.005010886076758633,44,5,SGD,0.006805044393705472,0,,False,COMPLETE
75,52.470000000000006,2025-01-20 04:37:56.125584,2025-01-20 04:48:23.034338,0 days 00:10:26.908754,1.0500559095355786,0.8513863804952488,0.5187683191572188,0.003892553575474818,49,2,SGD,0.01822934649567631,0,,False,COMPLETE
76,52.43,2025-01-20 04:46:16.506738,2025-01-20 05:02:13.662756,0 days 00:15:57.156018,1.0447145147767891,0.7798847403429069,0.503914635671594,0.0034528111233851923,53,2,SGD,0.01879959107799793,0,,False,COMPLETE
77,52.64,2025-01-20 04:48:23.085971,2025-01-20 04:58:47.484534,0 days 00:10:24.398563,1.0654313397157709,0.7646646487407208,0.4282016616048524,0.003965422967183097,49,2,SGD,0.0007887226915325298,0,,False,COMPLETE
78,51.7,2025-01-20 04:58:47.555553,2025-01-20 05:09:20.676793,0 days 00:10:33.121240,1.0545631928856523,0.7374883293348338,0.5035249160669287,0.004079084850381583,55,1,SGD,0.00083152372510297,0,,False,COMPLETE
79,51.970000000000006,2025-01-20 05:02:13.749179,2025-01-20 05:16:47.663095,0 days 00:14:33.913916,1.1602132021768032,1.0216597047769689,0.4292750255289702,0.007444696046958255,50,1,SGD,0.000686111471413189,0,,False,COMPLETE
80,52.370000000000005,2025-01-20 05:09:20.746908,2025-01-20 05:20:11.615372,0 days 00:10:50.868464,0.903788189378465,0.5617222339979012,0.42603187926369773,0.00674027733693249,59,3,SGD,0.0007474455709964987,0,,False,COMPLETE
81,52.470000000000006,2025-01-20 05:16:47.746888,2025-01-20 05:25:06.033772,0 days 00:08:18.286884,0.9136573927322938,0.5434885157292346,0.4646660843040481,0.0059300822892752745,48,4,SGD,0.000269016757942059,0,,False,COMPLETE
82,52.559999999999995,2025-01-20 05:20:11.672169,2025-01-20 05:24:35.292036,0 days 00:04:23.619867,1.0485252071195637,0.7684983234433644,0.5275951119048125,0.006007442649593635,47,3,SGD,0.017623801126909762,0,,False,COMPLETE
83,51.89,2025-01-20 05:24:35.349118,2025-01-20 05:27:32.059075,0 days 00:02:56.709957,1.0713761645895632,0.9353050612157393,0.5933978431959701,0.005828668352971858,48,4,SGD,0.0002819255764841323,0,,False,COMPLETE
84,52.449999999999996,2025-01-20 05:25:06.112672,2025-01-20 05:31:00.572816,0 days 00:05:54.460144,1.1004439104256312,0.6691180417839525,0.46686311582861734,0.005465332084333458,48,4,SGD,0.0002988726220294454,0,,False,COMPLETE
85,52.62,2025-01-20 05:27:32.129652,2025-01-20 05:36:43.455004,0 days 00:09:11.325352,0.9683072667993418,1.0104105170551179,0.4688047802915795,0.004617464491860433,44,3,SGD,0.0004572852266490068,0,,False,COMPLETE
86,52.38,2025-01-20 05:31:00.667252,2025-01-20 05:47:46.321385,0 days 00:16:45.654133,0.9680671369664612,1.1081482258847026,0.3662986621174605,0.0046167784818497495,44,3,SGD,0.00014843010480704584,0,,False,COMPLETE
87,52.56999999999999,2025-01-20 05:36:43.512178,2025-01-20 05:40:34.353954,0 days 00:03:50.841776,0.9482693556295023,1.1088351309671292,0.38498888397403097,0.0076393371718660955,44,6,SGD,0.00041643791956631445,0,,False,COMPLETE
88,52.39,2025-01-20 05:40:34.406718,2025-01-20 05:44:54.712351,0 days 00:04:20.305633,0.9657495345919698,1.0342110459652143,0.3649785518472929,0.007557753680583731,44,6,SGD,0.00041440050759523347,0,,False,COMPLETE
89,51.959999999999994,2025-01-20 05:44:54.773554,2025-01-20 05:47:16.080424,0 days 00:02:21.306870,1.3307882540041966,1.1094976039755615,0.3878539774247918,0.004500879104386299,41,10,SGD,0.0005895914087434757,0,,False,COMPLETE
90,52.52,2025-01-20 05:47:16.146871,2025-01-20 05:49:40.985034,0 days 00:02:24.838163,1.1763283952283652,0.9934842996530312,0.4097620278818738,0.009032342159036436,38,8,SGD,0.0010942161723782793,0,,False,COMPLETE
91,52.71,2025-01-20 05:47:46.403954,2025-01-20 05:51:32.841631,0 days 00:03:46.437677,1.1836411508516296,0.9749248540714411,0.4087775544312041,0.009190090982416731,38,5,SGD,0.00045061210214283225,0,,False,COMPLETE
92,52.62,2025-01-20 05:49:41.037732,2025-01-20 05:51:50.912480,0 days 00:02:09.874748,1.1490695078124786,1.0000523824378162,0.41271269539691563,0.008919091818868324,46,8,SGD,0.00045437656999353614,0,,False,COMPLETE
93,52.62,2025-01-20 05:51:32.928690,2025-01-20 05:55:01.346380,0 days 00:03:28.417690,1.2661681769540862,1.0158725950156398,0.4116459249774002,0.00930240607903856,38,5,SGD,0.0003793840175400936,0,,False,COMPLETE
94,52.580000000000005,2025-01-20 05:51:50.971919,2025-01-20 05:54:32.246382,0 days 00:02:41.274463,1.2380145821614648,0.9875955457788311,0.4100691613357091,0.009718973202597014,37,5,SGD,0.00041706673827038824,0,,False,COMPLETE
95,51.78,2025-01-20 05:54:32.307497,2025-01-20 05:56:55.145223,0 days 00:02:22.837726,1.258842032945054,0.9964348952709742,0.31134758805735735,0.017035790212473305,38,5,SGD,0.0004917862743966376,0,,False,COMPLETE
96,51.77,2025-01-20 05:55:01.439012,2025-01-20 05:58:50.032162,0 days 00:03:48.593150,1.2910571984302077,1.0031677062518345,0.3135225047853061,0.011789574636104663,42,5,SGD,0.0001914838993942862,0,,False,COMPLETE
