number,value,datetime_start,datetime_complete,duration,params_gamma_1,params_gamma_2,params_lambda,params_lr,params_n_clusters,params_n_points,params_optimizer,params_reg_lambda,params_reg_type,params_tanh_x,params_use_tanh,state
97,52.03,2025-01-20 05:56:55.201988,2025-01-20 05:58:46.240862,0 days 00:01:51.038874,1.3802048648690284,0.7488656198654438,0.38686164222034203,0.011357366217628222,46,6,SGD,0.00020857728008427974,0,,False,COMPLETE
98,52.580000000000005,2025-01-20 05:58:46.298122,2025-01-20 06:01:00.594598,0 days 00:02:14.296476,1.215680751244247,1.1774596794189693,0.45759147685305696,0.012873905012713212,51,6,Adam,0.00036736276210135114,0,,False,COMPLETE
99,52.17,2025-01-20 05:58:50.127656,2025-01-20 06:00:04.792241,0 days 00:01:14.664585,1.2239735134753178,1.1785788100582995,0.3566705083738026,0.010040918223198534,51,6,Adam,0.0003571527264280507,0,,False,COMPLETE
100,45.1,2025-01-20 06:00:04.861423,2025-01-20 06:08:36.312182,0 days 00:08:31.450759,1.4287940394289087,0.884589512196125,0.27891958298788494,0.013310220399318081,43,27,SGD,0.0005307453898933833,0,,False,COMPLETE
101,52.6,2025-01-20 06:01:00.656293,2025-01-20 06:02:16.647347,0 days 00:01:15.991054,1.1878862874611236,1.1179647668574926,0.45861687156381403,0.008272203018110215,40,7,Adam,0.0005353256901705458,0,,False,COMPLETE
102,52.6,2025-01-20 06:02:16.704038,2025-01-20 06:03:33.692896,0 days 00:01:16.988858,1.2173600199117105,1.116659696337739,0.45978521527216143,0.01641205991480868,40,7,Adam,0.0005606594586082157,0,,False,COMPLETE
103,52.239999999999995,2025-01-20 06:03:33.749251,2025-01-20 06:04:39.334037,0 days 00:01:05.584786,1.3632632384830636,1.1356456244936666,0.3918207134674443,0.01983310862143334,40,7,Adam,0.0005274367575313424,0,,False,COMPLETE
104,52.739999999999995,2025-01-20 06:04:39.382885,2025-01-20 06:05:48.461235,0 days 00:01:09.078350,1.1833050163269192,1.2302043702594934,0.4633246381045505,0.016635565177176008,43,6,Adam,0.00038376923947441285,0,,False,COMPLETE
105,46.48,2025-01-20 06:05:48.516621,2025-01-20 06:07:02.542613,0 days 00:01:14.025992,1.4377305944651297,1.3310462535242304,0.4587186076327856,0.02602814349560005,42,28,Adam,0.0003543052115459063,0,,False,COMPLETE
106,49.480000000000004,2025-01-20 06:07:02.608833,2025-01-20 06:08:36.491179,0 days 00:01:33.882346,1.2002393699937255,1.217014685092688,0.48019327488993174,0.015959451832383415,37,20,Adam,0.0006299459674814194,0,,False,COMPLETE
107,52.35999999999999,2025-01-20 06:08:36.402507,2025-01-20 06:09:44.982550,0 days 00:01:08.580043,1.207333347033292,1.2140579360707473,0.4858462765420303,0.01786684975010775,40,8,Adam,0.000642751532364381,0,,False,COMPLETE
108,52.459999999999994,2025-01-20 06:08:36.587841,2025-01-20 06:09:54.076985,0 days 00:01:17.489144,1.2557089635501402,1.0444307598744704,0.4342120776544015,0.020903206137629755,40,8,Adam,0.0015299313535381317,0,,False,COMPLETE
109,51.99,2025-01-20 06:09:45.063925,2025-01-20 06:11:38.013885,0 days 00:01:52.949960,1.4822167860550737,1.2803925688251274,0.4043340023286033,0.012770469152772891,52,10,Adam,0.001588604135706897,0,,False,COMPLETE
110,52.73,2025-01-20 06:09:54.140619,2025-01-20 06:11:39.229681,0 days 00:01:45.089062,1.307614482656246,1.2956996114295758,0.41912907752528206,0.01283471794703641,46,4,Adam,0.000933373650646273,0,,False,COMPLETE
111,52.800000000000004,2025-01-20 06:11:38.096501,2025-01-20 06:13:14.712414,0 days 00:01:36.615913,1.3058371311998642,1.1691557233592722,0.4191855523881878,0.00905739993929015,46,4,Adam,0.0010818735668603524,0,,False,COMPLETE
112,52.690000000000005,2025-01-20 06:11:39.297647,2025-01-20 06:12:53.157882,0 days 00:01:13.860235,1.2983292701154279,1.3079814058835038,0.4165976021616039,0.010432011116367391,46,4,Adam,0.000910593656864153,0,,False,COMPLETE
113,50.6,2025-01-20 06:12:53.208093,2025-01-20 06:13:35.752420,0 days 00:00:42.544327,1.3218975634702943,1.5074593861060057,0.4178380572973624,0.010608454678668435,5,4,Adam,0.0009199643930422828,0,,False,COMPLETE
114,52.900000000000006,2025-01-20 06:13:14.800552,2025-01-20 06:14:34.271002,0 days 00:01:19.470450,1.2996059483533826,1.365530957960323,0.4268429780146297,0.008542497363592265,47,4,Adam,0.0009797791004244668,0,,False,COMPLETE
115,52.42,2025-01-20 06:13:35.810856,2025-01-20 06:14:54.851604,0 days 00:01:19.040748,1.5739156652652133,1.3741338695949166,0.49592130330617473,0.008513180752564733,46,7,Adam,0.001114743175181243,0,,False,COMPLETE
116,52.88,2025-01-20 06:14:34.342008,2025-01-20 06:15:58.153205,0 days 00:01:23.811197,1.1741037862330654,1.3400712967593764,0.4356170213414913,0.008536135943914207,46,4,Adam,0.001993496029709779,0,,False,COMPLETE
117,52.86,2025-01-20 06:14:54.903252,2025-01-20 06:16:09.233646,0 days 00:01:14.330394,1.3392702933440082,1.3056561143786616,0.44096418309090907,0.006696752316488001,46,4,Adam,0.0008216735871657348,0,,False,COMPLETE
118,52.75,2025-01-20 06:15:58.235252,2025-01-20 06:17:49.621336,0 days 00:01:51.386084,1.2965119083626513,1.3729537936820249,0.43926929942764076,0.006454669211728648,46,3,Adam,0.002351740631477883,0,,False,COMPLETE
119,52.76,2025-01-20 06:16:09.294835,2025-01-20 06:17:38.125373,0 days 00:01:28.830538,1.3565575918857002,1.3711353682211689,0.4384346593533081,0.006962204370039733,46,3,Adam,0.0021895966080299725,0,,False,COMPLETE
120,52.75,2025-01-20 06:17:38.185077,2025-01-20 06:19:15.070875,0 days 00:01:36.885798,1.3579688839770983,1.3835550190931938,0.4386111846632155,0.006885825205854456,53,3,Adam,0.001998097618621185,0,,False,COMPLETE
121,51.81,2025-01-20 06:17:49.697301,2025-01-20 06:19:40.578457,0 days 00:01:50.881156,1.356005704187038,1.4099555206143126,0.4385362429713261,0.007060161589777156,53,1,Adam,0.0020519734914023298,0,,False,COMPLETE
122,51.85999999999999,2025-01-20 06:19:15.139947,2025-01-20 06:20:49.746687,0 days 00:01:34.606740,1.3566845337742446,1.387615697439056,0.4361544475577609,0.006684981902500052,50,1,Adam,0.002039626615690048,0,,False,COMPLETE
123,52.6,2025-01-20 06:19:40.663155,2025-01-20 06:21:03.284642,0 days 00:01:22.621487,1.4978074263381533,1.4704239432812332,0.37747434338237273,0.006602491111836017,50,4,Adam,0.0019149335602506202,0,,False,COMPLETE
124,52.53,2025-01-20 06:20:49.818390,2025-01-20 06:22:20.778518,0 days 00:01:30.960128,1.408232362506916,1.4633096890937485,0.37095799162476195,0.0109270507032608,47,2,Adam,0.0012959708418845356,0,,False,COMPLETE
125,52.56999999999999,2025-01-20 06:21:03.357528,2025-01-20 06:23:09.412852,0 days 00:02:06.055324,1.2989275097898552,1.322730050856273,0.43001356006853425,0.01048830672087236,57,2,Adam,0.003081603345261087,0,,False,COMPLETE
126,53.010000000000005,2025-01-20 06:22:20.845586,2025-01-20 06:23:47.055815,0 days 00:01:26.210229,1.2947193975081457,1.3124423031844201,0.4483998750776984,0.014364757512661797,58,4,Adam,0.0025820682150776595,0,,False,COMPLETE
127,52.86,2025-01-20 06:23:09.491419,2025-01-20 06:24:57.112479,0 days 00:01:47.621060,1.298223963791334,1.3713139957362603,0.4462372304083259,0.0077282168876084125,55,4,Adam,0.0025174795482048825,0,,False,COMPLETE
128,52.82,2025-01-20 06:23:47.117640,2025-01-20 06:25:08.381615,0 days 00:01:21.263975,1.3060194975590675,1.2873412807345441,0.4449588653532173,0.014576670232211009,55,3,Adam,0.0009362004691374935,0,,False,COMPLETE
129,52.370000000000005,2025-01-20 06:24:57.199796,2025-01-20 06:27:18.312192,0 days 00:02:21.112396,1.4591456795676918,1.2776667149728758,0.3499580092762453,0.008245713445268128,55,3,Adam,0.0028081883191274875,0,,False,COMPLETE
130,52.769999999999996,2025-01-20 06:25:08.453839,2025-01-20 06:26:59.479982,0 days 00:01:51.026143,1.4462714035282938,1.6043417024935025,0.3961639318876272,0.015090898052974979,58,3,Adam,0.0028978610792856846,0,,False,COMPLETE
131,52.65,2025-01-20 06:26:59.537279,2025-01-20 06:28:19.835913,0 days 00:01:20.298634,1.7066629286575776,1.6171501227092295,0.44675163050752287,0.014968887876759755,53,3,Adam,0.0026702446778421665,0,,False,COMPLETE
132,52.78,2025-01-20 06:27:18.399469,2025-01-20 06:29:28.877661,0 days 00:02:10.478192,1.3997850751473526,1.5954292429461527,0.39738920625338847,0.014572197615081516,59,3,Adam,0.002638868376984069,0,,False,COMPLETE
133,52.54,2025-01-20 06:28:19.895197,2025-01-20 06:29:50.491223,0 days 00:01:30.596026,1.546852998109299,1.3547291678789422,0.3941111447569161,0.01894498652306775,59,4,Adam,0.0012846910457070607,0,,False,COMPLETE
134,52.559999999999995,2025-01-20 06:29:28.967963,2025-01-20 06:31:05.219777,0 days 00:01:36.251814,1.5272332958416153,1.3651885050796926,0.39927243538318585,0.02490038512685509,59,4,Adam,0.004168925400376806,0,,False,COMPLETE
135,49.730000000000004,2025-01-20 06:29:50.549084,2025-01-20 06:31:25.253414,0 days 00:01:34.704330,1.3856167681392195,1.8762434339628724,0.20217953777086045,0.022824826780794852,61,3,Adam,0.004004476599855614,0,,False,COMPLETE
136,52.72,2025-01-20 06:31:05.295493,2025-01-20 06:33:05.420978,0 days 00:02:00.125485,1.4022480653789446,1.597982281394389,0.442768668282857,0.07982607234870215,61,3,Adam,0.0018301565639176783,0,,False,COMPLETE
137,52.849999999999994,2025-01-20 06:31:25.313296,2025-01-20 06:33:11.809023,0 days 00:01:46.495727,1.4116581860004296,1.610409340759737,0.4499549788943316,0.06589419833589547,58,3,Adam,0.001883044631785642,0,,False,COMPLETE
138,50.349999999999994,2025-01-20 06:33:05.499746,2025-01-20 06:35:13.776758,0 days 00:02:08.277012,1.302829059289189,1.7401447222295627,0.47678719717968915,0.015185226673552304,55,22,Adam,0.0025102834582051998,0,,False,COMPLETE
139,52.559999999999995,2025-01-20 06:33:11.871972,2025-01-20 06:34:35.063024,0 days 00:01:23.191052,1.4547832784787003,1.53177062225468,0.4890081272776214,0.05017688717352361,55,2,Adam,0.0023446600031034035,0,,False,COMPLETE
140,50.760000000000005,2025-01-20 06:34:35.117890,2025-01-20 06:36:04.165123,0 days 00:01:29.047233,1.324394702909837,1.6848528238693266,0.4737397060860267,0.03297749394021973,63,22,Adam,0.0015894933111190394,0,,False,COMPLETE
141,51.449999999999996,2025-01-20 06:35:13.865476,2025-01-20 06:38:28.120537,0 days 00:03:14.255061,1.349088584513795,1.6238751173501507,0.4471492703154114,0.007279854078179889,57,1,Adam,0.0034441747605679705,0,,False,COMPLETE
142,51.339999999999996,2025-01-20 06:36:04.221891,2025-01-20 06:37:45.190498,0 days 00:01:40.968607,1.358172776552358,1.4238753115801135,0.4507842862202033,0.012274168245915068,57,1,Adam,0.003292214930085965,0,,False,COMPLETE
143,52.669999999999995,2025-01-20 06:37:45.256561,2025-01-20 06:39:37.195972,0 days 00:01:51.939411,1.402695146244975,1.253125018786804,0.4242244459951451,0.007278516892973532,66,3,Adam,0.0011093502830053744,0,,False,COMPLETE
144,52.26,2025-01-20 06:38:28.196537,2025-01-20 06:40:18.109436,0 days 00:01:49.912899,1.2755671039827587,1.2777554225454233,0.33156263972833017,0.014193494703649511,59,3,Adam,0.0011135002310961872,0,,False,COMPLETE
145,52.35999999999999,2025-01-20 06:39:37.255438,2025-01-20 06:41:18.125452,0 days 00:01:40.870014,1.2892559592071653,1.2854579180760184,0.32876650378757244,0.006385303628994651,59,5,Adam,0.005336117297577321,0,,False,COMPLETE
146,52.68000000000001,2025-01-20 06:40:18.188291,2025-01-20 06:41:44.881684,0 days 00:01:26.693393,1.4602054386182164,1.3980506806653765,0.37548841767724533,0.06041331026906493,58,5,Adam,0.0013728483164637104,0,,False,COMPLETE
147,52.459999999999994,2025-01-20 06:41:18.195141,2025-01-20 06:42:50.148008,0 days 00:01:31.952867,1.473472274484523,1.388864158456445,0.383241121006146,0.052479924306383714,54,2,Adam,0.0013873703707875087,0,,False,COMPLETE
148,52.54,2025-01-20 06:41:44.976509,2025-01-20 06:43:33.194583,0 days 00:01:48.218074,1.4148276984539903,1.4460855686974512,0.4286057187757851,0.011857831422755125,54,2,Adam,0.0017314348806937111,0,,False,COMPLETE
149,52.7,2025-01-20 06:42:50.205399,2025-01-20 06:44:06.350872,0 days 00:01:16.145473,1.4168131780302409,1.582680417311164,0.4248067709008212,0.01181098262078607,52,4,Adam,0.0017785661170781847,0,,False,COMPLETE
150,52.82,2025-01-20 06:43:33.286587,2025-01-20 06:44:44.896403,0 days 00:01:11.609816,1.3413090335330122,1.4944763521450264,0.3999050795418337,0.018343737127535925,48,4,Adam,0.0025340028298987006,0,,False,COMPLETE
151,52.7,2025-01-20 06:44:06.413656,2025-01-20 06:45:46.132640,0 days 00:01:39.718984,1.2538034975387875,1.2399805618552404,0.39759251593759154,0.007840386247171269,63,4,Adam,0.002547355990239956,0,,False,COMPLETE
152,49.68,2025-01-20 06:44:44.975617,2025-01-20 06:46:41.538005,0 days 00:01:56.562388,1.3296052304547339,1.497757553618319,0.8004566490798198,0.018579668693634237,48,4,Adam,0.0023694700429866032,0,,False,COMPLETE
153,52.980000000000004,2025-01-20 06:45:46.190775,2025-01-20 06:47:05.039831,0 days 00:01:18.849056,1.3272556075376485,1.6460309060964944,0.4560810033223933,0.042464437993296356,45,3,Adam,0.002188824638879913,0,,False,COMPLETE
154,52.89,2025-01-20 06:46:41.628910,2025-01-20 06:48:01.046244,0 days 00:01:19.417334,1.3835492036215646,1.660710926892303,0.4612814380534733,0.01399846751691177,45,6,Adam,0.0009554317992621609,0,,False,COMPLETE
155,52.7,2025-01-20 06:47:05.100069,2025-01-20 06:49:03.352195,0 days 00:01:58.252126,1.38096959264857,1.5738516025997107,0.4683649515104171,0.07118473113329868,43,3,Adam,0.0029068606248330697,0,,False,COMPLETE
156,52.78,2025-01-20 06:48:01.140975,2025-01-20 06:50:03.982866,0 days 00:02:02.841891,1.3806120623888853,1.6672756455240114,0.4465419994074088,0.027786350714359465,56,3,Adam,0.0030192590986846896,0,,False,COMPLETE
157,52.59,2025-01-20 06:49:03.402557,2025-01-20 06:50:29.062023,0 days 00:01:25.659466,1.3690332669972556,1.7724582959211221,0.45236992745317783,0.09442953628697219,45,2,Adam,0.0019214200280573994,0,,False,COMPLETE
158,52.580000000000005,2025-01-20 06:50:04.063542,2025-01-20 06:53:07.905851,0 days 00:03:03.842309,1.3813888728191341,1.659807166295472,0.49536870809343453,0.03578844737959257,56,5,Adam,0.003968187247294603,0,,False,COMPLETE
159,52.7,2025-01-20 06:50:29.129826,2025-01-20 06:52:06.015793,0 days 00:01:36.885967,1.4311741424023043,1.6499737849404625,0.40431508194031607,0.014101028637047814,56,5,Adam,0.004688262475676073,0,,False,COMPLETE
160,52.62,2025-01-20 06:52:06.067093,2025-01-20 06:53:28.835299,0 days 00:01:22.768206,1.6241751833228681,1.686363794289941,0.48127629008102896,0.033967403028489,47,6,Adam,0.0015334814997129645,0,,False,COMPLETE
161,52.66,2025-01-20 06:53:07.976025,2025-01-20 06:55:22.822289,0 days 00:02:14.846264,1.4991067014613808,1.5364000897512518,0.44144682278371816,0.04215527808307535,61,6,Adam,0.000743936711604031,0,,False,COMPLETE
162,52.839999999999996,2025-01-20 06:53:28.903231,2025-01-20 06:54:52.895845,0 days 00:01:23.992614,1.343448953984965,1.5470398933695273,0.4392285316897079,0.04382749744977485,51,3,Adam,0.002221530603144529,0,,False,COMPLETE
163,45.989999999999995,2025-01-20 06:54:52.965636,2025-01-20 06:56:10.350782,0 days 00:01:17.385146,1.3372989541649012,1.5516202266919512,0.4444858209638826,0.04257608449536524,48,33,Adam,0.0022423371446068487,0,,False,COMPLETE
164,52.71,2025-01-20 06:55:22.897360,2025-01-20 06:57:17.870889,0 days 00:01:54.973529,1.3281511852107937,1.6420982798854244,0.45686026757670656,0.038877154196378494,49,2,Adam,0.0031254955134833932,0,,False,COMPLETE
165,52.580000000000005,2025-01-20 06:56:10.421318,2025-01-20 06:57:46.967909,0 days 00:01:36.546591,1.2390215590548666,1.4958646252104122,0.4240728433408368,0.028402487750364736,51,2,Adam,0.0029945796952612403,0,,False,COMPLETE
166,46.97,2025-01-20 06:57:17.946924,2025-01-20 06:59:28.392050,0 days 00:02:10.445126,1.24960603790154,1.720284474790807,0.9592959006887493,0.04850572526118403,51,3,Adam,0.0012560517381679309,0,,False,COMPLETE
167,52.849999999999994,2025-01-20 06:57:47.037231,2025-01-20 06:59:11.732072,0 days 00:01:24.694841,1.2729034753108897,1.5944948610538325,0.4027660525527076,0.06168178337402651,45,3,Adam,0.0011906737199403597,0,,False,COMPLETE
168,45.129999999999995,2025-01-20 06:59:11.781392,2025-01-20 07:00:18.474867,0 days 00:01:06.693475,1.2698475401497276,1.7457885029109725,0.9047521776254017,0.06211382054334336,44,1,Adam,0.0010599466631532753,0,,False,COMPLETE
169,52.09,2025-01-20 06:59:28.468573,2025-01-20 07:00:52.471073,0 days 00:01:24.002500,1.2777536804563474,1.5882936143972246,0.35444205403545304,0.06078656654962106,45,1,Adam,0.0010549226014397322,0,,False,COMPLETE
170,52.6,2025-01-20 07:00:18.529368,2025-01-20 07:01:45.798447,0 days 00:01:27.269079,1.4367068650267705,1.805292790995074,0.35931276005286716,0.020801482708144824,45,4,Adam,0.001443805919749509,0,,False,COMPLETE
171,52.86,2025-01-20 07:00:52.562327,2025-01-20 07:02:30.675191,0 days 00:01:38.112864,1.444430047375498,1.616121470557284,0.3939086645397008,0.04512961550138647,58,4,Adam,0.0007912128940380636,1,,False,COMPLETE
172,52.78,2025-01-20 07:01:45.857356,2025-01-20 07:03:28.423388,0 days 00:01:42.566032,1.3296309030279467,1.3426296095720123,0.39445667396037626,0.06498645668030634,47,4,Adam,0.00220519497605416,0,,False,COMPLETE
173,51.190000000000005,2025-01-20 07:02:30.770764,2025-01-20 07:04:05.039375,0 days 00:01:34.268611,1.3927912915056462,1.6637810034031681,0.4021203771727352,0.07098146675587443,58,18,Adam,0.0008202899646741062,1,,False,COMPLETE
174,52.75,2025-01-20 07:03:28.494911,2025-01-20 07:07:04.411640,0 days 00:03:35.916729,1.4027350564145438,1.6611797300963829,0.3974641169938058,0.07476384474220928,57,4,Adam,0.0007659586916661759,1,,False,COMPLETE
175,52.800000000000004,2025-01-20 07:04:05.118838,2025-01-20 07:05:32.141364,0 days 00:01:27.022526,1.3053794837753228,1.6170625960672902,0.38903515021578655,0.042906476111827366,56,4,Adam,0.0008423734065955825,1,,False,COMPLETE
176,52.81,2025-01-20 07:05:32.235995,2025-01-20 07:06:53.214350,0 days 00:01:20.978355,1.3171831740391688,1.5274891715793095,0.37773864376433464,0.046942269168101104,56,4,Adam,0.0007297518985382099,1,,False,COMPLETE
177,52.68000000000001,2025-01-20 07:06:53.301732,2025-01-20 07:08:40.975207,0 days 00:01:47.673475,1.3058409940929723,1.519110304049694,0.3739398401547924,0.043393728359000065,56,5,Adam,0.0007155031543132068,1,,False,COMPLETE
178,52.559999999999995,2025-01-20 07:07:04.482684,2025-01-20 07:08:44.422947,0 days 00:01:39.940263,1.307440769066159,1.5612965188120687,0.38108539508982403,0.030382597181598976,54,5,Adam,0.0009865498319916665,1,,False,COMPLETE
179,52.92,2025-01-20 07:08:41.049029,2025-01-20 07:10:08.605814,0 days 00:01:27.556785,1.2520547959591977,1.5587114840348149,0.4217121998980181,0.04659981704171614,60,5,Adam,0.0009516734353978149,1,1.2825177148753437,True,COMPLETE
180,53.010000000000005,2025-01-20 07:08:44.496272,2025-01-20 07:10:14.332570,0 days 00:01:29.836298,1.2268813587325866,1.6174650986730772,0.40848818063152414,0.04340752206243169,60,4,Adam,0.0008578168028443194,1,2.400690257987521,True,COMPLETE
181,52.790000000000006,2025-01-20 07:10:08.675388,2025-01-20 07:11:59.806006,0 days 00:01:51.130618,1.2322338421115717,1.4818631480760973,0.4139251074481272,0.04648473187023181,60,6,Adam,0.0008503030431896329,1,,False,COMPLETE
182,53.02,2025-01-20 07:10:14.384176,2025-01-20 07:11:34.275297,0 days 00:01:19.891121,1.2541173954311051,1.6177487520062286,0.41706176863463795,0.045978874194531165,60,4,Adam,0.0009031280594540671,1,1.1731952537085215,True,COMPLETE
183,52.900000000000006,2025-01-20 07:11:34.336806,2025-01-20 07:13:04.060956,0 days 00:01:29.724150,1.2147704469642013,1.6234431837722731,0.4146285584640201,0.04615920367896162,62,5,Adam,0.0008379221523844359,1,1.5723288492513579,True,COMPLETE
184,52.87,2025-01-20 07:11:59.900311,2025-01-20 07:13:49.567546,0 days 00:01:49.667235,1.2324040680992197,1.6327852252520576,0.4207924367456075,0.056499469371900465,62,5,Adam,0.0009064517206753476,1,1.3130703365427316,True,COMPLETE
185,52.790000000000006,2025-01-20 07:13:04.121956,2025-01-20 07:14:46.647391,0 days 00:01:42.525435,1.2126384068552885,1.5693559625551912,0.4180402079102115,0.0542724327217104,66,5,Adam,0.0006669402443084211,1,1.2080978387118804,True,COMPLETE
186,52.87,2025-01-20 07:13:49.646070,2025-01-20 07:15:33.156199,0 days 00:01:43.510129,1.1706471714295774,1.5553393321920048,0.41478932164942195,0.053137392953454765,63,5,Adam,0.0006544744560324275,1,1.370666121507438,True,COMPLETE
187,52.839999999999996,2025-01-20 07:14:46.706355,2025-01-20 07:16:08.933035,0 days 00:01:22.226680,1.1579355114900554,1.537702158756894,0.4271037625263024,0.055935481173793274,62,6,Adam,0.0006513461829368237,1,1.597801847241727,True,COMPLETE
188,52.82,2025-01-20 07:15:33.253138,2025-01-20 07:17:02.832979,0 days 00:01:29.579841,1.1493692904661943,1.7162498904601657,0.46572240931500364,0.039007981289590474,63,6,Adam,0.0012518805238767201,1,1.7244920925567508,True,COMPLETE
189,52.87,2025-01-20 07:16:09.003425,2025-01-20 07:17:48.201452,0 days 00:01:39.198027,1.1620938626619806,1.7104516157271608,0.4618940522186927,0.05366894017808573,64,6,Adam,0.0012337605065203233,1,1.5476094633305886,True,COMPLETE
190,52.86,2025-01-20 07:17:02.909938,2025-01-20 07:18:53.750472,0 days 00:01:50.840534,1.104106803061451,1.6231368873149894,0.42422337982297015,0.05433288657040584,65,5,Adam,0.0005647715606996512,1,1.174348991659693,True,COMPLETE
191,52.900000000000006,2025-01-20 07:17:48.260589,2025-01-20 07:19:28.351425,0 days 00:01:40.090836,1.1567419820550147,1.6333607182334842,0.4270151159830714,0.056047660909115046,63,6,Adam,0.00122162443316691,1,1.2315733442265009,True,COMPLETE
192,53.04,2025-01-20 07:18:53.825712,2025-01-20 07:20:32.839707,0 days 00:01:39.013995,1.1035357220559694,1.631847647779079,0.4253434431106194,0.0564631581067517,65,7,Adam,0.0006123155838073593,1,1.2696699793430772,True,COMPLETE
193,52.96999999999999,2025-01-20 07:19:28.409624,2025-01-20 07:20:58.262674,0 days 00:01:29.853050,1.1284903893883733,1.6331773880824723,0.4264242647045102,0.05594792621702111,68,7,Adam,0.0009183584333681416,1,1.002281292837131,True,COMPLETE
