number,value,datetime_start,datetime_complete,duration,params_gamma_1,params_gamma_2,params_lambda,params_lr,params_n_clusters,params_n_points,params_optimizer,params_reg_lambda,params_reg_type,params_tanh_x,params_use_tanh,state
749,52.78,2025-01-20 16:08:53.396258,2025-01-20 16:11:47.929120,0 days 00:02:54.532862,1.1035735251277752,1.6182624763614022,0.3909480700747184,0.05175149773355519,71,4,SGD,0.00200935700314438,2,5.25857835695258,True,COMPLETE
750,53.169999999999995,2025-01-20 16:10:24.059864,2025-01-20 16:11:48.671037,0 days 00:01:24.611173,1.1484472354423416,1.6346765522435138,0.3984321259143982,0.054955949085176876,22,4,Adam,0.002432550669467098,2,7.030449456598764,True,COMPLETE
751,52.86,2025-01-20 16:11:48.040516,2025-01-20 16:14:46.471333,0 days 00:02:58.430817,1.1501133446328353,1.640629987772411,0.41465188748269616,0.0007003304495834016,71,3,Adam,0.0018083453778401765,2,5.205087049071224,True,COMPLETE
752,52.65,2025-01-20 16:11:48.763840,2025-01-20 16:12:39.395748,0 days 00:00:50.631908,1.1285593417554274,1.6511275747791403,0.36865917798162223,0.05952382020865232,19,4,Adam,0.003148485426556791,2,7.154328452173806,True,COMPLETE
753,52.78,2025-01-20 16:12:39.496975,2025-01-20 16:13:46.274799,0 days 00:01:06.777824,1.151084315679068,1.6438260945944727,0.3922464558197138,0.050032173858372886,25,4,Adam,0.002393697601386579,2,7.532110930684699,True,COMPLETE
754,52.690000000000005,2025-01-20 16:13:46.368779,2025-01-20 16:15:08.050125,0 days 00:01:21.681346,1.1497182748595849,1.6421801968188854,0.37478183239069157,0.028739586517955596,17,4,Adam,0.00349121214689066,2,7.024250787450673,True,COMPLETE
755,52.78,2025-01-20 16:14:46.576059,2025-01-20 16:16:10.935711,0 days 00:01:24.359652,1.1662812944923278,0.9477698654787606,0.4032074952184129,0.06653469427120759,22,4,Adam,0.002133371273510723,2,7.148421276552433,True,COMPLETE
756,52.59,2025-01-20 16:15:08.151702,2025-01-20 16:17:01.034976,0 days 00:01:52.883274,1.0861274055401664,1.6036963192049278,0.35459472995515523,0.06778888112679737,72,2,Adam,0.0025128570315408978,2,6.917113840732569,True,COMPLETE
757,52.62,2025-01-20 16:16:11.029850,2025-01-20 16:18:24.433877,0 days 00:02:13.404027,1.0735708746085695,1.6050862344504278,0.38462716323892904,0.05927085951208611,72,2,Adam,0.0016364077869600825,2,6.371785729709505,True,COMPLETE
758,52.7,2025-01-20 16:17:01.118532,2025-01-20 16:18:17.197563,0 days 00:01:16.079031,1.1224263256141005,1.6161606919531448,0.3955867140663767,0.058132898973861494,30,4,Adam,0.0015097116740354698,2,6.688300515243866,True,COMPLETE
759,52.72,2025-01-20 16:18:17.285447,2025-01-20 16:20:32.653538,0 days 00:02:15.368091,1.1761935223524567,1.9129545187680683,0.4178039342729883,0.048330328947438335,72,3,Adam,0.002160204122318728,2,3.233521689530346,True,COMPLETE
760,52.55,2025-01-20 16:18:24.543658,2025-01-20 16:20:23.026036,0 days 00:01:58.482378,1.1761009043624953,1.6669983719429176,0.4119595698012369,0.05246021154030594,12,4,Adam,0.0030680099955081954,2,7.441686051426625,True,COMPLETE
761,52.839999999999996,2025-01-20 16:20:23.100412,2025-01-20 16:22:29.093302,0 days 00:02:05.992890,1.1862901525023688,1.905573493273264,0.4222336363525671,0.07813522436286162,73,3,Adam,0.002213923998912036,2,3.245666330731616,True,COMPLETE
762,50.8,2025-01-20 16:20:32.755324,2025-01-20 16:21:27.133483,0 days 00:00:54.378159,1.1985963375040303,1.8517818659114405,0.4207728004029785,0.07736905969472789,5,4,Adam,0.001130220300785707,2,7.345702222568877,True,COMPLETE
763,52.18000000000001,2025-01-20 16:21:27.235090,2025-01-20 16:23:22.218129,0 days 00:01:54.983039,1.1261976504333364,1.567244956076934,0.39929597223997704,0.06488327832998934,73,14,Adam,0.0017712597924605632,2,3.7263888381901875,True,COMPLETE
764,52.900000000000006,2025-01-20 16:22:29.208182,2025-01-20 16:24:46.395510,0 days 00:02:17.187328,1.1205648574958333,1.5780689901438878,0.44077259148337083,0.0659243785494177,34,5,Adam,0.0018402286247521716,2,6.795238842805724,True,COMPLETE
765,52.72,2025-01-20 16:23:22.355463,2025-01-20 16:25:20.648435,0 days 00:01:58.292972,1.2049286350588944,1.6516781342347147,0.4415980385177315,0.056939119842188975,33,5,Adam,0.002870136617497966,2,6.614075704960143,True,COMPLETE
766,52.81,2025-01-20 16:24:46.516479,2025-01-20 16:27:16.126704,0 days 00:02:29.610225,1.2082191940049556,1.6526979471390588,0.3822750637078057,0.02069856083017769,75,3,Adam,0.0013216975304513132,2,6.545105922506124,True,COMPLETE
767,52.769999999999996,2025-01-20 16:25:20.753342,2025-01-20 16:27:34.582311,0 days 00:02:13.828969,1.1531726458046343,1.5449546110108274,0.40870496864253514,0.07096332493958651,75,2,Adam,0.001102709169708003,2,4.193483890837011,True,COMPLETE
768,52.87,2025-01-20 16:27:16.433266,2025-01-20 16:29:25.129713,0 days 00:02:08.696447,1.158519831993455,1.6189077703764923,0.40538314713958157,0.06944839236198434,71,3,Adam,0.0011022427148753126,2,6.392311013632673,True,COMPLETE
769,52.7,2025-01-20 16:27:34.682428,2025-01-20 16:28:51.342711,0 days 00:01:16.660283,1.0918030213157193,1.9515047070003444,0.4297446764801592,0.053797749831617926,9,4,Adam,0.0017053170517861607,2,4.641835091810787,True,COMPLETE
770,52.980000000000004,2025-01-20 16:28:51.431887,2025-01-20 16:30:45.074087,0 days 00:01:53.642200,1.216280359549209,1.6249091400720912,0.4438612775925061,0.059625093922816494,40,3,Adam,0.001043694198273172,2,6.3207877570470155,True,COMPLETE
771,48.93,2025-01-20 16:29:25.237495,2025-01-20 16:31:08.079895,0 days 00:01:42.842400,1.223536244005456,1.5844911585098547,0.8238532141722475,0.06199884702156265,42,3,Adam,0.002521808759077412,2,4.032511554796384,True,COMPLETE
772,50.11,2025-01-20 16:30:45.198799,2025-01-20 16:31:59.797804,0 days 00:01:14.599005,1.1835425540529478,0.6335237812654372,0.42009582098328646,0.0473404933207837,27,13,Adam,0.001484400473178191,2,6.046046390527187,True,COMPLETE
773,51.39,2025-01-20 16:31:08.181756,2025-01-20 16:33:16.683558,0 days 00:02:08.501802,1.1783560946045832,1.6748515605218541,0.4286556254244686,0.001518474191773233,73,20,Adam,0.001446581159475384,2,4.258638494053355,True,COMPLETE
774,53.010000000000005,2025-01-20 16:31:59.902953,2025-01-20 16:34:05.261088,0 days 00:02:05.358135,1.1312215990504473,1.6724601108884516,0.4466377375720432,0.08385580553226817,71,5,Adam,0.0013417710503871507,2,3.4858288907388806,True,COMPLETE
775,51.82,2025-01-20 16:33:16.787855,2025-01-20 16:36:17.773946,0 days 00:03:00.986091,1.1264489657794263,1.5457568966712785,0.4424532600472637,0.0861874726018501,70,18,Adam,0.001877180293659706,2,3.531421603663588,True,COMPLETE
776,52.82,2025-01-20 16:34:05.359325,2025-01-20 16:36:23.286766,0 days 00:02:17.927441,1.2145626969755807,1.5363604781952398,0.39071176424769194,0.05329125914358414,70,5,Adam,0.0023465201130622917,2,6.792542866544625,True,COMPLETE
777,52.839999999999996,2025-01-20 16:36:17.876727,2025-01-20 16:38:18.538384,0 days 00:02:00.661657,1.226597648272026,1.5849289048880961,0.39122379106870026,0.05296475654895202,74,5,Adam,0.0017524559603729285,2,6.87899413215715,True,COMPLETE
778,52.71,2025-01-20 16:36:23.378891,2025-01-20 16:37:23.356301,0 days 00:00:59.977410,0.7780556407654813,1.5896790248214225,0.4168707897966931,0.07403537285721591,21,4,Adam,0.0010280628901658247,2,5.399788129864909,True,COMPLETE
779,52.93,2025-01-20 16:37:23.452810,2025-01-20 16:39:24.942258,0 days 00:02:01.489448,1.222264969804228,1.632875983341808,0.4295499806389747,0.06259030455507653,74,2,Adam,0.0019068976136479188,2,5.199631007070767,True,COMPLETE
780,52.790000000000006,2025-01-20 16:38:18.657361,2025-01-20 16:40:33.756589,0 days 00:02:15.099228,1.0845623251479386,1.6292899366180775,0.42677822125226483,0.06479879112865507,75,2,Adam,0.0012895641655098645,2,4.389709685264728,True,COMPLETE
781,52.31,2025-01-20 16:39:25.033746,2025-01-20 16:41:01.767017,0 days 00:01:36.733271,1.0737284767650708,1.6229380319011188,0.4499336013107485,0.0165083756947398,38,12,Adam,0.0011732585265015745,2,7.5675716978934435,True,COMPLETE
782,52.480000000000004,2025-01-20 16:40:33.878056,2025-01-20 16:42:40.613964,0 days 00:02:06.735908,1.1764273329588872,1.6672386973362614,0.3417179544856155,0.07111344665231516,72,5,Adam,0.0012032846603518858,2,7.033056193815666,True,COMPLETE
783,52.44,2025-01-20 16:41:01.854706,2025-01-20 16:42:24.449842,0 days 00:01:22.595136,1.155084750330592,1.681931535037615,0.3628885684404994,0.07255692931416853,24,4,Adam,0.002754882068236631,2,7.035542873958318,True,COMPLETE
784,48.309999999999995,2025-01-20 16:42:24.537402,2025-01-20 16:44:27.089789,0 days 00:02:02.552387,1.1766916846349367,1.5364580002344481,0.8834542483344971,0.04802064648662313,72,5,Adam,0.001606886143715317,2,6.926173864741168,True,COMPLETE
785,52.92,2025-01-20 16:42:40.714955,2025-01-20 16:44:48.544615,0 days 00:02:07.829660,1.1947319119359117,1.563148009822805,0.40453235197034637,0.04675976424683367,73,5,Adam,0.003562358787472405,2,5.932871353580504,True,COMPLETE
786,52.769999999999996,2025-01-20 16:44:27.206856,2025-01-20 16:59:44.135055,0 days 00:15:16.928199,1.2314695115311367,1.5709540124236925,0.409083255423923,0.06015970219393329,73,3,SGD,0.0015974292136693993,2,5.815850546252134,True,COMPLETE
787,51.76,2025-01-20 16:44:48.668226,2025-01-20 16:47:26.303229,0 days 00:02:37.635003,1.2220520623951292,1.6068350944693333,0.44866132216922794,0.05987304927420514,70,1,Adam,0.0009748037672469257,2,6.482225567645647,True,COMPLETE
788,52.75,2025-01-20 16:47:26.421301,2025-01-20 16:49:41.191757,0 days 00:02:14.770456,1.134092706477778,1.576154288787009,0.41014848315866204,0.05684037573357407,73,3,Adam,0.0014276699095549595,2,6.667257534169518,True,COMPLETE
789,48.980000000000004,2025-01-20 16:49:41.303121,2025-01-20 16:51:40.452496,0 days 00:01:59.149375,1.223178252110721,1.6556198422891617,0.4330361056092484,0.08060184379474565,71,32,Adam,0.0022900639072387327,2,5.457660213205762,True,COMPLETE
790,53.12,2025-01-20 16:51:40.583948,2025-01-20 16:53:50.121521,0 days 00:02:09.537573,1.1584852155995944,1.604690900496587,0.4524321692527655,0.06582865879903607,75,3,Adam,0.0016337542655194303,2,4.765901292313646,True,COMPLETE
791,51.41,2025-01-20 16:53:50.246694,2025-01-20 16:58:42.098736,0 days 00:04:51.852042,1.1019080152053924,0.5205050431396331,0.4505312130854045,0.0781577476413747,75,1,SGD,0.0020701608187410152,2,4.427271438243148,True,COMPLETE
792,52.96999999999999,2025-01-20 16:58:42.213920,2025-01-20 17:00:54.210360,0 days 00:02:11.996440,1.1441825839517359,1.5266188097993534,0.44674342705940845,0.07011665859567127,75,2,Adam,0.0019259500681600642,2,4.797323120375669,True,COMPLETE
793,52.93,2025-01-20 16:59:44.249130,2025-01-20 17:02:00.874355,0 days 00:02:16.625225,1.151441113874682,1.523214213721335,0.4519186116377413,0.06842261141087842,75,2,Adam,0.0019600592560760285,2,4.661145401862023,True,COMPLETE
794,52.769999999999996,2025-01-20 17:00:54.315287,2025-01-20 17:02:08.097604,0 days 00:01:13.782317,1.1215411145034613,1.5972434287374264,0.45613351717684936,0.08884690522473822,13,4,Adam,0.004200621535132575,2,4.62019787152859,True,COMPLETE
795,53.04,2025-01-20 17:02:00.972491,2025-01-20 17:03:55.562976,0 days 00:01:54.590485,1.1247897522373183,1.6048338589352975,0.4347652335943111,0.05438698859159787,75,3,Adam,0.0013961894704090858,2,3.90090396098417,True,COMPLETE
796,53.080000000000005,2025-01-20 17:02:08.195798,2025-01-20 17:04:26.548543,0 days 00:02:18.352745,1.0472841713433132,1.5612990401724864,0.4339115351929469,0.05442265224211068,74,3,Adam,0.0016819043172097029,2,4.912063345325618,True,COMPLETE
797,52.99,2025-01-20 17:03:55.662960,2025-01-20 17:06:27.205634,0 days 00:02:31.542674,1.1592118554549893,1.5472492242727303,0.4354655367735209,0.07826613667465644,74,3,Adam,0.001651941414569959,2,5.145166884622978,True,COMPLETE
798,52.75,2025-01-20 17:04:26.652765,2025-01-20 17:06:30.829797,0 days 00:02:04.177032,1.1577289169867313,1.626820664290663,0.4564826217706357,0.07840308506116202,73,3,Adam,0.0009623573829805327,2,4.055745471121715,True,COMPLETE
799,52.83,2025-01-20 17:06:27.303771,2025-01-20 17:08:27.798160,0 days 00:02:00.494389,1.1948042499082006,1.6281713065409664,0.45759643092854063,0.06509297163634747,73,3,Adam,0.0009658558012907292,2,4.080315955041444,True,COMPLETE
800,52.2,2025-01-20 17:06:30.934227,2025-01-20 17:09:01.050479,0 days 00:02:30.116252,1.0901833326311057,1.4975605931620433,0.42152372650802794,0.06443459139967861,75,1,Adam,0.0012366241399617143,2,5.059522854395359,True,COMPLETE
801,52.76,2025-01-20 17:08:27.923678,2025-01-20 17:09:40.607551,0 days 00:01:12.683873,1.0889317142995305,1.1043187073918463,0.4185585471365054,0.06497411882027636,31,4,Adam,0.005526617361715277,2,4.27837366549,True,COMPLETE
802,52.690000000000005,2025-01-20 17:09:01.143243,2025-01-20 17:10:43.525999,0 days 00:01:42.382756,1.1956526605154174,1.5766535498832033,0.44757493906485446,0.04928054270794988,28,4,Adam,0.00264411742286726,2,3.7504194417983108,True,COMPLETE
803,52.64,2025-01-20 17:09:40.716995,2025-01-20 17:11:49.553417,0 days 00:02:08.836422,1.189988327071971,1.5782096782125128,0.44636688414221715,0.04388634543518082,73,2,Adam,0.002515942710952244,2,7.217276544339224,True,COMPLETE
804,52.22,2025-01-20 17:10:43.646436,2025-01-20 17:12:54.147014,0 days 00:02:10.500578,1.176026850070115,1.5978939983470677,0.30501695345897595,0.04326750560787886,72,2,Adam,0.0012167809733180173,2,7.211099187401604,True,COMPLETE
805,52.89,2025-01-20 17:11:49.849985,2025-01-20 17:14:04.280077,0 days 00:02:14.430092,1.2336823916075756,1.605465125117512,0.38052422489914955,0.08686093239398106,75,4,Adam,0.001277318604951295,2,6.203837730128608,True,COMPLETE
806,52.370000000000005,2025-01-20 17:12:54.278456,2025-01-20 17:14:05.838020,0 days 00:01:11.559564,1.2316969206243686,1.6525892150305717,0.4313170211436983,0.0576222600557741,7,4,Adam,0.0015636624398789477,2,8.04696812318765,True,COMPLETE
807,52.949999999999996,2025-01-20 17:14:04.366065,2025-01-20 17:15:58.725194,0 days 00:01:54.359129,1.112367701408462,1.690541136696166,0.4330101946502094,0.0577260583956884,73,3,Adam,0.0021140335863535035,2,5.401858134861189,True,COMPLETE
808,52.849999999999994,2025-01-20 17:14:05.942735,2025-01-20 17:16:31.866344,0 days 00:02:25.923609,1.1474960354643775,1.5413877990260008,0.3977114659291253,0.07181881472118022,71,3,Adam,0.0021166749007976364,2,5.465003811079222,True,COMPLETE
809,53.059999999999995,2025-01-20 17:15:58.850229,2025-01-20 17:18:08.737097,0 days 00:02:09.886868,1.158580100027756,1.8373429284447158,0.40411419406115423,0.07267167445990791,71,5,Adam,0.0015886986371611905,2,,False,COMPLETE
810,52.88,2025-01-20 17:16:31.954190,2025-01-20 17:19:32.992867,0 days 00:03:01.038677,1.1877344025420107,1.5081236472289952,0.45652237387890693,0.07317397664221222,74,5,Adam,0.0010601761738539721,2,6.106780942607572,True,COMPLETE
811,52.910000000000004,2025-01-20 17:18:08.860765,2025-01-20 17:19:53.173468,0 days 00:01:44.312703,1.1938044579909055,1.4960443326535389,0.45194899200263805,0.06102135666962537,74,5,Adam,0.0010435319223915701,2,6.7164507064462375,True,COMPLETE
812,52.980000000000004,2025-01-20 17:19:33.092911,2025-01-20 17:21:38.132214,0 days 00:02:05.039303,1.2143645302422714,1.6503394978077035,0.4205441926175691,0.05107503747279225,74,3,Adam,0.0031135960057391953,2,6.576997612722141,True,COMPLETE
813,52.7,2025-01-20 17:19:53.284763,2025-01-20 17:21:50.068170,0 days 00:01:56.783407,1.2377693349622918,0.8660297428484852,0.4179233337714775,0.0533050117742216,72,3,Adam,0.003247012662915268,2,4.493181703518316,True,COMPLETE
814,52.910000000000004,2025-01-20 17:21:38.213492,2025-01-20 17:23:54.556139,0 days 00:02:16.342647,1.0702483756975683,1.6975771634024377,0.4400964157069176,0.08689419084848761,72,4,Adam,0.0013091404664496023,2,4.339962883930285,True,COMPLETE
815,53.02,2025-01-20 17:21:50.173403,2025-01-20 17:26:27.328894,0 days 00:04:37.155491,1.0520463578350385,1.5621069257214126,0.44049432085261364,0.0017195764992334165,70,4,Adam,0.0014316376625589638,2,4.849656438981919,True,COMPLETE
816,52.71,2025-01-20 17:23:54.676321,2025-01-20 17:26:23.897418,0 days 00:02:29.221097,1.1773586037291548,1.5654854913435392,0.45893215357358325,0.06389990824286815,70,2,Adam,0.0019477010409239494,2,5.691073573381689,True,COMPLETE
817,53.14,2025-01-20 17:26:23.980378,2025-01-20 17:28:55.412525,0 days 00:02:31.432147,1.130826848646973,1.6107792948157105,0.43737015199629625,0.06828319335576095,75,5,Adam,0.0015609783072693653,2,4.783817718768043,True,COMPLETE
818,52.980000000000004,2025-01-20 17:26:27.417976,2025-01-20 17:28:47.007455,0 days 00:02:19.589479,1.127860830292706,1.6163456912833443,0.4126943881821104,0.0807333173794676,75,5,Adam,0.0009686500220422013,2,6.347235675396217,True,COMPLETE
819,53.010000000000005,2025-01-20 17:28:47.108520,2025-01-20 17:30:29.265635,0 days 00:01:42.157115,1.243569600843297,1.65196619645177,0.42652581481553326,0.06810642541016275,73,4,Adam,0.0016849590393388924,2,4.957644025998915,True,COMPLETE
820,53.18000000000001,2025-01-20 17:28:55.508843,2025-01-20 17:31:09.079775,0 days 00:02:13.570932,1.1122632726290986,1.6321079473894395,0.42984538892522783,0.06940774129458738,75,4,Adam,0.0016706932897452636,2,4.953598804587605,True,COMPLETE
821,52.839999999999996,2025-01-20 17:30:29.400733,2025-01-20 17:32:40.016646,0 days 00:02:10.615913,1.1027185666738624,1.3293771304346043,0.3980308513861806,0.07561206797847371,75,4,Adam,0.002271796655723939,2,4.786332070692149,True,COMPLETE
822,53.010000000000005,2025-01-20 17:31:09.171197,2025-01-20 17:33:03.517101,0 days 00:01:54.345904,1.1260847505589735,1.6865739324772449,0.4388388908087008,0.08202682474277305,75,5,Adam,0.002363541941566961,2,4.636822990328173,True,COMPLETE
823,53.09,2025-01-20 17:32:40.100118,2025-01-20 17:34:42.734791,0 days 00:02:02.634673,1.0417485302928666,1.6987254111333239,0.440833933971566,0.08353623236449446,75,3,Adam,0.0018653264370394375,2,4.055998742451204,True,COMPLETE
824,53.16,2025-01-20 17:33:03.626365,2025-01-20 17:36:54.550609,0 days 00:03:50.924244,1.0476234992206679,1.6537791112048352,0.4423919913240765,0.06659020404803467,75,3,SGD,0.0018537062524843762,2,4.449073869496111,True,COMPLETE
825,51.06,2025-01-20 17:34:42.842278,2025-01-20 17:36:53.904548,0 days 00:02:11.062270,1.0598752169485508,1.63229534051738,0.4181479024778103,0.06615566818487333,73,23,SGD,0.0016985508608175672,2,4.248314649509283,True,COMPLETE
826,53.04,2025-01-20 17:36:53.998249,2025-01-20 17:39:09.137993,0 days 00:02:15.139744,1.100445006297967,1.6575100496545636,0.45363839147664264,0.05878400370776089,74,5,Adam,0.001943364814037205,2,4.4704401058647765,True,COMPLETE
827,52.6,2025-01-20 17:36:54.674830,2025-01-20 17:40:51.821039,0 days 00:03:57.146209,0.9601123813081232,1.7363145716789903,0.45421012264330934,0.09054967888165584,73,2,SGD,0.001633862511121879,2,,False,COMPLETE
828,52.2,2025-01-20 17:39:09.257813,2025-01-20 17:44:00.922379,0 days 00:04:51.664566,0.9885622685128389,1.7312544578360423,0.45357475075530357,0.07327478203002255,72,1,SGD,0.0015166896048319437,2,,False,COMPLETE
829,52.65,2025-01-20 17:40:51.961123,2025-01-20 17:44:49.075207,0 days 00:03:57.114084,1.0238247040028536,1.7176907418307834,0.43834811732017365,0.0713426697287922,73,2,SGD,0.001368598291112578,2,4.538617973201403,True,COMPLETE
830,52.64,2025-01-20 17:44:01.038812,2025-01-20 17:59:58.261685,0 days 00:15:57.222873,1.0364231176344791,1.6784503080924316,0.44065361066744924,0.06883274073264656,73,2,SGD,0.0013355511061411062,2,4.668238255591209,True,COMPLETE
831,52.2,2025-01-20 17:44:49.161340,2025-01-20 17:52:43.825921,0 days 00:07:54.664581,1.0087903702438679,1.673664636988099,0.4349777733965102,0.06698907611882778,75,1,SGD,0.0015194657918307724,2,4.794820272975585,True,COMPLETE
832,52.769999999999996,2025-01-20 17:52:43.914709,2025-01-20 17:55:12.392326,0 days 00:02:28.477617,0.9302036819030621,1.6631900568461788,0.4600967242757341,0.0810325285677373,71,3,SGD,0.0017682653265205545,2,4.684648401212972,True,COMPLETE
833,52.6,2025-01-20 17:55:12.469154,2025-01-20 18:00:10.904854,0 days 00:04:58.435700,1.0553489124345377,1.690004132371349,0.4101481577241799,0.07677296878465674,73,2,SGD,0.0025631085631954323,2,4.905498227487477,True,COMPLETE
834,52.910000000000004,2025-01-20 17:59:58.338806,2025-01-20 18:16:16.861195,0 days 00:16:18.522389,1.0837357530620122,1.6332382356248787,0.41062534949519736,0.0010469862088779175,74,3,SGD,0.002513427842794287,2,4.393858962910452,True,COMPLETE
835,52.980000000000004,2025-01-20 18:00:11.225512,2025-01-20 18:06:17.616456,0 days 00:06:06.390944,1.0629684177261889,1.642672210574078,0.425144911343467,0.05987071667713467,75,3,SGD,0.0019511308703162784,2,4.3943675165097265,True,COMPLETE
836,52.73,2025-01-20 18:06:17.741105,2025-01-20 18:08:42.802642,0 days 00:02:25.061537,1.0912089499085913,1.6155205327010347,0.38518248277878564,0.08919185128270425,71,4,SGD,0.0014717495456905247,2,4.503620724549866,True,COMPLETE
837,53.05,2025-01-20 18:08:42.901631,2025-01-20 18:17:00.329472,0 days 00:08:17.427841,1.1210655983753322,1.6340679935056364,0.46033535964989447,0.01000230130594226,74,3,SGD,0.002156962696374795,2,4.251686610055251,True,COMPLETE
838,45.910000000000004,2025-01-20 18:16:16.972534,2025-01-20 18:17:15.481424,0 days 00:00:58.508890,1.0251217102126065,1.7192218431372066,0.9341372614539479,0.0648526419551413,15,4,SGD,0.0017777342643079054,2,3.9026959486333483,True,COMPLETE
839,53.09,2025-01-20 18:17:00.438051,2025-01-20 18:18:58.549735,0 days 00:01:58.111684,1.007581456858944,1.5959935851160911,0.4463647260813556,0.06627171115736427,52,4,SGD,0.0011579139484087417,2,5.210892886305992,True,COMPLETE
840,52.949999999999996,2025-01-20 18:17:15.579985,2025-01-20 18:19:19.153791,0 days 00:02:03.573806,1.075623564887856,1.5994616279537508,0.4449203879156086,0.05583459947567983,72,5,SGD,0.0012200212268764813,2,5.030858518171258,True,COMPLETE
841,53.04,2025-01-20 18:18:58.653663,2025-01-20 18:21:26.615912,0 days 00:02:27.962249,1.07857136188723,1.671224266292123,0.4284526707474348,0.054919420225834556,72,5,Adam,0.001280624720156737,2,4.7232722162710665,True,COMPLETE
