number,value,datetime_start,datetime_complete,duration,params_gamma_1,params_gamma_2,params_lambda,params_lr,params_n_clusters,params_n_points,params_optimizer,params_reg_lambda,params_reg_type,params_tanh_x,params_use_tanh,state
1140,52.78,2025-01-21 07:14:23.767386,2025-01-21 07:17:43.630089,0 days 00:03:19.862703,0.9914904272906313,1.4512124770716783,0.39342155492036224,0.02565634902761528,15,4,SGD,0.018962878038594585,2,,False,COMPLETE
1141,52.800000000000004,2025-01-21 07:14:46.738994,2025-01-21 07:31:13.044871,0 days 00:16:26.305877,1.0032176341050618,1.4527871931517309,0.39730994778289325,0.029599806706218156,15,4,SGD,0.008091569922312627,0,,False,COMPLETE
1142,53.0,2025-01-21 07:17:43.748763,2025-01-21 07:21:14.369510,0 days 00:03:30.620747,0.9203386492660746,1.417770514693998,0.4131558456904839,0.02699357323372486,17,4,SGD,0.0007939305164231569,0,,False,COMPLETE
1143,52.66,2025-01-21 07:21:14.472643,2025-01-21 07:26:20.684940,0 days 00:05:06.212297,0.9534745747638597,1.3813751892753032,0.4617029528257228,0.029308869615275096,54,2,SGD,0.0012301240220866396,2,,False,COMPLETE
1144,53.190000000000005,2025-01-21 07:26:20.798799,2025-01-21 07:30:23.423397,0 days 00:04:02.624598,1.011918202405633,1.4562384418447134,0.43386852875446,0.009258133303254422,17,4,SGD,0.01135539840549532,2,,False,COMPLETE
1145,52.87,2025-01-21 07:30:23.552576,2025-01-21 07:34:21.924662,0 days 00:03:58.372086,1.0071295634583435,1.4314833782911505,0.40828783295331345,0.010148260287841885,15,4,SGD,0.006924799588423979,2,,False,COMPLETE
1146,53.18000000000001,2025-01-21 07:31:13.176261,2025-01-21 07:35:17.174611,0 days 00:04:03.998350,1.0225235572744746,1.4104616125532556,0.4288283668654123,0.008280308432138617,17,4,SGD,0.016220623312038187,2,,False,COMPLETE
1147,53.2,2025-01-21 07:34:22.047786,2025-01-21 07:37:42.110987,0 days 00:03:20.063201,1.0253993917942623,1.3984934389258676,0.42995937962553255,0.014779841299522827,18,4,SGD,0.010673933690719194,2,,False,COMPLETE
1148,52.62,2025-01-21 07:35:17.288981,2025-01-21 07:40:31.218535,0 days 00:05:13.929554,1.0248288361123825,1.4103968168914784,0.3887678926383309,0.008951941614348122,13,4,SGD,0.013684586016883871,2,,False,COMPLETE
1149,52.54,2025-01-21 07:37:42.234527,2025-01-21 07:54:27.263775,0 days 00:16:45.029248,1.0278014338147095,1.4052953852222232,0.3897272658196879,0.020140927902547727,12,4,SGD,0.014223785903380906,2,,False,COMPLETE
1150,52.96999999999999,2025-01-21 07:40:31.331475,2025-01-21 07:44:04.853738,0 days 00:03:33.522263,1.0411662043514256,1.4072042729051502,0.41777209138387505,0.0139115985760309,17,4,SGD,0.00921376070465637,2,,False,COMPLETE
1151,52.800000000000004,2025-01-21 07:44:04.942368,2025-01-21 07:48:20.293562,0 days 00:04:15.351194,1.0634801458408865,1.4106861150985295,0.3974619136912405,0.011348680380273531,17,4,SGD,0.014703205656242144,2,,False,COMPLETE
1152,53.03,2025-01-21 07:48:20.388816,2025-01-21 07:55:17.072912,0 days 00:06:56.684096,1.0148751621615226,1.4485976334390656,0.41751786993512047,0.006816705153792372,16,4,SGD,0.013316001755218574,2,,False,COMPLETE
1153,52.629999999999995,2025-01-21 07:54:27.371313,2025-01-21 08:01:50.380917,0 days 00:07:23.009604,0.9698619351118496,1.4578463474131993,0.37480680220752377,0.006829004191048,15,4,SGD,0.011212286206615128,2,,False,COMPLETE
1154,52.65,2025-01-21 07:55:17.176957,2025-01-21 08:00:21.112091,0 days 00:05:03.935134,0.958913646322842,1.3809308340412763,0.42712952835143586,0.007346918929095799,8,4,SGD,0.017466911965362302,2,,False,COMPLETE
1155,52.65,2025-01-21 08:00:21.239004,2025-01-21 08:08:27.095116,0 days 00:08:05.856112,1.0675024250549892,1.4660591980783468,0.37884978836155225,0.00810442123567632,19,5,SGD,0.010886034636278082,2,,False,COMPLETE
1156,53.12,2025-01-21 08:01:50.513087,2025-01-21 08:05:21.797692,0 days 00:03:31.284605,1.067677293934154,1.4342712929032009,0.41045140098368277,0.01581838075010873,18,4,SGD,0.011505138365949505,2,,False,COMPLETE
1157,46.56,2025-01-21 08:05:21.903246,2025-01-21 08:21:46.114264,0 days 00:16:24.211018,1.0017755001962225,1.473927524053847,0.4276404458794568,0.007975425266753579,19,16,SGD,0.021805577076118434,2,,False,COMPLETE
1158,53.15,2025-01-21 08:08:27.217515,2025-01-21 08:12:31.672562,0 days 00:04:04.455047,1.0010725681998196,1.3742970665647787,0.4318222704098095,0.008783759102845371,17,4,SGD,0.015692522635073165,2,,False,COMPLETE
1159,52.959999999999994,2025-01-21 08:12:31.799730,2025-01-21 08:16:29.250761,0 days 00:03:57.451031,1.0105068413091176,1.376869086865273,0.42522022618673444,0.010019160784512836,14,4,SGD,0.00874412689513647,2,,False,COMPLETE
1160,48.59,2025-01-21 08:16:29.352603,2025-01-21 08:33:22.161583,0 days 00:16:52.808980,1.038650592333239,1.4121824090592414,0.39795423368461935,0.009579762019468762,20,14,SGD,0.011318269661658551,2,,False,COMPLETE
1161,52.93,2025-01-21 08:21:46.244613,2025-01-21 08:27:09.794085,0 days 00:05:23.549472,1.0464303037257054,1.4144410006773098,0.40548911804738014,0.00832622737144791,16,4,SGD,0.010738012378729015,2,,False,COMPLETE
1162,51.72,2025-01-21 08:27:09.913849,2025-01-21 08:30:45.821383,0 days 00:03:35.907534,0.9473891658400575,1.3655743261401059,0.44841572376083744,0.0058504380351463055,20,10,SGD,0.011498149050545277,2,,False,COMPLETE
1163,53.13,2025-01-21 08:30:45.943481,2025-01-21 08:34:47.961043,0 days 00:04:02.017562,1.0364942179013537,1.42581059956739,0.405692217040678,0.012108162883113182,18,4,SGD,0.012654556375201225,2,,False,COMPLETE
1164,50.44,2025-01-21 08:33:22.271285,2025-01-21 08:42:40.298062,0 days 00:09:18.026777,0.9777873493290541,1.428906891627369,0.24472646217291405,0.013524932577429772,18,5,SGD,0.008470301332047275,2,,False,COMPLETE
1165,52.89,2025-01-21 08:34:48.071565,2025-01-21 08:51:23.981833,0 days 00:16:35.910268,0.9767621826347317,1.4786534746755002,0.4418386306660048,0.014025290259160068,16,4,SGD,0.017771847536760397,2,,False,COMPLETE
1166,53.02,2025-01-21 08:42:40.430550,2025-01-21 08:59:17.908263,0 days 00:16:37.477713,1.0776103731024067,1.479371823720718,0.44471431990214594,0.00739102175974818,16,4,SGD,0.017580886095978545,2,,False,COMPLETE
1167,52.54,2025-01-21 08:51:24.100273,2025-01-21 08:56:36.465433,0 days 00:05:12.365160,1.0527500089873834,1.3615579604131098,0.35944703555771074,0.01140918197760814,17,4,SGD,0.021222745013766937,2,,False,COMPLETE
1168,52.78,2025-01-21 08:56:36.567711,2025-01-21 09:03:16.456624,0 days 00:06:39.888913,0.93081248684402,1.3828775437079406,0.4186586185509402,0.006739059950177893,13,4,SGD,0.009107408454767393,2,,False,COMPLETE
1169,52.93,2025-01-21 08:59:18.013671,2025-01-21 09:04:26.236344,0 days 00:05:08.222673,0.932779861201352,1.3902217113408697,0.416497468395408,0.009564870121697969,14,4,SGD,0.006237709661561291,2,,False,COMPLETE
1170,53.1,2025-01-21 09:03:16.567894,2025-01-21 09:06:43.536848,0 days 00:03:26.968954,1.0831582796411878,1.448057241567176,0.42841104130824337,0.009329741768369084,22,5,SGD,0.015415058590241532,2,,False,COMPLETE
1171,53.04,2025-01-21 09:04:26.347072,2025-01-21 09:21:05.393739,0 days 00:16:39.046667,1.0816176266185777,1.3541634803285632,0.4315690697326179,0.013990658041770701,22,5,SGD,0.007244617361042991,2,,False,COMPLETE
1172,53.05,2025-01-21 09:06:43.641537,2025-01-21 09:10:09.044461,0 days 00:03:25.402924,1.0152361037188944,1.3638892504552678,0.46914385854721363,0.008224452696667831,20,5,SGD,0.010834905111720819,2,,False,COMPLETE
1173,52.87,2025-01-21 09:10:09.153260,2025-01-21 09:13:38.190312,0 days 00:03:29.037052,0.8940872489017192,1.4424738141940225,0.4604654753024068,0.01852669917514187,18,4,SGD,0.00964887770999353,2,,False,COMPLETE
1174,52.82,2025-01-21 09:13:38.287290,2025-01-21 09:30:06.471983,0 days 00:16:28.184693,1.015050155741949,1.3451735058523375,0.43814636766624887,0.014987081273111625,11,4,SGD,0.013437244488137438,0,,False,COMPLETE
1175,52.87,2025-01-21 09:21:05.510995,2025-01-21 09:25:02.384521,0 days 00:03:56.873526,0.9798912004979408,1.393588015958008,0.3980539363198876,0.008595893621857947,19,5,SGD,0.008127360638035156,0,,False,COMPLETE
1176,52.99,2025-01-21 09:25:02.496680,2025-01-21 09:28:29.683180,0 days 00:03:27.186500,1.0150190540023634,1.4922543374471178,0.4560689363738585,0.010963541551469379,15,4,SGD,0.013895338087373612,2,,False,COMPLETE
1177,52.88,2025-01-21 09:28:29.805679,2025-01-21 09:33:41.087180,0 days 00:05:11.281501,0.9796565805900406,1.4466727502935088,0.38436870870823137,0.010608034270428354,17,4,SGD,0.019865994216930184,2,,False,COMPLETE
1178,52.900000000000006,2025-01-21 09:30:06.592106,2025-01-21 09:38:07.896718,0 days 00:08:01.304612,0.9592499097176216,1.4335851600766942,0.3835231848549379,0.012389378252278163,17,4,SGD,0.01377210564716742,2,,False,COMPLETE
1179,53.02,2025-01-21 09:33:41.196483,2025-01-21 09:37:09.085667,0 days 00:03:27.889184,1.058362627118605,1.4013565660203102,0.40983156789654557,0.012420636604885262,20,5,SGD,0.00950572080554615,2,,False,COMPLETE
1180,52.92,2025-01-21 09:37:09.195719,2025-01-21 09:42:18.180279,0 days 00:05:08.984560,0.9572268982931053,1.4855055028315645,0.45146448153046587,0.007394153825852703,18,4,SGD,0.01555046144369479,2,,False,COMPLETE
1181,53.059999999999995,2025-01-21 09:38:08.018407,2025-01-21 09:43:00.099699,0 days 00:04:52.081292,1.0351792468073389,1.4814017191014954,0.4479661494560641,0.010492819367292346,19,3,SGD,0.011350666040106715,2,,False,COMPLETE
1182,52.92,2025-01-21 09:42:18.299630,2025-01-21 09:58:53.518234,0 days 00:16:35.218604,1.0373064288978264,1.3367777422959335,0.4205369971279057,0.006394191279116319,21,3,SGD,0.011726016448479976,2,,False,COMPLETE
1183,52.470000000000006,2025-01-21 09:43:00.217346,2025-01-21 09:51:14.599751,0 days 00:08:14.382405,1.0962323023100269,1.354648455416954,0.4193561173085046,0.015536567301348485,38,2,SGD,0.016760922644327922,2,,False,COMPLETE
1184,53.059999999999995,2025-01-21 09:51:14.721341,2025-01-21 09:56:41.326214,0 days 00:05:26.604873,1.0020143215170056,1.3974505429334325,0.43104625628099535,0.006326498686769049,21,5,SGD,0.011906189065574701,2,,False,COMPLETE
1185,47.5,2025-01-21 09:56:41.456095,2025-01-21 09:58:36.929742,0 days 00:01:55.473647,1.0710611018043108,1.3487949990386368,0.4059761275537212,0.008010742118191801,32,22,SGD,0.00814799639866784,2,,False,COMPLETE
1186,52.72,2025-01-21 09:58:37.039530,2025-01-21 10:01:05.753112,0 days 00:02:28.713582,0.8986724486272033,1.3230531330605628,0.4734714384653897,0.018804600441855796,16,4,SGD,0.02249468368210048,2,,False,COMPLETE
1187,52.910000000000004,2025-01-21 09:58:53.639725,2025-01-21 10:01:17.919477,0 days 00:02:24.279752,0.9220734062074578,1.4242804628919228,0.43604062775099167,0.02362381950209245,15,4,SGD,0.009409486221155939,2,,False,COMPLETE
1188,52.980000000000004,2025-01-21 10:01:05.855593,2025-01-21 10:03:31.318204,0 days 00:02:25.462611,0.9901725826262571,0.9926488414712025,0.4349974487368509,0.023093003786519257,15,4,SGD,0.009997362925681295,2,,False,COMPLETE
1189,53.059999999999995,2025-01-21 10:01:18.024600,2025-01-21 10:08:01.023710,0 days 00:06:42.999110,1.10893262211517,1.4542149967267097,0.4004169970291461,0.004977495217287927,18,4,SGD,0.014828699594461925,0,,False,COMPLETE
1190,52.68000000000001,2025-01-21 10:03:31.445945,2025-01-21 10:10:12.103453,0 days 00:06:40.657508,0.7487657902814612,1.3800112693671438,0.4008555261695304,0.011383061936965998,18,5,SGD,0.012862099919725305,2,,False,COMPLETE
1191,52.89,2025-01-21 10:08:01.135334,2025-01-21 10:25:10.647608,0 days 00:17:09.512274,1.0717702753812646,1.3728471631301118,0.45737705486110675,0.025180350693294714,19,5,SGD,0.017929942015243124,2,,False,COMPLETE
1192,52.99,2025-01-21 10:10:12.219470,2025-01-21 10:27:00.608751,0 days 00:16:48.389281,1.068314929010935,1.405636981846621,0.4587666432516618,0.00720360176381103,19,3,SGD,0.005927709302596384,2,,False,COMPLETE
1193,52.769999999999996,2025-01-21 10:25:10.778652,2025-01-21 10:31:38.745411,0 days 00:06:27.966759,1.0100862766294298,1.4102024471206307,0.36847846654644545,0.008141258571956383,17,4,SGD,0.016068275242657346,2,,False,COMPLETE
1194,46.42,2025-01-21 10:27:00.702312,2025-01-21 10:28:14.143772,0 days 00:01:13.441460,0.5337340295785525,1.5019430006896755,0.7805368597186677,0.03449483806654748,17,4,SGD,0.018833996030656986,2,,False,COMPLETE
1195,52.61,2025-01-21 10:28:14.256026,2025-01-21 10:34:45.523260,0 days 00:06:31.267234,1.0275249878660029,1.4547513794187863,0.36907930914787546,0.008641243447679909,14,4,SGD,0.009610393543894756,2,,False,COMPLETE
1196,52.949999999999996,2025-01-21 10:31:38.846676,2025-01-21 10:38:45.315126,0 days 00:07:06.468450,0.9430836057160423,1.4597855205162897,0.41311369458730096,0.010009106713997793,20,3,SGD,0.012771096463285943,2,,False,COMPLETE
1197,49.919999999999995,2025-01-21 10:34:45.646003,2025-01-21 10:36:27.490217,0 days 00:01:41.844214,0.9812055165042088,1.326939329722773,0.7198370467444161,0.02641673431928205,20,3,SGD,0.016542381996876146,0,,False,COMPLETE
1198,47.699999999999996,2025-01-21 10:36:27.609276,2025-01-21 10:38:26.587469,0 days 00:01:58.978193,0.9405712308079428,1.3077029790557406,0.8558825209482124,0.009895940802760825,23,3,SGD,0.02292624437391265,2,,False,COMPLETE
1199,48.730000000000004,2025-01-21 10:38:26.693493,2025-01-21 10:41:01.528422,0 days 00:02:34.834929,1.0354084808906288,1.4903525145092973,0.4188732548225187,0.016630922290723046,57,30,SGD,0.028044673343186798,2,,False,COMPLETE
1200,53.04,2025-01-21 10:38:45.412339,2025-01-21 10:42:30.757634,0 days 00:03:45.345295,1.0421535916548081,1.4950684269110126,0.42607626673863913,0.008940307712680298,16,4,SGD,0.005239997344993895,2,,False,COMPLETE
1201,53.080000000000005,2025-01-21 10:41:01.659600,2025-01-21 10:57:16.424734,0 days 00:16:14.765134,1.098228002258435,1.3762060406254084,0.44153204583786426,0.03316095772257914,16,4,SGD,0.0138139080593442,2,,False,COMPLETE
1202,53.14,2025-01-21 10:42:30.900215,2025-01-21 10:44:03.077665,0 days 00:01:32.177450,1.0981856602898874,1.4285715067322138,0.44634103858896623,0.03409775852628862,17,4,SGD,0.021181115599265717,2,,False,COMPLETE
1203,52.59,2025-01-21 10:44:03.192133,2025-01-21 10:45:47.631414,0 days 00:01:44.439281,0.9746302358279053,1.3714078092125739,0.4735582504670678,0.03236433816050907,13,4,SGD,0.011467288287366414,2,,False,COMPLETE
1204,53.059999999999995,2025-01-21 10:45:47.734519,2025-01-21 10:49:23.764327,0 days 00:03:36.029808,1.0010100016384058,1.3978345525637466,0.4410504008442394,0.01567095929315887,21,5,SGD,0.011228757346637048,2,,False,COMPLETE
1205,52.790000000000006,2025-01-21 10:49:23.851506,2025-01-21 10:51:49.553458,0 days 00:02:25.701952,1.0670887084999774,1.3200492555688992,0.39674976377412857,0.027331021265952136,16,4,SGD,0.007039864643287456,0,,False,COMPLETE
1206,52.93,2025-01-21 10:51:49.672662,2025-01-21 10:54:05.865064,0 days 00:02:16.192402,0.8300642771924852,1.3625229256062068,0.42722751387397967,0.03579927014822189,18,4,SGD,0.013234397179615451,2,,False,COMPLETE
1207,53.059999999999995,2025-01-21 10:54:05.973851,2025-01-21 11:10:56.197094,0 days 00:16:50.223243,1.1124836904017281,1.4259366556115642,0.4430894938315617,0.007619903450936351,15,4,SGD,0.009591020035132174,2,,False,COMPLETE
1208,52.910000000000004,2025-01-21 10:57:16.542626,2025-01-21 11:01:26.939107,0 days 00:04:10.396481,0.9946917184175005,1.4292233029873023,0.4121316045950885,0.007808589581309354,19,5,SGD,0.010534785538364153,2,,False,COMPLETE
1209,53.059999999999995,2025-01-21 11:01:27.034975,2025-01-21 11:08:13.428343,0 days 00:06:46.393368,1.1101019945185444,1.4726853309720171,0.45793842882178887,0.003971858844866448,14,4,SGD,0.014725441184698602,2,,False,COMPLETE
1210,52.839999999999996,2025-01-21 11:08:13.509759,2025-01-21 11:24:47.696471,0 days 00:16:34.186712,1.0327650182059822,1.4474406175869243,0.38988714918418327,0.009053119376606683,22,3,SGD,0.007665583613897352,2,,False,COMPLETE
1211,48.72,2025-01-21 11:10:56.298116,2025-01-21 11:14:01.166077,0 days 00:03:04.867961,1.032718512557621,1.3429422678222613,0.42530367533170876,0.03731295006639111,3,3,SGD,0.005731422459276584,2,,False,COMPLETE
1212,52.61,2025-01-21 11:14:01.269007,2025-01-21 11:16:30.897726,0 days 00:02:29.628719,0.9557004022796283,1.2939755192220435,0.39212301807103367,0.028689361159896624,25,5,SGD,0.017426649022590734,2,,False,COMPLETE
1213,52.93,2025-01-21 11:16:30.989641,2025-01-21 11:20:13.241575,0 days 00:03:42.251934,1.0650457788640082,1.3930709746462455,0.4118255428368245,0.023811054711630367,22,3,SGD,0.008641573956740372,0,,False,COMPLETE
1214,52.81,2025-01-21 11:20:13.364502,2025-01-21 11:24:29.776330,0 days 00:04:16.411828,0.8930057133396715,1.4487352194204441,0.47556249580434773,0.008940936094000197,18,5,SGD,0.011954392223309084,2,,False,COMPLETE
1215,53.0,2025-01-21 11:24:29.977313,2025-01-21 11:40:51.942464,0 days 00:16:21.965151,1.0175811739661733,1.498183165005751,0.43007959552033403,0.031866681001805224,20,5,SGD,0.009549080016945153,2,,False,COMPLETE
1216,43.94,2025-01-21 11:24:47.822346,2025-01-21 11:27:57.173553,0 days 00:03:09.351207,0.985170834906073,1.340068881728022,0.4313874845512116,0.019521031424678835,40,39,SGD,0.01393667540274545,2,,False,COMPLETE
1217,51.970000000000006,2025-01-21 11:27:57.265371,2025-01-21 11:31:03.556789,0 days 00:03:06.291418,0.9299900794403122,1.4035472537947065,0.3127203869168936,0.03133889055751407,20,5,SGD,0.01952363260760835,2,,False,COMPLETE
1218,53.1,2025-01-21 11:31:03.650445,2025-01-21 11:32:37.831959,0 days 00:01:34.181514,1.0128577614377172,1.4915888118108087,0.4548786333077828,0.0368966036114894,17,4,SGD,0.015848963604057433,2,,False,COMPLETE
1219,53.059999999999995,2025-01-21 11:32:37.938850,2025-01-21 11:36:51.491260,0 days 00:04:13.552410,1.0619471554605713,1.3650722049879138,0.4144975293343034,0.013235181702175157,19,3,SGD,0.010191192572735515,2,,False,COMPLETE
1220,53.15,2025-01-21 11:36:51.599568,2025-01-21 11:39:56.319896,0 days 00:03:04.720328,0.966251394522393,1.2999821672344543,0.43719897970408483,0.03923694834288621,18,4,SGD,0.0009676672859765751,0,,False,COMPLETE
1221,52.86,2025-01-21 11:39:56.432244,2025-01-21 11:55:59.931997,0 days 00:16:03.499753,0.9962073818957231,1.4088494044126214,0.40589929884424625,0.026161660200826442,15,4,SGD,0.001111776717981902,2,,False,COMPLETE
1222,52.800000000000004,2025-01-21 11:40:52.040224,2025-01-21 11:43:15.119820,0 days 00:02:23.079596,1.1171870045458248,1.3225493778714799,0.40319374460953167,0.025776238163649597,15,4,SGD,0.013739651836402435,2,,False,COMPLETE
1223,53.09,2025-01-21 11:43:15.219420,2025-01-21 11:44:47.332711,0 days 00:01:32.113291,1.068323945472865,1.4040831126462898,0.4637814884789433,0.04198228433776773,17,4,SGD,0.012396821228220695,2,,False,COMPLETE
1224,52.96999999999999,2025-01-21 11:44:47.438213,2025-01-21 11:48:39.444071,0 days 00:03:52.005858,0.9138949215861049,1.4313086951646987,0.44539102006014203,0.027871341585414662,21,3,SGD,0.0011433758045675739,2,,False,COMPLETE
1225,53.010000000000005,2025-01-21 11:48:39.545988,2025-01-21 11:51:03.695332,0 days 00:02:24.149344,0.9933708268216586,1.3668324044292768,0.418745078283794,0.03168716102890866,16,4,SGD,0.0009341958407455366,2,,False,COMPLETE
1226,52.73,2025-01-21 11:51:03.809265,2025-01-21 11:53:22.285277,0 days 00:02:18.476012,0.9482328417417075,1.5114061202070739,0.37959097803401404,0.03660616573259329,19,5,SGD,0.025117094047219794,2,,False,COMPLETE
1227,49.49,2025-01-21 11:53:22.384310,2025-01-21 11:55:25.666443,0 days 00:02:03.282133,1.0406056275754458,1.4636325334976494,0.407288990721526,0.04067205587790728,35,19,SGD,0.0010914917981361425,2,,False,COMPLETE
1228,51.41,2025-01-21 11:55:25.786481,2025-01-21 12:11:47.889617,0 days 00:16:22.103136,1.1032608903224317,0.2102434472574639,0.45177146724102635,0.006067565812931733,13,4,SGD,0.27422939811970115,0,,False,COMPLETE
1229,52.73,2025-01-21 11:56:00.053982,2025-01-21 11:58:17.510528,0 days 00:02:17.456546,1.0889891341428628,1.3353501693848702,0.4544387211315928,0.017461911272801896,10,4,SGD,0.006905899209017276,0,,False,COMPLETE
1230,53.09,2025-01-21 11:58:17.635797,2025-01-21 12:00:45.376531,0 days 00:02:27.740734,0.9681828037282306,1.377403419936161,0.42692662916031854,0.0340362921095297,23,5,SGD,0.0009689973578261786,2,,False,COMPLETE
1231,52.839999999999996,2025-01-21 12:00:45.488165,2025-01-21 12:05:48.880309,0 days 00:05:03.392144,1.1105237345001653,1.2967041148837852,0.44077406753101045,0.005729303869765985,13,4,SGD,0.001285484990974836,2,,False,COMPLETE
1232,52.629999999999995,2025-01-21 12:05:49.001029,2025-01-21 12:09:18.394598,0 days 00:03:29.393569,1.0400130748646956,1.4340900001302281,0.35101042325370474,0.028491963311544424,18,4,SGD,0.01955547060625109,2,,False,COMPLETE
1233,52.75,2025-01-21 12:09:18.532517,2025-01-21 12:25:41.960735,0 days 00:16:23.428218,0.8562029071521164,1.467195951474174,0.4635634725484429,0.03970566786143233,17,4,SGD,0.004433178018240859,2,,False,COMPLETE
1234,52.980000000000004,2025-01-21 12:11:48.007612,2025-01-21 12:15:16.964072,0 days 00:03:28.956460,1.0114418339930524,1.4665781171349723,0.4754436244542584,0.011948842467766538,17,4,SGD,0.0008445612712942009,2,,False,COMPLETE
1235,53.0,2025-01-21 12:15:17.061226,2025-01-21 12:19:26.333171,0 days 00:04:09.271945,0.857264668192948,1.3449132521624432,0.42143099354910335,0.038019196588111585,19,3,SGD,0.03167933017674594,2,,False,COMPLETE
1236,52.76,2025-01-21 12:19:26.443980,2025-01-21 12:23:05.115454,0 days 00:03:38.671474,1.0695490162257937,1.5063281391529544,0.38122712484093796,0.023089420378672943,21,3,SGD,0.0012888095917501425,2,,False,COMPLETE
1237,52.980000000000004,2025-01-21 12:23:05.220501,2025-01-21 12:25:29.524210,0 days 00:02:24.303709,0.9318239402953655,1.38325911292097,0.4340508325650471,0.03058241927599943,26,5,SGD,0.04667066433890428,2,,False,COMPLETE
1238,52.86,2025-01-21 12:25:29.628620,2025-01-21 12:41:57.363000,0 days 00:16:27.734380,0.9681116840609763,1.2685317970298073,0.3940404857580487,0.0030591425187741312,16,4,SGD,0.008477326132535276,2,,False,COMPLETE
